2025-05-07 13:05:10.8246Z [I 2025-05-07 16:05:10,824] Trial 0 finished with value: 21.336493178639017 and parameters: {'n_layers': 5, 'n_units_0': 27, 'n_units_1': 30, 'n_units_2': 58, 'n_units_3': 88, 'n_units_4': 51, 'activation': 'logistic', 'learning_rate': 0.006899496709058473, 'batch_size': 256, 'optimizer': 'LBFGS', 'max_epochs': 182}. Best is trial 0 with value: 21.336493178639017.
2025-05-07 13:17:57.9372Z [I 2025-05-07 16:17:57,936] Trial 1 finished with value: 97.02359067998617 and parameters: {'n_layers': 7, 'n_units_0': 93, 'n_units_1': 68, 'n_units_2': 59, 'n_units_3': 14, 'n_units_4': 3, 'n_units_5': 16, 'n_units_6': 33, 'activation': 'tanh', 'learning_rate': 8.476421968357209e-05, 'batch_size': 64, 'optimizer': 'RMSprop', 'max_epochs': 117}. Best is trial 0 with value: 21.336493178639017.
2025-05-07 13:19:14.4463Z [I 2025-05-07 16:19:14,446] Trial 2 finished with value: 35.39585881553183 and parameters: {'n_layers': 2, 'n_units_0': 16, 'n_units_1': 5, 'activation': 'logistic', 'learning_rate': 0.0275665459836988, 'batch_size': 256, 'optimizer': 'SGD', 'max_epochs': 339}. Best is trial 0 with value: 21.336493178639017.
2025-05-07 13:32:10.7186Z [I 2025-05-07 16:32:10,718] Trial 3 finished with value: 97.77218618106583 and parameters: {'n_layers': 13, 'n_units_0': 61, 'n_units_1': 88, 'n_units_2': 22, 'n_units_3': 86, 'n_units_4': 27, 'n_units_5': 26, 'n_units_6': 43, 'n_units_7': 97, 'n_units_8': 8, 'n_units_9': 67, 'n_units_10': 24, 'n_units_11': 61, 'n_units_12': 99, 'activation': 'tanh', 'learning_rate': 0.014498196564046184, 'batch_size': 16, 'optimizer': 'Adam', 'max_epochs': 232}. Best is trial 0 with value: 21.336493178639017.
2025-05-07 13:57:42.5452Z [I 2025-05-07 16:57:42,544] Trial 4 finished with value: 14.12889167040304 and parameters: {'n_layers': 5, 'n_units_0': 22, 'n_units_1': 82, 'n_units_2': 92, 'n_units_3': 48, 'n_units_4': 43, 'activation': 'relu', 'learning_rate': 0.00023686868397152465, 'batch_size': 16, 'optimizer': 'RMSprop', 'max_epochs': 251}. Best is trial 4 with value: 14.12889167040304.
2025-05-07 14:40:04.2007Z [I 2025-05-07 17:40:04,200] Trial 5 finished with value: 23.34180071555173 and parameters: {'n_layers': 12, 'n_units_0': 25, 'n_units_1': 8, 'n_units_2': 22, 'n_units_3': 66, 'n_units_4': 84, 'n_units_5': 18, 'n_units_6': 65, 'n_units_7': 10, 'n_units_8': 76, 'n_units_9': 99, 'n_units_10': 59, 'n_units_11': 65, 'activation': 'relu', 'learning_rate': 1.2702695546344824e-05, 'batch_size': 32, 'optimizer': 'Adam', 'max_epochs': 149}. Best is trial 4 with value: 14.12889167040304.
2025-05-07 14:44:28.0705Z [I 2025-05-07 17:44:28,070] Trial 6 finished with value: 97.77638610465975 and parameters: {'n_layers': 15, 'n_units_0': 99, 'n_units_1': 20, 'n_units_2': 64, 'n_units_3': 83, 'n_units_4': 76, 'n_units_5': 42, 'n_units_6': 83, 'n_units_7': 74, 'n_units_8': 26, 'n_units_9': 4, 'n_units_10': 15, 'n_units_11': 73, 'n_units_12': 68, 'n_units_13': 17, 'n_units_14': 62, 'activation': 'logistic', 'learning_rate': 0.00040781181183844803, 'batch_size': 256, 'optimizer': 'RMSprop', 'max_epochs': 148}. Best is trial 4 with value: 14.12889167040304.
2025-05-07 14:45:22.1125Z [I 2025-05-07 17:45:22,112] Trial 7 finished with value: 1000000.0 and parameters: {'n_layers': 1, 'n_units_0': 84, 'activation': 'relu', 'learning_rate': 0.02115457904810613, 'batch_size': 32, 'optimizer': 'SGD', 'max_epochs': 116}. Best is trial 4 with value: 14.12889167040304.
2025-05-07 14:49:16.2332Z [I 2025-05-07 17:49:16,232] Trial 8 finished with value: 13.063857304631785 and parameters: {'n_layers': 8, 'n_units_0': 29, 'n_units_1': 47, 'n_units_2': 36, 'n_units_3': 41, 'n_units_4': 71, 'n_units_5': 33, 'n_units_6': 56, 'n_units_7': 89, 'activation': 'relu', 'learning_rate': 6.444385474349616e-05, 'batch_size': 128, 'optimizer': 'SGD', 'max_epochs': 64}. Best is trial 8 with value: 13.063857304631785.
2025-05-07 14:49:44.3853Z [I 2025-05-07 17:49:44,385] Trial 9 finished with value: 1000000.0 and parameters: {'n_layers': 8, 'n_units_0': 91, 'n_units_1': 13, 'n_units_2': 39, 'n_units_3': 59, 'n_units_4': 65, 'n_units_5': 43, 'n_units_6': 12, 'n_units_7': 48, 'activation': 'relu', 'learning_rate': 2.523662245869256e-05, 'batch_size': 128, 'optimizer': 'LBFGS', 'max_epochs': 409}. Best is trial 8 with value: 13.063857304631785.
2025-05-07 14:51:10.6795Z [I 2025-05-07 17:51:10,679] Trial 10 finished with value: 1000000.0 and parameters: {'n_layers': 11, 'n_units_0': 46, 'n_units_1': 45, 'n_units_2': 3, 'n_units_3': 25, 'n_units_4': 97, 'n_units_5': 90, 'n_units_6': 95, 'n_units_7': 100, 'n_units_8': 99, 'n_units_9': 4, 'n_units_10': 100, 'activation': 'relu', 'learning_rate': 0.0018974180481275652, 'batch_size': 128, 'optimizer': 'SGD', 'max_epochs': 487}. Best is trial 8 with value: 13.063857304631785.
2025-05-07 15:06:10.0871Z [I 2025-05-07 18:06:10,086] Trial 11 finished with value: 44.27443352395587 and parameters: {'n_layers': 5, 'n_units_0': 1, 'n_units_1': 68, 'n_units_2': 100, 'n_units_3': 36, 'n_units_4': 45, 'activation': 'relu', 'learning_rate': 0.00021069959132376042, 'batch_size': 16, 'optimizer': 'RMSprop', 'max_epochs': 51}. Best is trial 8 with value: 13.063857304631785.
2025-05-07 15:17:07.2989Z [I 2025-05-07 18:17:07,298] Trial 12 finished with value: 19.582468779397907 and parameters: {'n_layers': 5, 'n_units_0': 49, 'n_units_1': 97, 'n_units_2': 91, 'n_units_3': 45, 'n_units_4': 37, 'activation': 'relu', 'learning_rate': 6.919846016622575e-05, 'batch_size': 16, 'optimizer': 'SGD', 'max_epochs': 281}. Best is trial 8 with value: 13.063857304631785.
2025-05-07 15:22:23.9247Z [I 2025-05-07 18:22:23,924] Trial 13 finished with value: 16.32773530485924 and parameters: {'n_layers': 10, 'n_units_0': 35, 'n_units_1': 56, 'n_units_2': 76, 'n_units_3': 37, 'n_units_4': 61, 'n_units_5': 75, 'n_units_6': 63, 'n_units_7': 56, 'n_units_8': 49, 'n_units_9': 40, 'activation': 'relu', 'learning_rate': 0.0011175831124597224, 'batch_size': 128, 'optimizer': 'RMSprop', 'max_epochs': 319}. Best is trial 8 with value: 13.063857304631785.
2025-05-07 15:24:31.9809Z [I 2025-05-07 18:24:31,980] Trial 14 finished with value: 37.31569945453589 and parameters: {'n_layers': 3, 'n_units_0': 6, 'n_units_1': 79, 'n_units_2': 41, 'activation': 'relu', 'learning_rate': 0.000283815534004329, 'batch_size': 64, 'optimizer': 'SGD', 'max_epochs': 233}. Best is trial 8 with value: 13.063857304631785.
2025-05-07 15:28:56.2759Z [I 2025-05-07 18:28:56,275] Trial 15 finished with value: 140.4158235941555 and parameters: {'n_layers': 8, 'n_units_0': 67, 'n_units_1': 45, 'n_units_2': 78, 'n_units_3': 3, 'n_units_4': 21, 'n_units_5': 2, 'n_units_6': 1, 'n_units_7': 18, 'activation': 'tanh', 'learning_rate': 5.499391428541535e-05, 'batch_size': 128, 'optimizer': 'RMSprop', 'max_epochs': 61}. Best is trial 8 with value: 13.063857304631785.
2025-05-07 15:29:41.3504Z [I 2025-05-07 18:29:41,350] Trial 16 finished with value: 1000000.0 and parameters: {'n_layers': 7, 'n_units_0': 34, 'n_units_1': 34, 'n_units_2': 38, 'n_units_3': 66, 'n_units_4': 65, 'n_units_5': 66, 'n_units_6': 26, 'activation': 'relu', 'learning_rate': 0.0016338556824396016, 'batch_size': 16, 'optimizer': 'LBFGS', 'max_epochs': 389}. Best is trial 8 with value: 13.063857304631785.
2025-05-07 17:04:05.9440Z [I 2025-05-07 20:04:05,943] Trial 17 finished with value: 20.935242124058867 and parameters: {'n_layers': 9, 'n_units_0': 16, 'n_units_1': 59, 'n_units_2': 22, 'n_units_3': 52, 'n_units_4': 82, 'n_units_5': 55, 'n_units_6': 64, 'n_units_7': 71, 'n_units_8': 47, 'activation': 'relu', 'learning_rate': 1.0744289183767816e-05, 'batch_size': 16, 'optimizer': 'Adam', 'max_epochs': 214}. Best is trial 8 with value: 13.063857304631785.
2025-05-07 17:30:18.3649Z [I 2025-05-07 20:30:18,364] Trial 18 finished with value: 13.44973269058691 and parameters: {'n_layers': 4, 'n_units_0': 38, 'n_units_1': 77, 'n_units_2': 81, 'n_units_3': 25, 'activation': 'tanh', 'learning_rate': 0.00014704262096159763, 'batch_size': 128, 'optimizer': 'RMSprop', 'max_epochs': 456}. Best is trial 8 with value: 13.063857304631785.
2025-05-07 17:30:48.5527Z [I 2025-05-07 20:30:48,552] Trial 19 finished with value: 1000000.0 and parameters: {'n_layers': 3, 'n_units_0': 41, 'n_units_1': 66, 'n_units_2': 75, 'activation': 'tanh', 'learning_rate': 0.09263215901716643, 'batch_size': 128, 'optimizer': 'SGD', 'max_epochs': 493}. Best is trial 8 with value: 13.063857304631785.
2025-05-07 17:58:14.3621Z [I 2025-05-07 20:58:14,361] Trial 20 finished with value: 21.99949576060104 and parameters: {'n_layers': 6, 'n_units_0': 61, 'n_units_1': 36, 'n_units_2': 48, 'n_units_3': 22, 'n_units_4': 99, 'n_units_5': 95, 'activation': 'tanh', 'learning_rate': 4.0704730968710774e-05, 'batch_size': 128, 'optimizer': 'RMSprop', 'max_epochs': 424}. Best is trial 8 with value: 13.063857304631785.
2025-05-07 18:19:00.1626Z [I 2025-05-07 21:19:00,162] Trial 21 finished with value: 12.34563437456138 and parameters: {'n_layers': 4, 'n_units_0': 18, 'n_units_1': 81, 'n_units_2': 89, 'n_units_3': 34, 'activation': 'tanh', 'learning_rate': 0.00016015209488210371, 'batch_size': 128, 'optimizer': 'RMSprop', 'max_epochs': 359}. Best is trial 21 with value: 12.34563437456138.
2025-05-07 18:41:19.5532Z [I 2025-05-07 21:41:19,553] Trial 22 finished with value: 19.424267941381824 and parameters: {'n_layers': 3, 'n_units_0': 11, 'n_units_1': 99, 'n_units_2': 87, 'activation': 'tanh', 'learning_rate': 0.00013520735562602156, 'batch_size': 128, 'optimizer': 'RMSprop', 'max_epochs': 448}. Best is trial 21 with value: 12.34563437456138.
2025-05-07 18:58:11.0320Z [I 2025-05-07 21:58:11,031] Trial 23 finished with value: 20.565813812098618 and parameters: {'n_layers': 1, 'n_units_0': 35, 'activation': 'tanh', 'learning_rate': 0.0005070715158502397, 'batch_size': 128, 'optimizer': 'RMSprop', 'max_epochs': 368}. Best is trial 21 with value: 12.34563437456138.
2025-05-07 19:14:58.7180Z [I 2025-05-07 22:14:58,717] Trial 24 finished with value: 36.15944710908029 and parameters: {'n_layers': 4, 'n_units_0': 27, 'n_units_1': 77, 'n_units_2': 66, 'n_units_3': 31, 'activation': 'tanh', 'learning_rate': 0.00012494663516602578, 'batch_size': 128, 'optimizer': 'RMSprop', 'max_epochs': 291}. Best is trial 21 with value: 12.34563437456138.
2025-05-07 19:22:57.5100Z [I 2025-05-07 22:22:57,509] Trial 25 finished with value: 13.202862076709033 and parameters: {'n_layers': 7, 'n_units_0': 56, 'n_units_1': 87, 'n_units_2': 100, 'n_units_3': 13, 'n_units_4': 3, 'n_units_5': 27, 'n_units_6': 51, 'activation': 'tanh', 'learning_rate': 2.758887876193534e-05, 'batch_size': 128, 'optimizer': 'SGD', 'max_epochs': 446}. Best is trial 21 with value: 12.34563437456138.
2025-05-07 19:29:06.5534Z [I 2025-05-07 22:29:06,553] Trial 26 finished with value: 96.93390850052164 and parameters: {'n_layers': 9, 'n_units_0': 75, 'n_units_1': 90, 'n_units_2': 100, 'n_units_3': 9, 'n_units_4': 1, 'n_units_5': 31, 'n_units_6': 52, 'n_units_7': 33, 'n_units_8': 79, 'activation': 'tanh', 'learning_rate': 2.5968816095243188e-05, 'batch_size': 128, 'optimizer': 'SGD', 'max_epochs': 337}. Best is trial 21 with value: 12.34563437456138.
2025-05-07 19:31:14.0464Z [I 2025-05-07 22:31:14,046] Trial 27 finished with value: 97.77214123441554 and parameters: {'n_layers': 7, 'n_units_0': 57, 'n_units_1': 49, 'n_units_2': 32, 'n_units_3': 15, 'n_units_4': 20, 'n_units_5': 2, 'n_units_6': 50, 'activation': 'logistic', 'learning_rate': 2.56462533752105e-05, 'batch_size': 64, 'optimizer': 'SGD', 'max_epochs': 359}. Best is trial 21 with value: 12.34563437456138.
2025-05-07 19:41:27.3240Z [I 2025-05-07 22:41:27,323] Trial 28 finished with value: 18.95931747173776 and parameters: {'n_layers': 10, 'n_units_0': 52, 'n_units_1': 90, 'n_units_2': 5, 'n_units_3': 40, 'n_units_4': 12, 'n_units_5': 35, 'n_units_6': 78, 'n_units_7': 79, 'n_units_8': 1, 'n_units_9': 100, 'activation': 'tanh', 'learning_rate': 4.121145567155728e-05, 'batch_size': 32, 'optimizer': 'SGD', 'max_epochs': 422}. Best is trial 21 with value: 12.34563437456138.
2025-05-07 19:42:03.0666Z [I 2025-05-07 22:42:03,066] Trial 29 finished with value: 97.76729186888117 and parameters: {'n_layers': 6, 'n_units_0': 71, 'n_units_1': 59, 'n_units_2': 50, 'n_units_3': 17, 'n_units_4': 57, 'n_units_5': 55, 'activation': 'logistic', 'learning_rate': 0.002948485336178882, 'batch_size': 256, 'optimizer': 'LBFGS', 'max_epochs': 460}. Best is trial 21 with value: 12.34563437456138.
2025-05-07 19:57:49.4915Z [I 2025-05-07 22:57:49,491] Trial 30 finished with value: 17.610026607287537 and parameters: {'n_layers': 6, 'n_units_0': 30, 'n_units_1': 69, 'n_units_2': 70, 'n_units_3': 2, 'n_units_4': 33, 'n_units_5': 18, 'activation': 'tanh', 'learning_rate': 1.6997120017377394e-05, 'batch_size': 128, 'optimizer': 'SGD', 'max_epochs': 307}. Best is trial 21 with value: 12.34563437456138.
2025-05-07 20:25:06.9562Z [I 2025-05-07 23:25:06,955] Trial 31 finished with value: 24.917363423925895 and parameters: {'n_layers': 4, 'n_units_0': 42, 'n_units_1': 75, 'n_units_2': 85, 'n_units_3': 25, 'activation': 'tanh', 'learning_rate': 0.00011880879134047795, 'batch_size': 128, 'optimizer': 'Adam', 'max_epochs': 454}. Best is trial 21 with value: 12.34563437456138.
2025-05-07 20:34:45.1308Z [I 2025-05-07 23:34:45,130] Trial 32 finished with value: 12.527549596843238 and parameters: {'n_layers': 4, 'n_units_0': 21, 'n_units_1': 84, 'n_units_2': 96, 'n_units_3': 30, 'activation': 'tanh', 'learning_rate': 0.0006095342482609061, 'batch_size': 128, 'optimizer': 'RMSprop', 'max_epochs': 389}. Best is trial 21 with value: 12.34563437456138.
2025-05-07 20:38:45.6928Z [I 2025-05-07 23:38:45,692] Trial 33 finished with value: 12.095805148780531 and parameters: {'n_layers': 2, 'n_units_0': 18, 'n_units_1': 84, 'activation': 'tanh', 'learning_rate': 0.0005291851118487265, 'batch_size': 128, 'optimizer': 'SGD', 'max_epochs': 388}. Best is trial 33 with value: 12.095805148780531.
2025-05-07 20:40:02.9124Z [I 2025-05-07 23:40:02,912] Trial 34 finished with value: 14.710415758472273 and parameters: {'n_layers': 2, 'n_units_0': 18, 'n_units_1': 26, 'activation': 'tanh', 'learning_rate': 0.006329262420705448, 'batch_size': 64, 'optimizer': 'LBFGS', 'max_epochs': 380}. Best is trial 33 with value: 12.095805148780531.
2025-05-07 20:52:26.8085Z [I 2025-05-07 23:52:26,808] Trial 35 finished with value: 21.151945186111135 and parameters: {'n_layers': 2, 'n_units_0': 11, 'n_units_1': 95, 'activation': 'tanh', 'learning_rate': 0.000607382191094395, 'batch_size': 128, 'optimizer': 'RMSprop', 'max_epochs': 348}. Best is trial 33 with value: 12.095805148780531.
2025-05-07 20:55:15.8192Z [I 2025-05-07 23:55:15,819] Trial 36 finished with value: 23.550795180063055 and parameters: {'n_layers': 2, 'n_units_0': 21, 'n_units_1': 71, 'activation': 'logistic', 'learning_rate': 0.0009039852047195855, 'batch_size': 256, 'optimizer': 'SGD', 'max_epochs': 395}. Best is trial 33 with value: 12.095805148780531.
2025-05-07 21:08:32.6855Z [I 2025-05-08 00:08:32,685] Trial 37 finished with value: 97.77512265077964 and parameters: {'n_layers': 15, 'n_units_0': 13, 'n_units_1': 84, 'n_units_2': 57, 'n_units_3': 58, 'n_units_4': 73, 'n_units_5': 76, 'n_units_6': 25, 'n_units_7': 85, 'n_units_8': 28, 'n_units_9': 39, 'n_units_10': 90, 'n_units_11': 9, 'n_units_12': 7, 'n_units_13': 94, 'n_units_14': 1, 'activation': 'tanh', 'learning_rate': 0.0040221272711826045, 'batch_size': 128, 'optimizer': 'Adam', 'max_epochs': 263}. Best is trial 33 with value: 12.095805148780531.
2025-05-07 21:28:07.8084Z [I 2025-05-08 00:28:07,808] Trial 38 finished with value: 34.904844141340185 and parameters: {'n_layers': 1, 'n_units_0': 5, 'activation': 'tanh', 'learning_rate': 0.0003188398098604914, 'batch_size': 32, 'optimizer': 'RMSprop', 'max_epochs': 191}. Best is trial 33 with value: 12.095805148780531.
2025-05-07 21:30:10.9961Z [I 2025-05-08 00:30:10,995] Trial 39 finished with value: 97.77221115141818 and parameters: {'n_layers': 14, 'n_units_0': 25, 'n_units_1': 38, 'n_units_2': 12, 'n_units_3': 31, 'n_units_4': 88, 'n_units_5': 64, 'n_units_6': 100, 'n_units_7': 54, 'n_units_8': 67, 'n_units_9': 68, 'n_units_10': 57, 'n_units_11': 99, 'n_units_12': 1, 'n_units_13': 1, 'activation': 'logistic', 'learning_rate': 0.0007308187805294556, 'batch_size': 128, 'optimizer': 'SGD', 'max_epochs': 83}. Best is trial 33 with value: 12.095805148780531.
2025-05-07 21:44:36.4211Z [I 2025-05-08 00:44:36,420] Trial 40 finished with value: 58.86819062267414 and parameters: {'n_layers': 3, 'n_units_0': 29, 'n_units_1': 62, 'n_units_2': 57, 'activation': 'tanh', 'learning_rate': 8.81140825222743e-05, 'batch_size': 256, 'optimizer': 'RMSprop', 'max_epochs': 324}. Best is trial 33 with value: 12.095805148780531.
2025-05-07 21:48:34.4709Z [I 2025-05-08 00:48:34,470] Trial 41 finished with value: 48.866230131509276 and parameters: {'n_layers': 8, 'n_units_0': 21, 'n_units_1': 87, 'n_units_2': 94, 'n_units_3': 42, 'n_units_4': 52, 'n_units_5': 41, 'n_units_6': 37, 'n_units_7': 33, 'activation': 'tanh', 'learning_rate': 0.000297668068077733, 'batch_size': 128, 'optimizer': 'SGD', 'max_epochs': 430}. Best is trial 33 with value: 12.095805148780531.
2025-05-07 21:52:02.0110Z [I 2025-05-08 00:52:02,010] Trial 42 finished with value: 28.71134140872351 and parameters: {'n_layers': 5, 'n_units_0': 9, 'n_units_1': 93, 'n_units_2': 98, 'n_units_3': 32, 'n_units_4': 73, 'activation': 'tanh', 'learning_rate': 0.00022191587838838413, 'batch_size': 128, 'optimizer': 'SGD', 'max_epochs': 404}. Best is trial 33 with value: 12.095805148780531.
2025-05-07 21:58:52.3177Z [I 2025-05-08 00:58:52,317] Trial 43 finished with value: 13.457493869043804 and parameters: {'n_layers': 7, 'n_units_0': 17, 'n_units_1': 85, 'n_units_2': 87, 'n_units_3': 98, 'n_units_4': 12, 'n_units_5': 25, 'n_units_6': 74, 'activation': 'tanh', 'learning_rate': 7.548684007488012e-05, 'batch_size': 128, 'optimizer': 'SGD', 'max_epochs': 371}. Best is trial 33 with value: 12.095805148780531.
2025-05-07 22:12:46.7312Z [I 2025-05-08 01:12:46,731] Trial 44 finished with value: 13.584194850319445 and parameters: {'n_layers': 4, 'n_units_0': 55, 'n_units_1': 81, 'n_units_2': 29, 'n_units_3': 10, 'activation': 'tanh', 'learning_rate': 4.2818560633495386e-05, 'batch_size': 128, 'optimizer': 'SGD', 'max_epochs': 473}. Best is trial 33 with value: 12.095805148780531.
2025-05-07 22:15:01.0642Z [I 2025-05-08 01:15:01,063] Trial 45 finished with value: 97.77400900002772 and parameters: {'n_layers': 12, 'n_units_0': 1, 'n_units_1': 52, 'n_units_2': 94, 'n_units_3': 20, 'n_units_4': 41, 'n_units_5': 10, 'n_units_6': 53, 'n_units_7': 63, 'n_units_8': 96, 'n_units_9': 26, 'n_units_10': 30, 'n_units_11': 1, 'activation': 'relu', 'learning_rate': 0.001339709890216756, 'batch_size': 128, 'optimizer': 'SGD', 'max_epochs': 133}. Best is trial 33 with value: 12.095805148780531.
2025-05-07 22:15:40.6615Z [I 2025-05-08 01:15:40,661] Trial 46 finished with value: 94781.71502985162 and parameters: {'n_layers': 6, 'n_units_0': 46, 'n_units_1': 72, 'n_units_2': 83, 'n_units_3': 52, 'n_units_4': 51, 'n_units_5': 47, 'activation': 'tanh', 'learning_rate': 0.0004274038863985286, 'batch_size': 32, 'optimizer': 'LBFGS', 'max_epochs': 435}. Best is trial 33 with value: 12.095805148780531.
2025-05-07 22:31:44.7157Z [I 2025-05-08 01:31:44,715] Trial 47 finished with value: 13.126350841943134 and parameters: {'n_layers': 9, 'n_units_0': 22, 'n_units_1': 100, 'n_units_2': 91, 'n_units_3': 9, 'n_units_4': 92, 'n_units_5': 35, 'n_units_6': 57, 'n_units_7': 88, 'n_units_8': 30, 'activation': 'relu', 'learning_rate': 0.00017076368788894103, 'batch_size': 64, 'optimizer': 'Adam', 'max_epochs': 348}. Best is trial 33 with value: 12.095805148780531.
2025-05-07 22:46:34.0798Z [I 2025-05-08 01:46:34,079] Trial 48 finished with value: 13.970606328521445 and parameters: {'n_layers': 11, 'n_units_0': 24, 'n_units_1': 99, 'n_units_2': 90, 'n_units_3': 30, 'n_units_4': 91, 'n_units_5': 36, 'n_units_6': 83, 'n_units_7': 89, 'n_units_8': 30, 'n_units_9': 78, 'n_units_10': 74, 'activation': 'relu', 'learning_rate': 0.000209535079387305, 'batch_size': 64, 'optimizer': 'Adam', 'max_epochs': 301}. Best is trial 33 with value: 12.095805148780531.
2025-05-07 22:52:43.5075Z [I 2025-05-08 01:52:43,507] Trial 49 finished with value: 17.37575436059135 and parameters: {'n_layers': 10, 'n_units_0': 31, 'n_units_1': 94, 'n_units_2': 72, 'n_units_3': 75, 'n_units_4': 80, 'n_units_5': 50, 'n_units_6': 71, 'n_units_7': 89, 'n_units_8': 19, 'n_units_9': 24, 'activation': 'relu', 'learning_rate': 0.0027103775060999366, 'batch_size': 64, 'optimizer': 'Adam', 'max_epochs': 333}. Best is trial 33 with value: 12.095805148780531.
2025-05-07 23:09:46.3073Z [I 2025-05-08 02:09:46,306] Trial 50 finished with value: 20.412608629581207 and parameters: {'n_layers': 2, 'n_units_0': 21, 'n_units_1': 64, 'activation': 'relu', 'learning_rate': 0.0008085090900019995, 'batch_size': 64, 'optimizer': 'Adam', 'max_epochs': 353}. Best is trial 33 with value: 12.095805148780531.
2025-05-08 00:02:38.4037Z [I 2025-05-08 03:02:38,403] Trial 51 finished with value: 18.163181262225326 and parameters: {'n_layers': 9, 'n_units_0': 15, 'n_units_1': 89, 'n_units_2': 95, 'n_units_3': 9, 'n_units_4': 93, 'n_units_5': 26, 'n_units_6': 45, 'n_units_7': 67, 'n_units_8': 40, 'activation': 'relu', 'learning_rate': 1.7785471150214136e-05, 'batch_size': 64, 'optimizer': 'Adam', 'max_epochs': 410}. Best is trial 33 with value: 12.095805148780531.
