2025-05-09 03:09:28.0649Z [I 2025-05-09 06:09:28,064] Trial 107 finished with value: 11.864904348548087 and parameters: {'n_layers': 6, 'n_units_0': 25, 'n_units_1': 33, 'n_units_2': 54, 'n_units_3': 68, 'n_units_4': 90, 'n_units_5': 89, 'activation': 'tanh', 'learning_rate': 0.000559238988136161, 'batch_size': 16, 'optimizer': 'RMSprop', 'max_epochs': 227}. Best is trial 103 with value: 10.139008803217342.
2025-05-09 03:27:28.5123Z [I 2025-05-09 06:27:28,512] Trial 108 finished with value: 13.945971185424394 and parameters: {'n_layers': 5, 'n_units_0': 13, 'n_units_1': 14, 'n_units_2': 63, 'n_units_3': 63, 'n_units_4': 85, 'activation': 'tanh', 'learning_rate': 0.0009764677528374919, 'batch_size': 16, 'optimizer': 'RMSprop', 'max_epochs': 181}. Best is trial 103 with value: 10.139008803217342.
2025-05-09 03:28:21.2504Z [I 2025-05-09 06:28:21,250] Trial 109 finished with value: 55.36972675230572 and parameters: {'n_layers': 6, 'n_units_0': 16, 'n_units_1': 38, 'n_units_2': 59, 'n_units_3': 71, 'n_units_4': 81, 'n_units_5': 97, 'activation': 'tanh', 'learning_rate': 0.00029388249421399804, 'batch_size': 16, 'optimizer': 'LBFGS', 'max_epochs': 145}. Best is trial 103 with value: 10.139008803217342.
2025-05-09 03:41:39.7930Z [I 2025-05-09 06:41:39,792] Trial 110 finished with value: 12.570601398948659 and parameters: {'n_layers': 4, 'n_units_0': 22, 'n_units_1': 44, 'n_units_2': 66, 'n_units_3': 60, 'activation': 'tanh', 'learning_rate': 0.0023406899211647243, 'batch_size': 16, 'optimizer': 'RMSprop', 'max_epochs': 193}. Best is trial 103 with value: 10.139008803217342.
2025-05-09 04:11:43.8251Z [I 2025-05-09 07:11:43,824] Trial 111 finished with value: 10.60555831281243 and parameters: {'n_layers': 4, 'n_units_0': 20, 'n_units_1': 31, 'n_units_2': 70, 'n_units_3': 65, 'activation': 'tanh', 'learning_rate': 0.00032825327801791737, 'batch_size': 16, 'optimizer': 'RMSprop', 'max_epochs': 172}. Best is trial 103 with value: 10.139008803217342.
2025-05-09 04:28:31.3790Z [I 2025-05-09 07:28:31,378] Trial 112 finished with value: 11.434283695445451 and parameters: {'n_layers': 5, 'n_units_0': 100, 'n_units_1': 24, 'n_units_2': 71, 'n_units_3': 65, 'n_units_4': 95, 'activation': 'tanh', 'learning_rate': 0.0004689890252339511, 'batch_size': 16, 'optimizer': 'RMSprop', 'max_epochs': 236}. Best is trial 103 with value: 10.139008803217342.
2025-05-09 04:35:50.6530Z [I 2025-05-09 07:35:50,652] Trial 113 finished with value: 31.128254057746215 and parameters: {'n_layers': 4, 'n_units_0': 32, 'n_units_1': 32, 'n_units_2': 68, 'n_units_3': 68, 'activation': 'tanh', 'learning_rate': 0.00023355374028336185, 'batch_size': 256, 'optimizer': 'RMSprop', 'max_epochs': 162}. Best is trial 103 with value: 10.139008803217342.
2025-05-09 04:59:45.4362Z [I 2025-05-09 07:59:45,435] Trial 114 finished with value: 10.261239565206086 and parameters: {'n_layers': 3, 'n_units_0': 21, 'n_units_1': 28, 'n_units_2': 80, 'activation': 'tanh', 'learning_rate': 0.0007138910140925414, 'batch_size': 16, 'optimizer': 'RMSprop', 'max_epochs': 222}. Best is trial 103 with value: 10.139008803217342.
2025-05-09 05:16:20.9537Z [I 2025-05-09 08:16:20,953] Trial 115 finished with value: 11.416615581166118 and parameters: {'n_layers': 3, 'n_units_0': 23, 'n_units_1': 18, 'n_units_2': 73, 'activation': 'tanh', 'learning_rate': 0.0006974510250109361, 'batch_size': 32, 'optimizer': 'RMSprop', 'max_epochs': 224}. Best is trial 103 with value: 10.139008803217342.
2025-05-09 05:31:33.5915Z [I 2025-05-09 08:31:33,591] Trial 116 finished with value: 12.170564906629616 and parameters: {'n_layers': 3, 'n_units_0': 16, 'n_units_1': 37, 'n_units_2': 69, 'activation': 'tanh', 'learning_rate': 0.0014932916816913768, 'batch_size': 16, 'optimizer': 'RMSprop', 'max_epochs': 211}. Best is trial 103 with value: 10.139008803217342.
2025-05-09 05:48:01.4417Z [I 2025-05-09 08:48:01,441] Trial 117 finished with value: 12.021854844261112 and parameters: {'n_layers': 4, 'n_units_0': 30, 'n_units_1': 28, 'n_units_2': 80, 'n_units_3': 78, 'activation': 'tanh', 'learning_rate': 0.0007853269516594762, 'batch_size': 16, 'optimizer': 'RMSprop', 'max_epochs': 175}. Best is trial 103 with value: 10.139008803217342.
2025-05-09 06:11:38.3535Z [I 2025-05-09 09:11:38,353] Trial 118 finished with value: 11.451394901514387 and parameters: {'n_layers': 3, 'n_units_0': 25, 'n_units_1': 24, 'n_units_2': 85, 'activation': 'tanh', 'learning_rate': 0.0005694270740765145, 'batch_size': 16, 'optimizer': 'RMSprop', 'max_epochs': 251}. Best is trial 103 with value: 10.139008803217342.
2025-05-09 06:18:36.0495Z [I 2025-05-09 09:18:36,049] Trial 119 finished with value: 97.77196144760777 and parameters: {'n_layers': 6, 'n_units_0': 11, 'n_units_1': 32, 'n_units_2': 78, 'n_units_3': 86, 'n_units_4': 97, 'n_units_5': 83, 'activation': 'logistic', 'learning_rate': 0.00035539127933116035, 'batch_size': 16, 'optimizer': 'RMSprop', 'max_epochs': 286}. Best is trial 103 with value: 10.139008803217342.
2025-05-09 06:35:32.3778Z [I 2025-05-09 09:35:32,377] Trial 120 finished with value: 9.774581439722999 and parameters: {'n_layers': 4, 'n_units_0': 17, 'n_units_1': 42, 'n_units_2': 79, 'n_units_3': 55, 'activation': 'tanh', 'learning_rate': 0.000926622239091267, 'batch_size': 16, 'optimizer': 'RMSprop', 'max_epochs': 261}. Best is trial 120 with value: 9.774581439722999.
2025-05-09 06:51:19.9418Z [I 2025-05-09 09:51:19,941] Trial 121 finished with value: 14.123301176014 and parameters: {'n_layers': 4, 'n_units_0': 17, 'n_units_1': 41, 'n_units_2': 76, 'n_units_3': 54, 'activation': 'tanh', 'learning_rate': 0.0008525461431618628, 'batch_size': 16, 'optimizer': 'RMSprop', 'max_epochs': 218}. Best is trial 120 with value: 9.774581439722999.
2025-05-09 07:28:33.1318Z [I 2025-05-09 10:28:33,131] Trial 122 finished with value: 10.367052458262343 and parameters: {'n_layers': 4, 'n_units_0': 21, 'n_units_1': 50, 'n_units_2': 79, 'n_units_3': 58, 'activation': 'tanh', 'learning_rate': 0.0002079414125314033, 'batch_size': 16, 'optimizer': 'RMSprop', 'max_epochs': 260}. Best is trial 120 with value: 9.774581439722999.
2025-05-09 07:59:53.0939Z [I 2025-05-09 10:59:53,093] Trial 123 finished with value: 10.70447428196828 and parameters: {'n_layers': 5, 'n_units_0': 14, 'n_units_1': 51, 'n_units_2': 79, 'n_units_3': 58, 'n_units_4': 89, 'activation': 'tanh', 'learning_rate': 0.00019622799156598846, 'batch_size': 16, 'optimizer': 'RMSprop', 'max_epochs': 268}. Best is trial 120 with value: 9.774581439722999.
2025-05-09 08:35:12.1708Z [I 2025-05-09 11:35:12,170] Trial 124 finished with value: 10.552764197799336 and parameters: {'n_layers': 5, 'n_units_0': 15, 'n_units_1': 50, 'n_units_2': 80, 'n_units_3': 58, 'n_units_4': 89, 'activation': 'tanh', 'learning_rate': 0.00020244418659291373, 'batch_size': 16, 'optimizer': 'RMSprop', 'max_epochs': 262}. Best is trial 120 with value: 9.774581439722999.
2025-05-09 09:04:36.0614Z [I 2025-05-09 12:04:36,061] Trial 125 finished with value: 12.666750322032211 and parameters: {'n_layers': 5, 'n_units_0': 14, 'n_units_1': 52, 'n_units_2': 79, 'n_units_3': 58, 'n_units_4': 89, 'activation': 'tanh', 'learning_rate': 0.00021117170938775637, 'batch_size': 16, 'optimizer': 'RMSprop', 'max_epochs': 265}. Best is trial 120 with value: 9.774581439722999.
2025-05-09 09:44:05.9517Z [I 2025-05-09 12:44:05,951] Trial 126 finished with value: 12.774329216772072 and parameters: {'n_layers': 5, 'n_units_0': 18, 'n_units_1': 49, 'n_units_2': 82, 'n_units_3': 57, 'n_units_4': 93, 'activation': 'tanh', 'learning_rate': 0.00013947779241077076, 'batch_size': 16, 'optimizer': 'RMSprop', 'max_epochs': 259}. Best is trial 120 with value: 9.774581439722999.
2025-05-09 09:45:42.0010Z [I 2025-05-09 12:45:42,000] Trial 127 finished with value: 215.58732460710672 and parameters: {'n_layers': 5, 'n_units_0': 95, 'n_units_1': 46, 'n_units_2': 81, 'n_units_3': 64, 'n_units_4': 85, 'activation': 'tanh', 'learning_rate': 0.00017487956277036993, 'batch_size': 16, 'optimizer': 'LBFGS', 'max_epochs': 248}. Best is trial 120 with value: 9.774581439722999.
2025-05-09 10:33:35.5229Z [I 2025-05-09 13:33:35,522] Trial 128 finished with value: 10.846859005295576 and parameters: {'n_layers': 6, 'n_units_0': 22, 'n_units_1': 50, 'n_units_2': 83, 'n_units_3': 49, 'n_units_4': 100, 'n_units_5': 70, 'activation': 'tanh', 'learning_rate': 0.00011544886456969788, 'batch_size': 16, 'optimizer': 'RMSprop', 'max_epochs': 241}. Best is trial 120 with value: 9.774581439722999.
2025-05-09 10:44:52.5012Z [I 2025-05-09 13:44:52,501] Trial 129 finished with value: 24.91606392870308 and parameters: {'n_layers': 5, 'n_units_0': 22, 'n_units_1': 57, 'n_units_2': 77, 'n_units_3': 50, 'n_units_4': 100, 'activation': 'tanh', 'learning_rate': 0.00012441334489968954, 'batch_size': 256, 'optimizer': 'RMSprop', 'max_epochs': 239}. Best is trial 120 with value: 9.774581439722999.
2025-05-09 11:14:09.2440Z [I 2025-05-09 14:14:09,243] Trial 130 finished with value: 13.761011881327873 and parameters: {'n_layers': 6, 'n_units_0': 25, 'n_units_1': 53, 'n_units_2': 87, 'n_units_3': 54, 'n_units_4': 74, 'n_units_5': 71, 'activation': 'tanh', 'learning_rate': 0.0002065377689799438, 'batch_size': 16, 'optimizer': 'RMSprop', 'max_epochs': 271}. Best is trial 120 with value: 9.774581439722999.
2025-05-09 11:46:17.1532Z [I 2025-05-09 14:46:17,152] Trial 131 finished with value: 11.697459174857629 and parameters: {'n_layers': 6, 'n_units_0': 15, 'n_units_1': 50, 'n_units_2': 84, 'n_units_3': 67, 'n_units_4': 94, 'n_units_5': 69, 'activation': 'tanh', 'learning_rate': 0.00024114461726076918, 'batch_size': 16, 'optimizer': 'RMSprop', 'max_epochs': 249}. Best is trial 120 with value: 9.774581439722999.
2025-05-09 12:19:29.0713Z [I 2025-05-09 15:19:29,071] Trial 132 finished with value: 20.509746188597827 and parameters: {'n_layers': 5, 'n_units_0': 17, 'n_units_1': 47, 'n_units_2': 79, 'n_units_3': 48, 'n_units_4': 89, 'activation': 'tanh', 'learning_rate': 0.00016670347390242008, 'batch_size': 16, 'optimizer': 'RMSprop', 'max_epochs': 264}. Best is trial 120 with value: 9.774581439722999.
2025-05-09 13:07:19.1536Z [I 2025-05-09 16:07:19,153] Trial 133 finished with value: 20.1556542123672 and parameters: {'n_layers': 6, 'n_units_0': 10, 'n_units_1': 40, 'n_units_2': 84, 'n_units_3': 52, 'n_units_4': 97, 'n_units_5': 81, 'activation': 'tanh', 'learning_rate': 0.00010941470272174763, 'batch_size': 16, 'optimizer': 'RMSprop', 'max_epochs': 281}. Best is trial 120 with value: 9.774581439722999.
2025-05-09 13:30:04.7202Z [I 2025-05-09 16:30:04,719] Trial 134 finished with value: 11.760012641951844 and parameters: {'n_layers': 4, 'n_units_0': 13, 'n_units_1': 55, 'n_units_2': 60, 'n_units_3': 59, 'activation': 'tanh', 'learning_rate': 0.00041211573097693464, 'batch_size': 16, 'optimizer': 'RMSprop', 'max_epochs': 198}. Best is trial 120 with value: 9.774581439722999.
2025-05-09 13:45:51.7299Z [I 2025-05-09 16:45:51,729] Trial 135 finished with value: 15.83363684647759 and parameters: {'n_layers': 5, 'n_units_0': 23, 'n_units_1': 44, 'n_units_2': 66, 'n_units_3': 56, 'n_units_4': 79, 'activation': 'tanh', 'learning_rate': 0.0002448743001721793, 'batch_size': 32, 'optimizer': 'RMSprop', 'max_epochs': 213}. Best is trial 120 with value: 9.774581439722999.
2025-05-09 14:12:38.9159Z [I 2025-05-09 17:12:38,915] Trial 136 finished with value: 10.242470557682848 and parameters: {'n_layers': 4, 'n_units_0': 19, 'n_units_1': 60, 'n_units_2': 82, 'n_units_3': 71, 'activation': 'tanh', 'learning_rate': 0.00027867173762661964, 'batch_size': 16, 'optimizer': 'RMSprop', 'max_epochs': 236}. Best is trial 120 with value: 9.774581439722999.
2025-05-09 14:45:52.4670Z [I 2025-05-09 17:45:52,466] Trial 137 finished with value: 10.973001813488784 and parameters: {'n_layers': 4, 'n_units_0': 20, 'n_units_1': 62, 'n_units_2': 81, 'n_units_3': 74, 'activation': 'tanh', 'learning_rate': 0.00018743869268528048, 'batch_size': 16, 'optimizer': 'RMSprop', 'max_epochs': 240}. Best is trial 120 with value: 9.774581439722999.
2025-05-09 15:34:37.8481Z [I 2025-05-09 18:34:37,847] Trial 138 finished with value: 10.535928564224855 and parameters: {'n_layers': 3, 'n_units_0': 28, 'n_units_1': 59, 'n_units_2': 76, 'activation': 'tanh', 'learning_rate': 0.0001370395909814258, 'batch_size': 16, 'optimizer': 'RMSprop', 'max_epochs': 224}. Best is trial 120 with value: 9.774581439722999.
2025-05-09 16:20:52.1572Z [I 2025-05-09 19:20:52,156] Trial 139 finished with value: 17.341837239683006 and parameters: {'n_layers': 3, 'n_units_0': 26, 'n_units_1': 35, 'n_units_2': 77, 'activation': 'tanh', 'learning_rate': 0.00014365564221396857, 'batch_size': 16, 'optimizer': 'RMSprop', 'max_epochs': 227}. Best is trial 120 with value: 9.774581439722999.
2025-05-09 16:49:01.5964Z [I 2025-05-09 19:49:01,596] Trial 140 finished with value: 10.616297849499931 and parameters: {'n_layers': 3, 'n_units_0': 19, 'n_units_1': 61, 'n_units_2': 71, 'activation': 'tanh', 'learning_rate': 0.0003658425540211689, 'batch_size': 16, 'optimizer': 'RMSprop', 'max_epochs': 220}. Best is trial 120 with value: 9.774581439722999.
2025-05-09 17:15:09.8570Z [I 2025-05-09 20:15:09,856] Trial 141 finished with value: 19.515204346447252 and parameters: {'n_layers': 3, 'n_units_0': 18, 'n_units_1': 60, 'n_units_2': 72, 'activation': 'tanh', 'learning_rate': 0.00035320017326605967, 'batch_size': 16, 'optimizer': 'RMSprop', 'max_epochs': 218}. Best is trial 120 with value: 9.774581439722999.
2025-05-09 17:25:15.7556Z [I 2025-05-09 20:25:15,755] Trial 142 finished with value: 14.48698841208735 and parameters: {'n_layers': 3, 'n_units_0': 29, 'n_units_1': 60, 'n_units_2': 70, 'activation': 'tanh', 'learning_rate': 0.013204236041427063, 'batch_size': 16, 'optimizer': 'RMSprop', 'max_epochs': 256}. Best is trial 120 with value: 9.774581439722999.
2025-05-09 18:05:26.6243Z [I 2025-05-09 21:05:26,624] Trial 143 finished with value: 20.579868205161006 and parameters: {'n_layers': 2, 'n_units_0': 15, 'n_units_1': 66, 'activation': 'tanh', 'learning_rate': 0.0002532296365013487, 'batch_size': 16, 'optimizer': 'RMSprop', 'max_epochs': 226}. Best is trial 120 with value: 9.774581439722999.
2025-05-09 18:41:26.2166Z [I 2025-05-09 21:41:26,216] Trial 144 finished with value: 20.37497079297178 and parameters: {'n_layers': 2, 'n_units_0': 20, 'n_units_1': 58, 'activation': 'tanh', 'learning_rate': 0.0004288446373163851, 'batch_size': 16, 'optimizer': 'RMSprop', 'max_epochs': 209}. Best is trial 120 with value: 9.774581439722999.
2025-05-09 19:00:56.7728Z [I 2025-05-09 22:00:56,772] Trial 145 finished with value: 11.082433640143467 and parameters: {'n_layers': 4, 'n_units_0': 17, 'n_units_1': 64, 'n_units_2': 75, 'n_units_3': 70, 'activation': 'tanh', 'learning_rate': 0.0005738482404282115, 'batch_size': 16, 'optimizer': 'RMSprop', 'max_epochs': 195}. Best is trial 120 with value: 9.774581439722999.
2025-05-09 19:05:59.7176Z [I 2025-05-09 22:05:59,717] Trial 146 finished with value: 97.77982681131114 and parameters: {'n_layers': 4, 'n_units_0': 21, 'n_units_1': 55, 'n_units_2': 79, 'n_units_3': 72, 'activation': 'logistic', 'learning_rate': 0.00030905831330961433, 'batch_size': 16, 'optimizer': 'RMSprop', 'max_epochs': 175}. Best is trial 120 with value: 9.774581439722999.
2025-05-09 19:39:39.0772Z [I 2025-05-09 22:39:39,076] Trial 147 finished with value: 19.49829485358311 and parameters: {'n_layers': 3, 'n_units_0': 24, 'n_units_1': 54, 'n_units_2': 76, 'activation': 'tanh', 'learning_rate': 0.00021314246744199254, 'batch_size': 16, 'optimizer': 'RMSprop', 'max_epochs': 234}. Best is trial 120 with value: 9.774581439722999.
2025-05-09 19:58:43.8434Z [I 2025-05-09 22:58:43,843] Trial 148 finished with value: 10.640123442313806 and parameters: {'n_layers': 4, 'n_units_0': 14, 'n_units_1': 51, 'n_units_2': 72, 'n_units_3': 79, 'activation': 'tanh', 'learning_rate': 0.0004739180976325977, 'batch_size': 16, 'optimizer': 'RMSprop', 'max_epochs': 249}. Best is trial 120 with value: 9.774581439722999.
2025-05-09 20:00:01.3381Z [I 2025-05-09 23:00:01,337] Trial 149 finished with value: 4029.585090303963 and parameters: {'n_layers': 4, 'n_units_0': 12, 'n_units_1': 51, 'n_units_2': 71, 'n_units_3': 82, 'activation': 'tanh', 'learning_rate': 0.0006619973158415998, 'batch_size': 16, 'optimizer': 'LBFGS', 'max_epochs': 253}. Best is trial 120 with value: 9.774581439722999.
2025-05-09 20:24:19.9914Z [I 2025-05-09 23:24:19,991] Trial 150 finished with value: 12.433213305128337 and parameters: {'n_layers': 3, 'n_units_0': 15, 'n_units_1': 61, 'n_units_2': 74, 'activation': 'tanh', 'learning_rate': 0.00045185892861407395, 'batch_size': 16, 'optimizer': 'RMSprop', 'max_epochs': 265}. Best is trial 120 with value: 9.774581439722999.
2025-05-09 20:53:31.1018Z [I 2025-05-09 23:53:31,101] Trial 151 finished with value: 10.11210017787226 and parameters: {'n_layers': 4, 'n_units_0': 18, 'n_units_1': 58, 'n_units_2': 65, 'n_units_3': 93, 'activation': 'tanh', 'learning_rate': 0.0002750940292634991, 'batch_size': 16, 'optimizer': 'RMSprop', 'max_epochs': 246}. Best is trial 120 with value: 9.774581439722999.
2025-05-09 21:19:09.1379Z [I 2025-05-10 00:19:09,137] Trial 152 finished with value: 10.617677566412388 and parameters: {'n_layers': 4, 'n_units_0': 17, 'n_units_1': 57, 'n_units_2': 68, 'n_units_3': 92, 'activation': 'tanh', 'learning_rate': 0.0003647084202114472, 'batch_size': 16, 'optimizer': 'RMSprop', 'max_epochs': 250}. Best is trial 120 with value: 9.774581439722999.
2025-05-09 21:44:24.1264Z [I 2025-05-10 00:44:24,126] Trial 153 finished with value: 10.238279014450347 and parameters: {'n_layers': 4, 'n_units_0': 17, 'n_units_1': 57, 'n_units_2': 69, 'n_units_3': 93, 'activation': 'tanh', 'learning_rate': 0.00038704928589756657, 'batch_size': 16, 'optimizer': 'RMSprop', 'max_epochs': 248}. Best is trial 120 with value: 9.774581439722999.
2025-05-09 22:11:43.0785Z [I 2025-05-10 01:11:43,078] Trial 154 finished with value: 10.2959984274554 and parameters: {'n_layers': 3, 'n_units_0': 18, 'n_units_1': 58, 'n_units_2': 66, 'activation': 'tanh', 'learning_rate': 0.00038473125222187644, 'batch_size': 16, 'optimizer': 'RMSprop', 'max_epochs': 248}. Best is trial 120 with value: 9.774581439722999.
2025-05-09 22:38:05.7885Z [I 2025-05-10 01:38:05,788] Trial 155 finished with value: 10.373239023062654 and parameters: {'n_layers': 3, 'n_units_0': 18, 'n_units_1': 58, 'n_units_2': 66, 'activation': 'tanh', 'learning_rate': 0.0003759731295642582, 'batch_size': 16, 'optimizer': 'RMSprop', 'max_epochs': 224}. Best is trial 120 with value: 9.774581439722999.
2025-05-09 23:03:44.9045Z [I 2025-05-10 02:03:44,904] Trial 156 finished with value: 10.811016708681503 and parameters: {'n_layers': 3, 'n_units_0': 18, 'n_units_1': 58, 'n_units_2': 67, 'activation': 'tanh', 'learning_rate': 0.0003821016802390249, 'batch_size': 16, 'optimizer': 'RMSprop', 'max_epochs': 222}. Best is trial 120 with value: 9.774581439722999.
2025-05-09 23:29:46.7549Z [I 2025-05-10 02:29:46,754] Trial 157 finished with value: 10.56124816338271 and parameters: {'n_layers': 2, 'n_units_0': 19, 'n_units_1': 64, 'activation': 'tanh', 'learning_rate': 0.0010184900864574006, 'batch_size': 16, 'optimizer': 'RMSprop', 'max_epochs': 238}. Best is trial 120 with value: 9.774581439722999.
2025-05-09 23:37:31.2288Z [I 2025-05-10 02:37:31,228] Trial 158 finished with value: 20.511594145379476 and parameters: {'n_layers': 2, 'n_units_0': 20, 'n_units_1': 64, 'activation': 'tanh', 'learning_rate': 0.001140762141528823, 'batch_size': 256, 'optimizer': 'RMSprop', 'max_epochs': 214}. Best is trial 120 with value: 9.774581439722999.
2025-05-10 00:05:03.6165Z [I 2025-05-10 03:05:03,616] Trial 159 finished with value: 20.904993130660646 and parameters: {'n_layers': 1, 'n_units_0': 18, 'activation': 'tanh', 'learning_rate': 0.0008982316510382978, 'batch_size': 16, 'optimizer': 'RMSprop', 'max_epochs': 241}. Best is trial 120 with value: 9.774581439722999.
2025-05-10 00:21:42.1630Z [I 2025-05-10 03:21:42,162] Trial 160 finished with value: 10.842493341719624 and parameters: {'n_layers': 3, 'n_units_0': 16, 'n_units_1': 66, 'n_units_2': 62, 'activation': 'tanh', 'learning_rate': 0.0005316985548512079, 'batch_size': 32, 'optimizer': 'RMSprop', 'max_epochs': 232}. Best is trial 120 with value: 9.774581439722999.
2025-05-10 00:40:56.2971Z [I 2025-05-10 03:40:56,296] Trial 161 finished with value: 10.693182611267337 and parameters: {'n_layers': 3, 'n_units_0': 19, 'n_units_1': 59, 'n_units_2': 69, 'activation': 'tanh', 'learning_rate': 0.0006547330351950127, 'batch_size': 16, 'optimizer': 'RMSprop', 'max_epochs': 246}. Best is trial 120 with value: 9.774581439722999.
2025-05-10 01:27:33.1561Z [I 2025-05-10 04:27:33,155] Trial 162 finished with value: 13.046801903799727 and parameters: {'n_layers': 2, 'n_units_0': 17, 'n_units_1': 62, 'activation': 'tanh', 'learning_rate': 0.00036425765165082726, 'batch_size': 16, 'optimizer': 'RMSprop', 'max_epochs': 257}. Best is trial 120 with value: 9.774581439722999.
2025-05-10 01:48:34.7696Z [I 2025-05-10 04:48:34,769] Trial 163 finished with value: 10.328376524570587 and parameters: {'n_layers': 3, 'n_units_0': 21, 'n_units_1': 56, 'n_units_2': 65, 'activation': 'tanh', 'learning_rate': 0.0005869824652344721, 'batch_size': 16, 'optimizer': 'RMSprop', 'max_epochs': 274}. Best is trial 120 with value: 9.774581439722999.
2025-05-10 01:59:55.1397Z [I 2025-05-10 04:59:55,139] Trial 164 finished with value: 10.078097368542547 and parameters: {'n_layers': 3, 'n_units_0': 21, 'n_units_1': 63, 'n_units_2': 65, 'activation': 'tanh', 'learning_rate': 0.0013606385558342258, 'batch_size': 16, 'optimizer': 'RMSprop', 'max_epochs': 275}. Best is trial 120 with value: 9.774581439722999.
