2025-05-08 00:18:31.4530Z [I 2025-05-08 03:18:31,452] Trial 52 finished with value: 13.303899001333981 and parameters: {'n_layers': 8, 'n_units_0': 63, 'n_units_1': 83, 'n_units_2': 91, 'n_units_3': 13, 'n_units_4': 68, 'n_units_5': 30, 'n_units_6': 58, 'n_units_7': 41, 'activation': 'relu', 'learning_rate': 9.415107025350028e-05, 'batch_size': 128, 'optimizer': 'RMSprop', 'max_epochs': 386}. Best is trial 33 with value: 12.095805148780531.
2025-05-08 00:30:55.4610Z [I 2025-05-08 03:30:55,460] Trial 53 finished with value: 97.08695562806057 and parameters: {'n_layers': 7, 'n_units_0': 7, 'n_units_1': 43, 'n_units_2': 100, 'n_units_3': 46, 'n_units_4': 87, 'n_units_5': 11, 'n_units_6': 42, 'activation': 'relu', 'learning_rate': 5.8501927905596396e-05, 'batch_size': 16, 'optimizer': 'SGD', 'max_epochs': 406}. Best is trial 33 with value: 12.095805148780531.
2025-05-08 00:45:24.9485Z [I 2025-05-08 03:45:24,948] Trial 54 finished with value: 13.60761012164356 and parameters: {'n_layers': 9, 'n_units_0': 19, 'n_units_1': 92, 'n_units_2': 44, 'n_units_3': 36, 'n_units_4': 9, 'n_units_5': 22, 'n_units_6': 58, 'n_units_7': 84, 'n_units_8': 66, 'activation': 'relu', 'learning_rate': 0.00017342103034044396, 'batch_size': 128, 'optimizer': 'RMSprop', 'max_epochs': 270}. Best is trial 33 with value: 12.095805148780531.
2025-05-08 00:54:16.5672Z [I 2025-05-08 03:54:16,566] Trial 55 finished with value: 21.309913097904328 and parameters: {'n_layers': 5, 'n_units_0': 25, 'n_units_1': 1, 'n_units_2': 80, 'n_units_3': 6, 'n_units_4': 77, 'activation': 'tanh', 'learning_rate': 0.00034286517470912914, 'batch_size': 128, 'optimizer': 'Adam', 'max_epochs': 479}. Best is trial 33 with value: 12.095805148780531.
2025-05-08 00:57:59.5945Z [I 2025-05-08 03:57:59,594] Trial 56 finished with value: 22.589563765448887 and parameters: {'n_layers': 4, 'n_units_0': 38, 'n_units_1': 80, 'n_units_2': 88, 'n_units_3': 22, 'activation': 'tanh', 'learning_rate': 0.0005327808279043706, 'batch_size': 64, 'optimizer': 'SGD', 'max_epochs': 178}. Best is trial 33 with value: 12.095805148780531.
2025-05-08 01:39:18.1444Z [I 2025-05-08 04:39:18,144] Trial 57 finished with value: 140.75319157127487 and parameters: {'n_layers': 11, 'n_units_0': 32, 'n_units_1': 75, 'n_units_2': 95, 'n_units_3': 17, 'n_units_4': 27, 'n_units_5': 34, 'n_units_6': 31, 'n_units_7': 94, 'n_units_8': 16, 'n_units_9': 83, 'n_units_10': 2, 'activation': 'logistic', 'learning_rate': 3.5361899255038796e-05, 'batch_size': 128, 'optimizer': 'RMSprop', 'max_epochs': 500}. Best is trial 33 with value: 12.095805148780531.
2025-05-08 01:43:51.6219Z [I 2025-05-08 04:43:51,621] Trial 58 finished with value: 15.134040085566161 and parameters: {'n_layers': 3, 'n_units_0': 15, 'n_units_1': 97, 'n_units_2': 35, 'activation': 'relu', 'learning_rate': 0.00017203220962757853, 'batch_size': 128, 'optimizer': 'SGD', 'max_epochs': 363}. Best is trial 33 with value: 12.095805148780531.
2025-05-08 02:42:17.0559Z [I 2025-05-08 05:42:17,055] Trial 59 finished with value: 12.280305083520357 and parameters: {'n_layers': 8, 'n_units_0': 27, 'n_units_1': 85, 'n_units_2': 28, 'n_units_3': 28, 'n_units_4': 55, 'n_units_5': 9, 'n_units_6': 57, 'n_units_7': 78, 'activation': 'tanh', 'learning_rate': 0.00010005452821892067, 'batch_size': 16, 'optimizer': 'RMSprop', 'max_epochs': 244}. Best is trial 33 with value: 12.095805148780531.
2025-05-08 03:24:40.3020Z [I 2025-05-08 06:24:40,301] Trial 60 finished with value: 22.223891810110576 and parameters: {'n_layers': 1, 'n_units_0': 28, 'activation': 'tanh', 'learning_rate': 0.00010865614486679628, 'batch_size': 16, 'optimizer': 'RMSprop', 'max_epochs': 246}. Best is trial 33 with value: 12.095805148780531.
2025-05-08 03:55:52.1105Z [I 2025-05-08 06:55:52,110] Trial 61 finished with value: 96.9370567365752 and parameters: {'n_layers': 7, 'n_units_0': 24, 'n_units_1': 85, 'n_units_2': 24, 'n_units_3': 26, 'n_units_4': 57, 'n_units_5': 12, 'n_units_6': 54, 'activation': 'tanh', 'learning_rate': 7.588835073264542e-05, 'batch_size': 16, 'optimizer': 'RMSprop', 'max_epochs': 104}. Best is trial 33 with value: 12.095805148780531.
2025-05-08 04:56:21.8257Z [I 2025-05-08 07:56:21,825] Trial 62 finished with value: 20.064925287840985 and parameters: {'n_layers': 8, 'n_units_0': 45, 'n_units_1': 79, 'n_units_2': 30, 'n_units_3': 40, 'n_units_4': 46, 'n_units_5': 18, 'n_units_6': 48, 'n_units_7': 75, 'activation': 'tanh', 'learning_rate': 5.789862080434646e-05, 'batch_size': 16, 'optimizer': 'RMSprop', 'max_epochs': 312}. Best is trial 33 with value: 12.095805148780531.
2025-05-08 06:05:29.3250Z [I 2025-05-08 09:05:29,324] Trial 63 finished with value: 45.70763866600281 and parameters: {'n_layers': 9, 'n_units_0': 39, 'n_units_1': 88, 'n_units_2': 25, 'n_units_3': 35, 'n_units_4': 67, 'n_units_5': 7, 'n_units_6': 70, 'n_units_7': 81, 'n_units_8': 58, 'activation': 'tanh', 'learning_rate': 1.9629125734266028e-05, 'batch_size': 16, 'optimizer': 'RMSprop', 'max_epochs': 168}. Best is trial 33 with value: 12.095805148780531.
2025-05-08 06:17:35.0339Z [I 2025-05-08 09:17:35,033] Trial 64 finished with value: 123.59946652392962 and parameters: {'n_layers': 10, 'n_units_0': 35, 'n_units_1': 53, 'n_units_2': 14, 'n_units_3': 28, 'n_units_4': 59, 'n_units_5': 40, 'n_units_6': 60, 'n_units_7': 90, 'n_units_8': 38, 'n_units_9': 54, 'activation': 'tanh', 'learning_rate': 3.086142096914934e-05, 'batch_size': 256, 'optimizer': 'RMSprop', 'max_epochs': 216}. Best is trial 33 with value: 12.095805148780531.
2025-05-08 06:19:46.8929Z [I 2025-05-08 09:19:46,892] Trial 65 finished with value: 466.96936797288964 and parameters: {'n_layers': 6, 'n_units_0': 82, 'n_units_1': 99, 'n_units_2': 18, 'n_units_3': 48, 'n_units_4': 33, 'n_units_5': 22, 'activation': 'tanh', 'learning_rate': 0.0002333905478447915, 'batch_size': 32, 'optimizer': 'LBFGS', 'max_epochs': 443}. Best is trial 33 with value: 12.095805148780531.
2025-05-08 06:26:26.7655Z [I 2025-05-08 09:26:26,765] Trial 66 finished with value: 21.334916215029853 and parameters: {'n_layers': 7, 'n_units_0': 12, 'n_units_1': 73, 'n_units_2': 62, 'n_units_3': 19, 'n_units_4': 49, 'n_units_5': 16, 'n_units_6': 41, 'activation': 'relu', 'learning_rate': 1.3152352829721774e-05, 'batch_size': 128, 'optimizer': 'SGD', 'max_epochs': 378}. Best is trial 33 with value: 12.095805148780531.
2025-05-08 07:30:29.3446Z [I 2025-05-08 10:30:29,344] Trial 67 finished with value: 11.607758236176839 and parameters: {'n_layers': 8, 'n_units_0': 18, 'n_units_1': 92, 'n_units_2': 39, 'n_units_3': 12, 'n_units_4': 71, 'n_units_5': 46, 'n_units_6': 35, 'n_units_7': 62, 'activation': 'tanh', 'learning_rate': 0.0001471026814632439, 'batch_size': 16, 'optimizer': 'Adam', 'max_epochs': 342}. Best is trial 67 with value: 11.607758236176839.
2025-05-08 08:44:00.2240Z [I 2025-05-08 11:44:00,223] Trial 68 finished with value: 96.97480745662762 and parameters: {'n_layers': 9, 'n_units_0': 18, 'n_units_1': 96, 'n_units_2': 41, 'n_units_3': 43, 'n_units_4': 70, 'n_units_5': 46, 'n_units_6': 35, 'n_units_7': 63, 'n_units_8': 15, 'activation': 'tanh', 'learning_rate': 0.0001521258542985675, 'batch_size': 16, 'optimizer': 'Adam', 'max_epochs': 287}. Best is trial 67 with value: 11.607758236176839.
2025-05-08 09:39:16.9415Z [I 2025-05-08 12:39:16,941] Trial 69 finished with value: 21.632149457155634 and parameters: {'n_layers': 8, 'n_units_0': 22, 'n_units_1': 92, 'n_units_2': 36, 'n_units_3': 1, 'n_units_4': 63, 'n_units_5': 57, 'n_units_6': 16, 'n_units_7': 70, 'activation': 'logistic', 'learning_rate': 0.0004386218493466974, 'batch_size': 16, 'optimizer': 'Adam', 'max_epochs': 343}. Best is trial 67 with value: 11.607758236176839.
2025-05-08 09:50:17.0932Z [I 2025-05-08 12:50:17,093] Trial 70 finished with value: 97.77388914448223 and parameters: {'n_layers': 10, 'n_units_0': 3, 'n_units_1': 100, 'n_units_2': 43, 'n_units_3': 57, 'n_units_4': 95, 'n_units_5': 63, 'n_units_6': 67, 'n_units_7': 78, 'n_units_8': 89, 'n_units_9': 21, 'activation': 'tanh', 'learning_rate': 0.0011662776705760923, 'batch_size': 16, 'optimizer': 'Adam', 'max_epochs': 327}. Best is trial 67 with value: 11.607758236176839.
2025-05-08 11:06:00.0767Z [I 2025-05-08 14:06:00,076] Trial 71 finished with value: 19.734728353180547 and parameters: {'n_layers': 8, 'n_units_0': 27, 'n_units_1': 88, 'n_units_2': 46, 'n_units_3': 13, 'n_units_4': 84, 'n_units_5': 30, 'n_units_6': 46, 'n_units_7': 96, 'activation': 'tanh', 'learning_rate': 5.412339413405065e-05, 'batch_size': 16, 'optimizer': 'Adam', 'max_epochs': 359}. Best is trial 67 with value: 11.607758236176839.
2025-05-08 11:25:59.9394Z [I 2025-05-08 14:25:59,939] Trial 72 finished with value: 17.197707373833747 and parameters: {'n_layers': 5, 'n_units_0': 14, 'n_units_1': 82, 'n_units_2': 33, 'n_units_3': 5, 'n_units_4': 76, 'activation': 'tanh', 'learning_rate': 0.00012687461422298044, 'batch_size': 128, 'optimizer': 'RMSprop', 'max_epochs': 416}. Best is trial 67 with value: 11.607758236176839.
2025-05-08 11:30:32.9018Z [I 2025-05-08 14:30:32,901] Trial 73 finished with value: 58.944614082177814 and parameters: {'n_layers': 8, 'n_units_0': 50, 'n_units_1': 91, 'n_units_2': 27, 'n_units_3': 22, 'n_units_4': 55, 'n_units_5': 39, 'n_units_6': 40, 'n_units_7': 63, 'activation': 'tanh', 'learning_rate': 0.0003636709567028294, 'batch_size': 128, 'optimizer': 'SGD', 'max_epochs': 392}. Best is trial 67 with value: 11.607758236176839.
2025-05-08 12:06:37.8117Z [I 2025-05-08 15:06:37,811] Trial 74 finished with value: 96.92404504462502 and parameters: {'n_layers': 9, 'n_units_0': 10, 'n_units_1': 86, 'n_units_2': 53, 'n_units_3': 33, 'n_units_4': 42, 'n_units_5': 45, 'n_units_6': 57, 'n_units_7': 84, 'n_units_8': 58, 'activation': 'tanh', 'learning_rate': 9.659997416933419e-05, 'batch_size': 64, 'optimizer': 'Adam', 'max_epochs': 373}. Best is trial 67 with value: 11.607758236176839.
2025-05-08 12:13:09.8990Z [I 2025-05-08 15:13:09,898] Trial 75 finished with value: 13.129230507748195 and parameters: {'n_layers': 5, 'n_units_0': 19, 'n_units_1': 77, 'n_units_2': 97, 'n_units_3': 11, 'n_units_4': 100, 'activation': 'tanh', 'learning_rate': 0.0006434711913948444, 'batch_size': 128, 'optimizer': 'RMSprop', 'max_epochs': 297}. Best is trial 67 with value: 11.607758236176839.
2025-05-08 12:28:08.6341Z [I 2025-05-08 15:28:08,633] Trial 76 finished with value: 11.03507674197021 and parameters: {'n_layers': 4, 'n_units_0': 20, 'n_units_1': 76, 'n_units_2': 96, 'n_units_3': 38, 'activation': 'tanh', 'learning_rate': 0.0007789439012263579, 'batch_size': 16, 'optimizer': 'RMSprop', 'max_epochs': 296}. Best is trial 76 with value: 11.03507674197021.
2025-05-08 12:35:48.6598Z [I 2025-05-08 15:35:48,659] Trial 77 finished with value: 23.630924511362622 and parameters: {'n_layers': 3, 'n_units_0': 27, 'n_units_1': 68, 'n_units_2': 39, 'activation': 'relu', 'learning_rate': 0.086968393458761, 'batch_size': 16, 'optimizer': 'RMSprop', 'max_epochs': 349}. Best is trial 76 with value: 11.03507674197021.
2025-05-08 13:10:07.0542Z [I 2025-05-08 16:10:07,053] Trial 78 finished with value: 10.957063627960183 and parameters: {'n_layers': 6, 'n_units_0': 8, 'n_units_1': 48, 'n_units_2': 84, 'n_units_3': 39, 'n_units_4': 79, 'n_units_5': 59, 'activation': 'tanh', 'learning_rate': 0.0002828361822099296, 'batch_size': 16, 'optimizer': 'RMSprop', 'max_epochs': 316}. Best is trial 78 with value: 10.957063627960183.
2025-05-08 13:26:46.9391Z [I 2025-05-08 16:26:46,938] Trial 79 finished with value: 13.220722024334624 and parameters: {'n_layers': 6, 'n_units_0': 8, 'n_units_1': 56, 'n_units_2': 77, 'n_units_3': 38, 'n_units_4': 61, 'n_units_5': 76, 'activation': 'tanh', 'learning_rate': 0.0016935808611978351, 'batch_size': 16, 'optimizer': 'RMSprop', 'max_epochs': 257}. Best is trial 78 with value: 10.957063627960183.
2025-05-08 14:02:43.6100Z [I 2025-05-08 17:02:43,609] Trial 80 finished with value: 10.655451322365504 and parameters: {'n_layers': 4, 'n_units_0': 12, 'n_units_1': 48, 'n_units_2': 83, 'n_units_3': 48, 'activation': 'tanh', 'learning_rate': 0.00023988918306936202, 'batch_size': 16, 'optimizer': 'RMSprop', 'max_epochs': 317}. Best is trial 80 with value: 10.655451322365504.
2025-05-08 14:37:02.5448Z [I 2025-05-08 17:37:02,544] Trial 81 finished with value: 12.80930671906356 and parameters: {'n_layers': 4, 'n_units_0': 5, 'n_units_1': 42, 'n_units_2': 83, 'n_units_3': 48, 'activation': 'tanh', 'learning_rate': 0.00027082857118285885, 'batch_size': 16, 'optimizer': 'RMSprop', 'max_epochs': 277}. Best is trial 80 with value: 10.655451322365504.
2025-05-08 15:15:23.0544Z [I 2025-05-08 18:15:23,054] Trial 82 finished with value: 13.114790951411264 and parameters: {'n_layers': 4, 'n_units_0': 5, 'n_units_1': 46, 'n_units_2': 83, 'n_units_3': 51, 'activation': 'tanh', 'learning_rate': 0.0002529418924987105, 'batch_size': 16, 'optimizer': 'RMSprop', 'max_epochs': 278}. Best is trial 80 with value: 10.655451322365504.
2025-05-08 15:54:08.6608Z [I 2025-05-08 18:54:08,660] Trial 83 finished with value: 11.019373392612682 and parameters: {'n_layers': 3, 'n_units_0': 12, 'n_units_1': 30, 'n_units_2': 73, 'activation': 'tanh', 'learning_rate': 0.0004905045670032936, 'batch_size': 16, 'optimizer': 'RMSprop', 'max_epochs': 310}. Best is trial 80 with value: 10.655451322365504.
2025-05-08 16:35:13.5493Z [I 2025-05-08 19:35:13,549] Trial 84 finished with value: 12.62651370199239 and parameters: {'n_layers': 3, 'n_units_0': 13, 'n_units_1': 17, 'n_units_2': 72, 'activation': 'tanh', 'learning_rate': 0.0005063037680982563, 'batch_size': 16, 'optimizer': 'RMSprop', 'max_epochs': 315}. Best is trial 80 with value: 10.655451322365504.
2025-05-08 17:07:35.2280Z [I 2025-05-08 20:07:35,227] Trial 85 finished with value: 17.83261268561936 and parameters: {'n_layers': 2, 'n_units_0': 10, 'n_units_1': 22, 'activation': 'tanh', 'learning_rate': 0.0008602951414822854, 'batch_size': 16, 'optimizer': 'RMSprop', 'max_epochs': 329}. Best is trial 80 with value: 10.655451322365504.
2025-05-08 17:31:01.2675Z [I 2025-05-08 20:31:01,267] Trial 86 finished with value: 10.418329416446278 and parameters: {'n_layers': 3, 'n_units_0': 16, 'n_units_1': 39, 'n_units_2': 80, 'activation': 'tanh', 'learning_rate': 0.0006385991145752322, 'batch_size': 16, 'optimizer': 'RMSprop', 'max_epochs': 238}. Best is trial 86 with value: 10.418329416446278.
2025-05-08 17:47:59.3336Z [I 2025-05-08 20:47:59,333] Trial 87 finished with value: 12.422437585530718 and parameters: {'n_layers': 3, 'n_units_0': 16, 'n_units_1': 30, 'n_units_2': 68, 'activation': 'tanh', 'learning_rate': 0.0012684323631227032, 'batch_size': 16, 'optimizer': 'RMSprop', 'max_epochs': 220}. Best is trial 86 with value: 10.418329416446278.
2025-05-08 18:15:22.2701Z [I 2025-05-08 21:15:22,269] Trial 88 finished with value: 19.981294658516717 and parameters: {'n_layers': 2, 'n_units_0': 12, 'n_units_1': 40, 'activation': 'tanh', 'learning_rate': 0.0010447247041569766, 'batch_size': 16, 'optimizer': 'RMSprop', 'max_epochs': 242}. Best is trial 86 with value: 10.418329416446278.
2025-05-08 18:46:08.2152Z [I 2025-05-08 21:46:08,215] Trial 89 finished with value: 11.569782994509406 and parameters: {'n_layers': 4, 'n_units_0': 8, 'n_units_1': 34, 'n_units_2': 74, 'n_units_3': 55, 'activation': 'tanh', 'learning_rate': 0.00039360564512329777, 'batch_size': 16, 'optimizer': 'RMSprop', 'max_epochs': 233}. Best is trial 86 with value: 10.418329416446278.
2025-05-08 18:52:35.1859Z [I 2025-05-08 21:52:35,185] Trial 90 finished with value: 44.77679425451243 and parameters: {'n_layers': 3, 'n_units_0': 1, 'n_units_1': 32, 'n_units_2': 75, 'activation': 'tanh', 'learning_rate': 0.00039957955053471694, 'batch_size': 16, 'optimizer': 'RMSprop', 'max_epochs': 204}. Best is trial 86 with value: 10.418329416446278.
2025-05-08 19:08:27.8349Z [I 2025-05-08 22:08:27,834] Trial 91 finished with value: 13.212480505691627 and parameters: {'n_layers': 5, 'n_units_0': 7, 'n_units_1': 38, 'n_units_2': 81, 'n_units_3': 65, 'n_units_4': 78, 'activation': 'tanh', 'learning_rate': 0.0006499891399577739, 'batch_size': 16, 'optimizer': 'RMSprop', 'max_epochs': 304}. Best is trial 86 with value: 10.418329416446278.
2025-05-08 19:59:06.2913Z [I 2025-05-08 22:59:06,291] Trial 92 finished with value: 12.620858599055127 and parameters: {'n_layers': 4, 'n_units_0': 17, 'n_units_1': 26, 'n_units_2': 86, 'n_units_3': 55, 'activation': 'tanh', 'learning_rate': 0.00019581188206936072, 'batch_size': 16, 'optimizer': 'RMSprop', 'max_epochs': 229}. Best is trial 86 with value: 10.418329416446278.
2025-05-08 20:48:36.3943Z [I 2025-05-08 23:48:36,394] Trial 93 finished with value: 12.355634854044707 and parameters: {'n_layers': 3, 'n_units_0': 9, 'n_units_1': 48, 'n_units_2': 78, 'activation': 'tanh', 'learning_rate': 0.00028701536850761364, 'batch_size': 16, 'optimizer': 'RMSprop', 'max_epochs': 269}. Best is trial 86 with value: 10.418329416446278.
2025-05-08 21:30:59.7812Z [I 2025-05-09 00:30:59,780] Trial 94 finished with value: 20.269835000253455 and parameters: {'n_layers': 2, 'n_units_0': 14, 'n_units_1': 35, 'activation': 'tanh', 'learning_rate': 0.0004811836924062002, 'batch_size': 16, 'optimizer': 'RMSprop', 'max_epochs': 293}. Best is trial 86 with value: 10.418329416446278.
2025-05-08 22:02:16.0293Z [I 2025-05-09 01:02:16,029] Trial 95 finished with value: 11.353073954132766 and parameters: {'n_layers': 4, 'n_units_0': 20, 'n_units_1': 30, 'n_units_2': 89, 'n_units_3': 44, 'activation': 'tanh', 'learning_rate': 0.0003250955065809935, 'batch_size': 16, 'optimizer': 'RMSprop', 'max_epochs': 200}. Best is trial 86 with value: 10.418329416446278.
2025-05-08 22:32:28.3627Z [I 2025-05-09 01:32:28,362] Trial 96 finished with value: 10.994529751119062 and parameters: {'n_layers': 4, 'n_units_0': 20, 'n_units_1': 27, 'n_units_2': 74, 'n_units_3': 61, 'activation': 'tanh', 'learning_rate': 0.0003226567227991432, 'batch_size': 16, 'optimizer': 'RMSprop', 'max_epochs': 231}. Best is trial 86 with value: 10.418329416446278.
2025-05-08 23:04:32.5985Z [I 2025-05-09 02:04:32,598] Trial 97 finished with value: 10.16275295116371 and parameters: {'n_layers': 4, 'n_units_0': 19, 'n_units_1': 26, 'n_units_2': 64, 'n_units_3': 62, 'activation': 'tanh', 'learning_rate': 0.0003483657318245913, 'batch_size': 16, 'optimizer': 'RMSprop', 'max_epochs': 198}. Best is trial 97 with value: 10.16275295116371.
2025-05-08 23:27:03.7720Z [I 2025-05-09 02:27:03,771] Trial 98 finished with value: 22.179228624391943 and parameters: {'n_layers': 4, 'n_units_0': 4, 'n_units_1': 29, 'n_units_2': 61, 'n_units_3': 61, 'activation': 'tanh', 'learning_rate': 0.00035152440725382683, 'batch_size': 16, 'optimizer': 'RMSprop', 'max_epochs': 207}. Best is trial 97 with value: 10.16275295116371.
2025-05-08 23:54:57.8088Z [I 2025-05-09 02:54:57,808] Trial 99 finished with value: 12.574360121720037 and parameters: {'n_layers': 4, 'n_units_0': 19, 'n_units_1': 22, 'n_units_2': 75, 'n_units_3': 74, 'activation': 'tanh', 'learning_rate': 0.00041323742160647, 'batch_size': 16, 'optimizer': 'RMSprop', 'max_epochs': 161}. Best is trial 97 with value: 10.16275295116371.
2025-05-09 00:25:06.8973Z [I 2025-05-09 03:25:06,897] Trial 100 finished with value: 10.631874642924059 and parameters: {'n_layers': 5, 'n_units_0': 23, 'n_units_1': 25, 'n_units_2': 66, 'n_units_3': 71, 'n_units_4': 85, 'activation': 'tanh', 'learning_rate': 0.0003210912926551867, 'batch_size': 16, 'optimizer': 'RMSprop', 'max_epochs': 197}. Best is trial 97 with value: 10.16275295116371.
2025-05-09 00:46:49.8876Z [I 2025-05-09 03:46:49,887] Trial 101 finished with value: 14.427852693648122 and parameters: {'n_layers': 5, 'n_units_0': 23, 'n_units_1': 26, 'n_units_2': 67, 'n_units_3': 70, 'n_units_4': 87, 'activation': 'tanh', 'learning_rate': 0.0007339099395747654, 'batch_size': 16, 'optimizer': 'RMSprop', 'max_epochs': 202}. Best is trial 97 with value: 10.16275295116371.
2025-05-09 01:16:03.7081Z [I 2025-05-09 04:16:03,707] Trial 102 finished with value: 10.806960257845331 and parameters: {'n_layers': 5, 'n_units_0': 20, 'n_units_1': 33, 'n_units_2': 64, 'n_units_3': 62, 'n_units_4': 84, 'activation': 'tanh', 'learning_rate': 0.00032213626703897377, 'batch_size': 16, 'optimizer': 'RMSprop', 'max_epochs': 236}. Best is trial 97 with value: 10.16275295116371.
2025-05-09 01:45:39.8683Z [I 2025-05-09 04:45:39,868] Trial 103 finished with value: 10.139008803217342 and parameters: {'n_layers': 5, 'n_units_0': 15, 'n_units_1': 33, 'n_units_2': 71, 'n_units_3': 64, 'n_units_4': 96, 'activation': 'tanh', 'learning_rate': 0.0003139829355590745, 'batch_size': 16, 'optimizer': 'RMSprop', 'max_epochs': 230}. Best is trial 103 with value: 10.139008803217342.
2025-05-09 02:16:52.1649Z [I 2025-05-09 05:16:52,164] Trial 104 finished with value: 11.214162754707214 and parameters: {'n_layers': 5, 'n_units_0': 20, 'n_units_1': 29, 'n_units_2': 64, 'n_units_3': 62, 'n_units_4': 82, 'activation': 'tanh', 'learning_rate': 0.00029812375239059147, 'batch_size': 16, 'optimizer': 'RMSprop', 'max_epochs': 186}. Best is trial 103 with value: 10.139008803217342.
2025-05-09 02:23:08.3536Z [I 2025-05-09 05:23:08,353] Trial 105 finished with value: 97.77166679629124 and parameters: {'n_layers': 5, 'n_units_0': 15, 'n_units_1': 27, 'n_units_2': 70, 'n_units_3': 62, 'n_units_4': 82, 'activation': 'logistic', 'learning_rate': 0.00019275313044671177, 'batch_size': 16, 'optimizer': 'RMSprop', 'max_epochs': 188}. Best is trial 103 with value: 10.139008803217342.
2025-05-09 02:49:47.3459Z [I 2025-05-09 05:49:47,345] Trial 106 finished with value: 20.292590152267174 and parameters: {'n_layers': 5, 'n_units_0': 11, 'n_units_1': 22, 'n_units_2': 64, 'n_units_3': 78, 'n_units_4': 97, 'activation': 'tanh', 'learning_rate': 0.00024879093193785553, 'batch_size': 16, 'optimizer': 'RMSprop', 'max_epochs': 256}. Best is trial 103 with value: 10.139008803217342.
