2025-05-14 03:32:23.8706Z [I 2025-05-14 06:32:23,870] Trial 58 finished with value: 7.927287583261653 and parameters: {'n_layers': 3, 'n_units_0': 84, 'n_units_1': 8, 'n_units_2': 57, 'activation': 'tanh', 'learning_rate': 0.02606277776989927, 'batch_size': 32768, 'optimizer': 'LBFGS', 'max_epochs': 179}. Best is trial 26 with value: 6.512729797409263.
2025-05-14 03:32:51.5800Z [I 2025-05-14 06:32:51,579] Trial 57 finished with value: 94.77415589178307 and parameters: {'n_layers': 13, 'n_units_0': 74, 'n_units_1': 44, 'n_units_2': 96, 'n_units_3': 47, 'n_units_4': 77, 'n_units_5': 44, 'n_units_6': 57, 'n_units_7': 42, 'n_units_8': 26, 'n_units_9': 1, 'n_units_10': 95, 'n_units_11': 100, 'n_units_12': 95, 'activation': 'tanh', 'learning_rate': 0.002030215858078804, 'batch_size': 32768, 'optimizer': 'LBFGS', 'max_epochs': 391}. Best is trial 26 with value: 6.512729797409263.
2025-05-14 03:33:16.3920Z [I 2025-05-14 06:33:16,391] Trial 49 finished with value: 71.45247409773506 and parameters: {'n_layers': 9, 'n_units_0': 80, 'n_units_1': 30, 'n_units_2': 36, 'n_units_3': 11, 'n_units_4': 38, 'n_units_5': 68, 'n_units_6': 98, 'n_units_7': 3, 'n_units_8': 1, 'activation': 'tanh', 'learning_rate': 0.0014088952253309519, 'batch_size': 32768, 'optimizer': 'SGD', 'max_epochs': 125}. Best is trial 26 with value: 6.512729797409263.
2025-05-14 03:33:22.7427Z [I 2025-05-14 06:33:22,742] Trial 59 finished with value: 175.26831551046243 and parameters: {'n_layers': 3, 'n_units_0': 81, 'n_units_1': 6, 'n_units_2': 86, 'activation': 'tanh', 'learning_rate': 0.011952059547480945, 'batch_size': 32768, 'optimizer': 'LBFGS', 'max_epochs': 176}. Best is trial 26 with value: 6.512729797409263.
2025-05-14 03:34:14.4872Z [I 2025-05-14 06:34:14,486] Trial 51 finished with value: 77.58657588663453 and parameters: {'n_layers': 9, 'n_units_0': 94, 'n_units_1': 29, 'n_units_2': 38, 'n_units_3': 10, 'n_units_4': 40, 'n_units_5': 20, 'n_units_6': 81, 'n_units_7': 3, 'n_units_8': 1, 'activation': 'tanh', 'learning_rate': 0.0010824634090664364, 'batch_size': 32768, 'optimizer': 'SGD', 'max_epochs': 113}. Best is trial 26 with value: 6.512729797409263.
2025-05-14 03:47:15.9179Z [I 2025-05-14 06:47:15,917] Trial 60 finished with value: 6.280200775727418 and parameters: {'n_layers': 3, 'n_units_0': 83, 'n_units_1': 8, 'n_units_2': 57, 'activation': 'tanh', 'learning_rate': 0.013149132409643716, 'batch_size': 32768, 'optimizer': 'LBFGS', 'max_epochs': 327}. Best is trial 60 with value: 6.280200775727418.
2025-05-14 03:47:53.5224Z [I 2025-05-14 06:47:53,522] Trial 63 finished with value: 3576.5421848483766 and parameters: {'n_layers': 3, 'n_units_0': 83, 'n_units_1': 5, 'n_units_2': 58, 'activation': 'tanh', 'learning_rate': 0.015322346848608453, 'batch_size': 32768, 'optimizer': 'LBFGS', 'max_epochs': 327}. Best is trial 60 with value: 6.280200775727418.
2025-05-14 03:48:16.1149Z [I 2025-05-14 06:48:16,114] Trial 62 finished with value: 7.597562609882461 and parameters: {'n_layers': 3, 'n_units_0': 82, 'n_units_1': 6, 'n_units_2': 87, 'activation': 'tanh', 'learning_rate': 0.013834377541670223, 'batch_size': 32768, 'optimizer': 'LBFGS', 'max_epochs': 182}. Best is trial 60 with value: 6.280200775727418.
2025-05-14 03:49:55.2107Z [I 2025-05-14 06:49:55,210] Trial 61 finished with value: 7.287456961188974 and parameters: {'n_layers': 3, 'n_units_0': 76, 'n_units_1': 6, 'n_units_2': 58, 'activation': 'tanh', 'learning_rate': 0.013091473737962347, 'batch_size': 32768, 'optimizer': 'LBFGS', 'max_epochs': 493}. Best is trial 60 with value: 6.280200775727418.
2025-05-14 03:51:00.1122Z [I 2025-05-14 06:51:00,112] Trial 67 finished with value: 72.56676613212828 and parameters: {'n_layers': 15, 'n_units_0': 83, 'n_units_1': 17, 'n_units_2': 57, 'n_units_3': 76, 'n_units_4': 20, 'n_units_5': 77, 'n_units_6': 70, 'n_units_7': 37, 'n_units_8': 50, 'n_units_9': 67, 'n_units_10': 100, 'n_units_11': 70, 'n_units_12': 96, 'n_units_13': 1, 'n_units_14': 100, 'activation': 'tanh', 'learning_rate': 0.027463687183347057, 'batch_size': 32768, 'optimizer': 'Adam', 'max_epochs': 234}. Best is trial 60 with value: 6.280200775727418.
2025-05-14 04:10:36.3873Z [I 2025-05-14 07:10:36,387] Trial 68 finished with value: 7.3749857756913935 and parameters: {'n_layers': 3, 'n_units_0': 55, 'n_units_1': 16, 'n_units_2': 57, 'activation': 'tanh', 'learning_rate': 0.025426257476968573, 'batch_size': 32768, 'optimizer': 'LBFGS', 'max_epochs': 328}. Best is trial 60 with value: 6.280200775727418.
2025-05-14 04:23:52.8874Z [I 2025-05-14 07:23:52,887] Trial 72 finished with value: 8.369924800995312 and parameters: {'n_layers': 2, 'n_units_0': 70, 'n_units_1': 8, 'activation': 'tanh', 'learning_rate': 0.055943708274605916, 'batch_size': 32768, 'optimizer': 'LBFGS', 'max_epochs': 478}. Best is trial 60 with value: 6.280200775727418.
2025-05-14 04:40:29.6606Z [I 2025-05-14 07:40:29,660] Trial 73 finished with value: 9.519643852560339 and parameters: {'n_layers': 2, 'n_units_0': 69, 'n_units_1': 8, 'activation': 'tanh', 'learning_rate': 0.024321115485021173, 'batch_size': 32768, 'optimizer': 'LBFGS', 'max_epochs': 408}. Best is trial 60 with value: 6.280200775727418.
2025-05-14 04:56:23.5935Z [I 2025-05-14 07:56:23,593] Trial 74 finished with value: 4430.805795789294 and parameters: {'n_layers': 2, 'n_units_0': 76, 'n_units_1': 3, 'activation': 'tanh', 'learning_rate': 0.02396729333026787, 'batch_size': 32768, 'optimizer': 'LBFGS', 'max_epochs': 433}. Best is trial 60 with value: 6.280200775727418.
2025-05-14 05:01:17.4578Z [I 2025-05-14 08:01:17,457] Trial 65 finished with value: 23.51408061789122 and parameters: {'n_layers': 3, 'n_units_0': 83, 'n_units_1': 7, 'n_units_2': 58, 'activation': 'tanh', 'learning_rate': 0.014405200548409249, 'batch_size': 32768, 'optimizer': 'Adam', 'max_epochs': 180}. Best is trial 60 with value: 6.280200775727418.
2025-05-14 05:04:01.8549Z [I 2025-05-14 08:04:01,854] Trial 66 finished with value: 18.404840645321748 and parameters: {'n_layers': 3, 'n_units_0': 83, 'n_units_1': 6, 'n_units_2': 58, 'activation': 'tanh', 'learning_rate': 0.022610918500517423, 'batch_size': 32768, 'optimizer': 'Adam', 'max_epochs': 186}. Best is trial 60 with value: 6.280200775727418.
2025-05-14 05:06:07.9901Z [I 2025-05-14 08:06:07,989] Trial 64 finished with value: 24.402763635434308 and parameters: {'n_layers': 3, 'n_units_0': 54, 'n_units_1': 7, 'n_units_2': 59, 'activation': 'tanh', 'learning_rate': 0.012924461359090141, 'batch_size': 32768, 'optimizer': 'Adam', 'max_epochs': 191}. Best is trial 60 with value: 6.280200775727418.
2025-05-14 05:07:22.7439Z [I 2025-05-14 08:07:22,743] Trial 77 finished with value: 2072.177719212327 and parameters: {'n_layers': 5, 'n_units_0': 51, 'n_units_1': 15, 'n_units_2': 48, 'n_units_3': 64, 'n_units_4': 2, 'activation': 'tanh', 'learning_rate': 0.009778711810762017, 'batch_size': 32768, 'optimizer': 'LBFGS', 'max_epochs': 190}. Best is trial 60 with value: 6.280200775727418.
2025-05-14 05:18:13.6145Z [I 2025-05-14 08:18:13,614] Trial 78 finished with value: 84.85787750704115 and parameters: {'n_layers': 14, 'n_units_0': 53, 'n_units_1': 16, 'n_units_2': 69, 'n_units_3': 61, 'n_units_4': 87, 'n_units_5': 1, 'n_units_6': 44, 'n_units_7': 16, 'n_units_8': 100, 'n_units_9': 64, 'n_units_10': 1, 'n_units_11': 4, 'n_units_12': 62, 'n_units_13': 99, 'activation': 'tanh', 'learning_rate': 0.055184399752924634, 'batch_size': 32768, 'optimizer': 'LBFGS', 'max_epochs': 478}. Best is trial 60 with value: 6.280200775727418.
2025-05-14 05:19:56.0569Z [I 2025-05-14 08:19:56,056] Trial 69 finished with value: 40.88720222348385 and parameters: {'n_layers': 2, 'n_units_0': 75, 'n_units_1': 16, 'activation': 'tanh', 'learning_rate': 0.02372640747157078, 'batch_size': 32768, 'optimizer': 'Adam', 'max_epochs': 187}. Best is trial 60 with value: 6.280200775727418.
2025-05-14 05:22:53.5873Z [I 2025-05-14 08:22:53,587] Trial 79 finished with value: 79.87585888133692 and parameters: {'n_layers': 2, 'n_units_0': 59, 'n_units_1': 16, 'activation': 'tanh', 'learning_rate': 0.009568068993304155, 'batch_size': 32768, 'optimizer': 'LBFGS', 'max_epochs': 484}. Best is trial 60 with value: 6.280200775727418.
2025-05-14 05:37:01.4728Z [I 2025-05-14 08:37:01,472] Trial 70 finished with value: 30.366365437805424 and parameters: {'n_layers': 5, 'n_units_0': 69, 'n_units_1': 8, 'n_units_2': 70, 'n_units_3': 78, 'n_units_4': 18, 'activation': 'tanh', 'learning_rate': 0.02794775218227528, 'batch_size': 32768, 'optimizer': 'Adam', 'max_epochs': 230}. Best is trial 60 with value: 6.280200775727418.
2025-05-14 05:37:54.6433Z [I 2025-05-14 08:37:54,643] Trial 80 finished with value: 9.631040584953602 and parameters: {'n_layers': 2, 'n_units_0': 71, 'n_units_1': 3, 'activation': 'tanh', 'learning_rate': 0.05679765450152963, 'batch_size': 32768, 'optimizer': 'LBFGS', 'max_epochs': 489}. Best is trial 60 with value: 6.280200775727418.
2025-05-14 05:38:20.2570Z [I 2025-05-14 08:38:20,256] Trial 83 finished with value: 34.88657157097215 and parameters: {'n_layers': 4, 'n_units_0': 69, 'n_units_1': 10, 'n_units_2': 46, 'n_units_3': 82, 'activation': 'tanh', 'learning_rate': 0.04769150681247016, 'batch_size': 32768, 'optimizer': 'LBFGS', 'max_epochs': 336}. Best is trial 60 with value: 6.280200775727418.
2025-05-14 05:39:22.0736Z [I 2025-05-14 08:39:22,073] Trial 82 finished with value: 9.002375818957026 and parameters: {'n_layers': 2, 'n_units_0': 70, 'n_units_1': 10, 'activation': 'tanh', 'learning_rate': 0.0490698764792716, 'batch_size': 32768, 'optimizer': 'LBFGS', 'max_epochs': 486}. Best is trial 60 with value: 6.280200775727418.
2025-05-14 05:46:22.4230Z [I 2025-05-14 08:46:22,422] Trial 81 finished with value: 37.97481143746388 and parameters: {'n_layers': 2, 'n_units_0': 69, 'n_units_1': 2, 'activation': 'tanh', 'learning_rate': 0.04998496286905217, 'batch_size': 32768, 'optimizer': 'LBFGS', 'max_epochs': 472}. Best is trial 60 with value: 6.280200775727418.
2025-05-14 05:49:22.5628Z [I 2025-05-14 08:49:22,562] Trial 87 finished with value: 77.04846726959434 and parameters: {'n_layers': 4, 'n_units_0': 62, 'n_units_1': 1, 'n_units_2': 83, 'n_units_3': 53, 'activation': 'logistic', 'learning_rate': 0.08582089597706107, 'batch_size': 32768, 'optimizer': 'LBFGS', 'max_epochs': 454}. Best is trial 60 with value: 6.280200775727418.
2025-05-14 05:54:43.8179Z [I 2025-05-14 08:54:43,817] Trial 84 finished with value: 54.44030292009083 and parameters: {'n_layers': 4, 'n_units_0': 70, 'n_units_1': 3, 'n_units_2': 44, 'n_units_3': 66, 'activation': 'tanh', 'learning_rate': 0.04931282321387104, 'batch_size': 32768, 'optimizer': 'LBFGS', 'max_epochs': 497}. Best is trial 60 with value: 6.280200775727418.
2025-05-14 05:56:39.5036Z [I 2025-05-14 08:56:39,503] Trial 88 finished with value: 213.51322778109088 and parameters: {'n_layers': 4, 'n_units_0': 96, 'n_units_1': 24, 'n_units_2': 43, 'n_units_3': 52, 'activation': 'tanh', 'learning_rate': 0.01844731297737746, 'batch_size': 32768, 'optimizer': 'LBFGS', 'max_epochs': 288}. Best is trial 60 with value: 6.280200775727418.
2025-05-14 05:59:53.4925Z [I 2025-05-14 08:59:53,492] Trial 86 finished with value: 47.13221098675512 and parameters: {'n_layers': 4, 'n_units_0': 78, 'n_units_1': 24, 'n_units_2': 9, 'n_units_3': 99, 'activation': 'tanh', 'learning_rate': 0.074034736097337, 'batch_size': 32768, 'optimizer': 'LBFGS', 'max_epochs': 465}. Best is trial 60 with value: 6.280200775727418.
2025-05-14 06:01:27.7334Z [I 2025-05-14 09:01:27,733] Trial 85 finished with value: 6.651785486062211 and parameters: {'n_layers': 4, 'n_units_0': 59, 'n_units_1': 9, 'n_units_2': 44, 'n_units_3': 86, 'activation': 'tanh', 'learning_rate': 0.09962946473206757, 'batch_size': 32768, 'optimizer': 'LBFGS', 'max_epochs': 344}. Best is trial 60 with value: 6.280200775727418.
2025-05-14 06:06:08.4662Z [I 2025-05-14 09:06:08,466] Trial 89 finished with value: 7.314453646528686 and parameters: {'n_layers': 3, 'n_units_0': 58, 'n_units_1': 19, 'n_units_2': 43, 'activation': 'tanh', 'learning_rate': 0.018466428083900328, 'batch_size': 32768, 'optimizer': 'LBFGS', 'max_epochs': 274}. Best is trial 60 with value: 6.280200775727418.
2025-05-14 06:08:08.9320Z [I 2025-05-14 09:08:08,931] Trial 93 finished with value: 13974.764684959815 and parameters: {'n_layers': 3, 'n_units_0': 58, 'n_units_1': 19, 'n_units_2': 30, 'activation': 'relu', 'learning_rate': 0.007763899698498065, 'batch_size': 32768, 'optimizer': 'LBFGS', 'max_epochs': 351}. Best is trial 60 with value: 6.280200775727418.
2025-05-14 06:10:09.5507Z [I 2025-05-14 09:10:09,550] Trial 90 finished with value: 5.515917718916803 and parameters: {'n_layers': 3, 'n_units_0': 96, 'n_units_1': 19, 'n_units_2': 49, 'activation': 'tanh', 'learning_rate': 0.017909738075600444, 'batch_size': 32768, 'optimizer': 'LBFGS', 'max_epochs': 271}. Best is trial 90 with value: 5.515917718916803.
2025-05-14 06:11:07.5686Z [I 2025-05-14 09:11:07,568] Trial 76 finished with value: 73.02995291958977 and parameters: {'n_layers': 5, 'n_units_0': 48, 'n_units_1': 16, 'n_units_2': 47, 'n_units_3': 62, 'n_units_4': 2, 'activation': 'tanh', 'learning_rate': 0.016425146948038646, 'batch_size': 32768, 'optimizer': 'Adam', 'max_epochs': 190}. Best is trial 90 with value: 5.515917718916803.
2025-05-14 06:14:43.7263Z [I 2025-05-14 09:14:43,726] Trial 97 finished with value: 900.8228876976872 and parameters: {'n_layers': 10, 'n_units_0': 56, 'n_units_1': 19, 'n_units_2': 49, 'n_units_3': 84, 'n_units_4': 69, 'n_units_5': 61, 'n_units_6': 90, 'n_units_7': 60, 'n_units_8': 70, 'n_units_9': 31, 'activation': 'tanh', 'learning_rate': 0.004102574243083926, 'batch_size': 32768, 'optimizer': 'LBFGS', 'max_epochs': 273}. Best is trial 90 with value: 5.515917718916803.
2025-05-14 06:15:01.2162Z [I 2025-05-14 09:15:01,216] Trial 94 finished with value: 1000000.0 and parameters: {'n_layers': 5, 'n_units_0': 58, 'n_units_1': 83, 'n_units_2': 48, 'n_units_3': 84, 'n_units_4': 70, 'activation': 'relu', 'learning_rate': 0.008339048586749314, 'batch_size': 32768, 'optimizer': 'LBFGS', 'max_epochs': 310}. Best is trial 90 with value: 5.515917718916803.
2025-05-14 06:16:44.8022Z [I 2025-05-14 09:16:44,802] Trial 91 finished with value: 6.224290382966108 and parameters: {'n_layers': 3, 'n_units_0': 48, 'n_units_1': 12, 'n_units_2': 50, 'activation': 'tanh', 'learning_rate': 0.0072156861675569135, 'batch_size': 32768, 'optimizer': 'LBFGS', 'max_epochs': 309}. Best is trial 90 with value: 5.515917718916803.
2025-05-14 06:23:32.6734Z [I 2025-05-14 09:23:32,673] Trial 92 finished with value: 6.421328184881924 and parameters: {'n_layers': 3, 'n_units_0': 48, 'n_units_1': 13, 'n_units_2': 49, 'activation': 'tanh', 'learning_rate': 0.008919357516638943, 'batch_size': 32768, 'optimizer': 'LBFGS', 'max_epochs': 423}. Best is trial 90 with value: 5.515917718916803.
2025-05-14 06:24:09.6788Z [I 2025-05-14 09:24:09,678] Trial 95 finished with value: 7.151051061243905 and parameters: {'n_layers': 5, 'n_units_0': 61, 'n_units_1': 84, 'n_units_2': 48, 'n_units_3': 94, 'n_units_4': 69, 'activation': 'tanh', 'learning_rate': 0.017456361259240712, 'batch_size': 32768, 'optimizer': 'LBFGS', 'max_epochs': 316}. Best is trial 90 with value: 5.515917718916803.
2025-05-14 06:27:22.3824Z [I 2025-05-14 09:27:22,382] Trial 75 finished with value: 15.963290541033855 and parameters: {'n_layers': 5, 'n_units_0': 58, 'n_units_1': 4, 'n_units_2': 68, 'n_units_3': 64, 'n_units_4': 91, 'activation': 'tanh', 'learning_rate': 0.015676636566444347, 'batch_size': 32768, 'optimizer': 'Adam', 'max_epochs': 330}. Best is trial 90 with value: 5.515917718916803.
2025-05-14 06:27:32.0349Z [I 2025-05-14 09:27:32,034] Trial 99 finished with value: 852.4553873957276 and parameters: {'n_layers': 3, 'n_units_0': 89, 'n_units_1': 13, 'n_units_2': 55, 'activation': 'tanh', 'learning_rate': 0.01865109349295446, 'batch_size': 32768, 'optimizer': 'LBFGS', 'max_epochs': 294}. Best is trial 90 with value: 5.515917718916803.
2025-05-14 06:29:54.8136Z [I 2025-05-14 09:29:54,813] Trial 96 finished with value: 6.106067279123896 and parameters: {'n_layers': 5, 'n_units_0': 56, 'n_units_1': 25, 'n_units_2': 49, 'n_units_3': 86, 'n_units_4': 72, 'activation': 'tanh', 'learning_rate': 0.017554279401705487, 'batch_size': 32768, 'optimizer': 'LBFGS', 'max_epochs': 283}. Best is trial 90 with value: 5.515917718916803.
2025-05-14 06:32:33.9294Z [I 2025-05-14 09:32:33,929] Trial 100 finished with value: 100.69298460388141 and parameters: {'n_layers': 3, 'n_units_0': 47, 'n_units_1': 13, 'n_units_2': 53, 'activation': 'tanh', 'learning_rate': 6.946741574635447e-05, 'batch_size': 32768, 'optimizer': 'LBFGS', 'max_epochs': 291}. Best is trial 90 with value: 5.515917718916803.
2025-05-14 06:32:58.5200Z [I 2025-05-14 09:32:58,519] Trial 98 finished with value: 7.034205921637356 and parameters: {'n_layers': 3, 'n_units_0': 89, 'n_units_1': 13, 'n_units_2': 61, 'activation': 'tanh', 'learning_rate': 0.018286770361219645, 'batch_size': 32768, 'optimizer': 'LBFGS', 'max_epochs': 312}. Best is trial 90 with value: 5.515917718916803.
2025-05-14 06:34:13.4872Z [I 2025-05-14 09:34:13,487] Trial 106 finished with value: 77.02443555051215 and parameters: {'n_layers': 6, 'n_units_0': 39, 'n_units_1': 63, 'n_units_2': 61, 'n_units_3': 94, 'n_units_4': 86, 'n_units_5': 78, 'activation': 'logistic', 'learning_rate': 0.006682921758138303, 'batch_size': 32768, 'optimizer': 'LBFGS', 'max_epochs': 308}. Best is trial 90 with value: 5.515917718916803.
2025-05-14 06:34:16.8950Z [I 2025-05-14 09:34:16,894] Trial 102 finished with value: 8.510644418633065 and parameters: {'n_layers': 3, 'n_units_0': 42, 'n_units_1': 86, 'n_units_2': 55, 'activation': 'tanh', 'learning_rate': 0.019373456432209658, 'batch_size': 32768, 'optimizer': 'LBFGS', 'max_epochs': 293}. Best is trial 90 with value: 5.515917718916803.
2025-05-14 06:41:07.3697Z [I 2025-05-14 09:41:07,369] Trial 103 finished with value: 5.979916657342288 and parameters: {'n_layers': 3, 'n_units_0': 42, 'n_units_1': 64, 'n_units_2': 55, 'activation': 'tanh', 'learning_rate': 0.006487373189967395, 'batch_size': 32768, 'optimizer': 'LBFGS', 'max_epochs': 295}. Best is trial 90 with value: 5.515917718916803.
2025-05-14 06:44:44.2077Z [I 2025-05-14 09:44:44,207] Trial 101 finished with value: 6.6810542621256115 and parameters: {'n_layers': 3, 'n_units_0': 44, 'n_units_1': 13, 'n_units_2': 54, 'activation': 'tanh', 'learning_rate': 0.019089785041441397, 'batch_size': 32768, 'optimizer': 'LBFGS', 'max_epochs': 296}. Best is trial 90 with value: 5.515917718916803.
2025-05-14 07:24:08.9965Z [I 2025-05-14 10:24:08,996] Trial 71 finished with value: 33.41808906502304 and parameters: {'n_layers': 2, 'n_units_0': 71, 'n_units_1': 8, 'activation': 'tanh', 'learning_rate': 0.02548003205497388, 'batch_size': 32768, 'optimizer': 'Adam', 'max_epochs': 491}. Best is trial 90 with value: 5.515917718916803.
2025-05-14 07:38:25.3456Z [I 2025-05-14 10:38:25,345] Trial 107 finished with value: 28.14853615893063 and parameters: {'n_layers': 4, 'n_units_0': 38, 'n_units_1': 73, 'n_units_2': 51, 'n_units_3': 95, 'activation': 'tanh', 'learning_rate': 0.010221024226132091, 'batch_size': 32768, 'optimizer': 'RMSprop', 'max_epochs': 312}. Best is trial 90 with value: 5.515917718916803.
2025-05-14 07:57:41.2546Z [I 2025-05-14 10:57:41,254] Trial 113 finished with value: 9.720910129715222 and parameters: {'n_layers': 4, 'n_units_0': 31, 'n_units_1': 57, 'n_units_2': 50, 'n_units_3': 72, 'activation': 'tanh', 'learning_rate': 0.008115565842457022, 'batch_size': 32768, 'optimizer': 'LBFGS', 'max_epochs': 341}. Best is trial 90 with value: 5.515917718916803.
2025-05-14 07:59:35.2763Z [I 2025-05-14 10:59:35,276] Trial 108 finished with value: 23.19628608179079 and parameters: {'n_layers': 4, 'n_units_0': 52, 'n_units_1': 50, 'n_units_2': 51, 'n_units_3': 72, 'activation': 'tanh', 'learning_rate': 0.010418133732477446, 'batch_size': 32768, 'optimizer': 'RMSprop', 'max_epochs': 382}. Best is trial 90 with value: 5.515917718916803.
2025-05-14 08:10:21.0666Z [I 2025-05-14 11:10:21,066] Trial 114 finished with value: 692.8075355031872 and parameters: {'n_layers': 1, 'n_units_0': 42, 'activation': 'tanh', 'learning_rate': 0.0042385070686007924, 'batch_size': 32768, 'optimizer': 'LBFGS', 'max_epochs': 372}. Best is trial 90 with value: 5.515917718916803.
2025-05-14 08:14:13.6869Z [I 2025-05-14 11:14:13,686] Trial 115 finished with value: 9.900847011514225 and parameters: {'n_layers': 1, 'n_units_0': 49, 'activation': 'tanh', 'learning_rate': 0.0046516054406452656, 'batch_size': 32768, 'optimizer': 'LBFGS', 'max_epochs': 320}. Best is trial 90 with value: 5.515917718916803.
2025-05-14 08:28:03.3169Z [I 2025-05-14 11:28:03,316] Trial 117 finished with value: 936.7412262732969 and parameters: {'n_layers': 4, 'n_units_0': 46, 'n_units_1': 68, 'n_units_2': 65, 'n_units_3': 89, 'activation': 'tanh', 'learning_rate': 0.0028167852256930897, 'batch_size': 32768, 'optimizer': 'LBFGS', 'max_epochs': 348}. Best is trial 90 with value: 5.515917718916803.
2025-05-14 08:35:11.6544Z [I 2025-05-14 11:35:11,654] Trial 116 finished with value: 7.860427452286931 and parameters: {'n_layers': 4, 'n_units_0': 48, 'n_units_1': 87, 'n_units_2': 62, 'n_units_3': 90, 'activation': 'tanh', 'learning_rate': 0.00713159585100341, 'batch_size': 32768, 'optimizer': 'LBFGS', 'max_epochs': 320}. Best is trial 90 with value: 5.515917718916803.
2025-05-14 08:41:29.4625Z [I 2025-05-14 11:41:29,462] Trial 118 finished with value: 6.0038503372477825 and parameters: {'n_layers': 3, 'n_units_0': 62, 'n_units_1': 47, 'n_units_2': 60, 'activation': 'tanh', 'learning_rate': 0.034185342510611644, 'batch_size': 32768, 'optimizer': 'LBFGS', 'max_epochs': 301}. Best is trial 90 with value: 5.515917718916803.
