2025-05-08 09:48:32.6969Z [I 2025-05-08 12:48:32,696] Trial 182 finished with value: 8.45457076649685 and parameters: {'n_layers': 2, 'n_units_0': 57, 'n_units_1': 92, 'activation': 'tanh', 'learning_rate': 0.003403550333684309, 'batch_size': 128, 'optimizer': 'Adam', 'max_epochs': 175}. Best is trial 27 with value: 7.372662965998451.
2025-05-08 09:52:56.9335Z [I 2025-05-08 12:52:56,933] Trial 183 finished with value: 8.367715428898347 and parameters: {'n_layers': 2, 'n_units_0': 64, 'n_units_1': 96, 'activation': 'tanh', 'learning_rate': 0.004862116072710242, 'batch_size': 128, 'optimizer': 'Adam', 'max_epochs': 198}. Best is trial 27 with value: 7.372662965998451.
2025-05-08 09:54:20.5499Z [I 2025-05-08 12:54:20,549] Trial 184 finished with value: 68.40248819030636 and parameters: {'n_layers': 14, 'n_units_0': 95, 'n_units_1': 98, 'n_units_2': 20, 'n_units_3': 8, 'n_units_4': 35, 'n_units_5': 64, 'n_units_6': 14, 'n_units_7': 84, 'n_units_8': 85, 'n_units_9': 25, 'n_units_10': 29, 'n_units_11': 31, 'n_units_12': 40, 'n_units_13': 99, 'activation': 'tanh', 'learning_rate': 0.00257876340335393, 'batch_size': 128, 'optimizer': 'Adam', 'max_epochs': 164}. Best is trial 27 with value: 7.372662965998451.
2025-05-08 10:01:42.3173Z [I 2025-05-08 13:01:42,317] Trial 185 finished with value: 7.928294453146339 and parameters: {'n_layers': 2, 'n_units_0': 91, 'n_units_1': 94, 'activation': 'tanh', 'learning_rate': 0.0014463353072475405, 'batch_size': 128, 'optimizer': 'Adam', 'max_epochs': 144}. Best is trial 27 with value: 7.372662965998451.
2025-05-08 10:08:30.9662Z [I 2025-05-08 13:08:30,965] Trial 186 finished with value: 14.19594722456163 and parameters: {'n_layers': 1, 'n_units_0': 92, 'activation': 'tanh', 'learning_rate': 0.0018848315663047086, 'batch_size': 128, 'optimizer': 'Adam', 'max_epochs': 141}. Best is trial 27 with value: 7.372662965998451.
2025-05-08 10:13:23.5281Z [I 2025-05-08 13:13:23,527] Trial 187 finished with value: 7.846122960278694 and parameters: {'n_layers': 2, 'n_units_0': 91, 'n_units_1': 94, 'activation': 'tanh', 'learning_rate': 0.002259840157641065, 'batch_size': 128, 'optimizer': 'Adam', 'max_epochs': 109}. Best is trial 27 with value: 7.372662965998451.
2025-05-08 10:13:41.8141Z [I 2025-05-08 13:13:41,813] Trial 188 finished with value: 15.21277565373329 and parameters: {'n_layers': 2, 'n_units_0': 93, 'n_units_1': 94, 'activation': 'tanh', 'learning_rate': 0.0022362103059235384, 'batch_size': 128, 'optimizer': 'LBFGS', 'max_epochs': 61}. Best is trial 27 with value: 7.372662965998451.
2025-05-08 10:19:19.1486Z [I 2025-05-08 13:19:19,148] Trial 189 finished with value: 8.521898223319338 and parameters: {'n_layers': 2, 'n_units_0': 90, 'n_units_1': 97, 'activation': 'logistic', 'learning_rate': 0.010150141589326615, 'batch_size': 128, 'optimizer': 'Adam', 'max_epochs': 124}. Best is trial 27 with value: 7.372662965998451.
2025-05-08 10:24:54.6091Z [I 2025-05-08 13:24:54,608] Trial 190 finished with value: 14.071032025432327 and parameters: {'n_layers': 1, 'n_units_0': 88, 'activation': 'tanh', 'learning_rate': 0.002754802657374902, 'batch_size': 128, 'optimizer': 'Adam', 'max_epochs': 116}. Best is trial 27 with value: 7.372662965998451.
2025-05-08 10:32:40.0455Z [I 2025-05-08 13:32:40,045] Trial 191 finished with value: 7.878453299836528 and parameters: {'n_layers': 2, 'n_units_0': 90, 'n_units_1': 94, 'activation': 'tanh', 'learning_rate': 0.0016134943931967831, 'batch_size': 128, 'optimizer': 'Adam', 'max_epochs': 190}. Best is trial 27 with value: 7.372662965998451.
2025-05-08 10:40:46.2733Z [I 2025-05-08 13:40:46,273] Trial 192 finished with value: 8.080708605221451 and parameters: {'n_layers': 2, 'n_units_0': 95, 'n_units_1': 92, 'activation': 'tanh', 'learning_rate': 0.0016134253125086571, 'batch_size': 128, 'optimizer': 'Adam', 'max_epochs': 186}. Best is trial 27 with value: 7.372662965998451.
2025-05-08 10:48:12.2318Z [I 2025-05-08 13:48:12,231] Trial 193 finished with value: 7.581004808805546 and parameters: {'n_layers': 2, 'n_units_0': 87, 'n_units_1': 100, 'activation': 'tanh', 'learning_rate': 0.002020921047453858, 'batch_size': 128, 'optimizer': 'Adam', 'max_epochs': 222}. Best is trial 27 with value: 7.372662965998451.
2025-05-08 10:53:44.9942Z [I 2025-05-08 13:53:44,993] Trial 194 finished with value: 8.28467601227821 and parameters: {'n_layers': 2, 'n_units_0': 90, 'n_units_1': 95, 'activation': 'tanh', 'learning_rate': 0.001860083522695634, 'batch_size': 128, 'optimizer': 'Adam', 'max_epochs': 106}. Best is trial 27 with value: 7.372662965998451.
2025-05-08 10:58:02.6776Z [I 2025-05-08 13:58:02,677] Trial 195 finished with value: 7.826402668873584 and parameters: {'n_layers': 2, 'n_units_0': 98, 'n_units_1': 98, 'activation': 'tanh', 'learning_rate': 0.003577181430524967, 'batch_size': 128, 'optimizer': 'Adam', 'max_epochs': 174}. Best is trial 27 with value: 7.372662965998451.
2025-05-08 11:05:50.0997Z [I 2025-05-08 14:05:50,099] Trial 196 finished with value: 8.245885111790939 and parameters: {'n_layers': 2, 'n_units_0': 98, 'n_units_1': 97, 'activation': 'tanh', 'learning_rate': 0.0011722858736513497, 'batch_size': 128, 'optimizer': 'Adam', 'max_epochs': 153}. Best is trial 27 with value: 7.372662965998451.
2025-05-08 11:09:13.1717Z [I 2025-05-08 14:09:13,171] Trial 197 finished with value: 11.750413603300643 and parameters: {'n_layers': 1, 'n_units_0': 94, 'activation': 'tanh', 'learning_rate': 0.0015266172092412535, 'batch_size': 128, 'optimizer': 'SGD', 'max_epochs': 77}. Best is trial 27 with value: 7.372662965998451.
2025-05-08 11:15:22.8973Z [I 2025-05-08 14:15:22,897] Trial 198 finished with value: 7.939491322555715 and parameters: {'n_layers': 2, 'n_units_0': 97, 'n_units_1': 99, 'activation': 'tanh', 'learning_rate': 0.002122853866640727, 'batch_size': 128, 'optimizer': 'Adam', 'max_epochs': 222}. Best is trial 27 with value: 7.372662965998451.
2025-05-08 11:31:59.7734Z [I 2025-05-08 14:31:59,773] Trial 199 finished with value: 8.50074764778305 and parameters: {'n_layers': 2, 'n_units_0': 98, 'n_units_1': 93, 'activation': 'tanh', 'learning_rate': 0.0018722627788203593, 'batch_size': 16, 'optimizer': 'Adam', 'max_epochs': 220}. Best is trial 27 with value: 7.372662965998451.
2025-05-08 11:31:59.7743Z Best Hyperparameters: {'n_layers': 2, 'n_units_0': 76, 'n_units_1': 90, 'activation': 'tanh', 'learning_rate': 0.015056225554015165, 'batch_size': 128, 'optimizer': 'LBFGS', 'max_epochs': 186}
2025-05-08 11:31:59.7760Z Оптимизация гиперпараметров MLP завершена!
2025-05-08 11:31:59.7775Z 2025-05-08 14:31:59,777 - INFO - GPU-MLP Model Training Log - 2025-05-08 14:31:59.777374
2025-05-08 11:31:59.8144Z Лучшие параметры MLP: {'n_layers': 2, 'n_units_0': 76, 'n_units_1': 90, 'activation': 'tanh', 'learning_rate': 0.015056225554015165, 'batch_size': 128, 'optimizer': 'LBFGS', 'max_epochs': 186}
2025-05-08 11:31:59.9180Z Лучшее значение метрики: 7.372662965998451
2025-05-08 11:31:59.8545Z 2025-05-08 14:31:59,777 - INFO - ==================================================
2025-05-08 11:31:59.9342Z ====================================
2025-05-08 11:31:59.9743Z 2025-05-08 14:31:59,777 - INFO - Component Number: 1
2025-05-08 11:32:00.0142Z Best GPU-MLP parameters: {'n_layers': 2, 'n_units_0': 76, 'n_units_1': 90, 'activation': 'tanh', 'learning_rate': 0.015056225554015165, 'batch_size': 128, 'optimizer': 'LBFGS', 'max_epochs': 186}
2025-05-08 11:32:00.1128Z Best GPU-MLP validation RMSE: 7.372662965998451
2025-05-08 11:32:00.0544Z 2025-05-08 14:31:59,777 - INFO - Number of Trials: 200
2025-05-08 11:32:00.1341Z Training logs and best parameters written to /output/MY_ARTIFACT
2025-05-08 11:32:00.1742Z 2025-05-08 14:31:59,777 - INFO - Device: cuda
2025-05-08 11:32:00.2542Z 2025-05-08 14:31:59,777 - INFO - ## GPU-MLP MODEL RESULTS ##
2025-05-08 11:32:00.3496Z 2025-05-08 14:31:59,778 - INFO - Best MLP Parameters: {'n_layers': 2, 'n_units_0': 76, 'n_units_1': 90, 'activation': 'tanh', 'learning_rate': 0.015056225554015165, 'batch_size': 128, 'optimizer': 'LBFGS', 'max_epochs': 186}
2025-05-08 11:32:00.3496Z 2025-05-08 14:31:59,778 - INFO - Best MLP Validation RMSE: 7.372662965998451
2025-05-08 11:32:00.3898Z 2025-05-08 14:31:59,778 - INFO - ==================================================
2025-05-08 11:32:00.4296Z 2025-05-08 14:31:59,778 - INFO - Тестовая выборка:
2025-05-08 11:32:00.5112Z 2025-05-08 14:31:59,778 - INFO -   X_test shape: (4800, 6)
2025-05-08 11:32:00.5112Z 2025-05-08 14:31:59,778 - INFO -   y_test shape: (4800,)
2025-05-08 11:32:03.2317Z [[init-process] Main process terminated]
