2025-05-07 17:45:35.9707Z [I 2025-05-07 20:45:35,970] Trial 57 finished with value: 1000000.0 and parameters: {'n_layers': 7, 'n_units_0': 79, 'n_units_1': 85, 'n_units_2': 22, 'n_units_3': 10, 'n_units_4': 54, 'n_units_5': 42, 'n_units_6': 75, 'activation': 'relu', 'learning_rate': 0.003100097728269777, 'batch_size': 16, 'optimizer': 'SGD', 'max_epochs': 147}. Best is trial 27 with value: 7.372662965998451.
2025-05-07 17:50:00.2679Z [I 2025-05-07 20:50:00,267] Trial 58 finished with value: 12.93816104987641 and parameters: {'n_layers': 1, 'n_units_0': 54, 'activation': 'tanh', 'learning_rate': 0.02085517976804009, 'batch_size': 128, 'optimizer': 'Adam', 'max_epochs': 429}. Best is trial 27 with value: 7.372662965998451.
2025-05-07 17:50:37.9454Z [I 2025-05-07 20:50:37,945] Trial 59 finished with value: 10.969026132786713 and parameters: {'n_layers': 3, 'n_units_0': 70, 'n_units_1': 27, 'n_units_2': 29, 'activation': 'tanh', 'learning_rate': 0.01229596923589758, 'batch_size': 128, 'optimizer': 'LBFGS', 'max_epochs': 128}. Best is trial 27 with value: 7.372662965998451.
2025-05-07 17:53:15.5449Z [I 2025-05-07 20:53:15,544] Trial 60 finished with value: 68.61981993199925 and parameters: {'n_layers': 14, 'n_units_0': 61, 'n_units_1': 68, 'n_units_2': 44, 'n_units_3': 59, 'n_units_4': 91, 'n_units_5': 88, 'n_units_6': 15, 'n_units_7': 23, 'n_units_8': 25, 'n_units_9': 68, 'n_units_10': 39, 'n_units_11': 43, 'n_units_12': 21, 'n_units_13': 1, 'activation': 'tanh', 'learning_rate': 0.031789741101421215, 'batch_size': 256, 'optimizer': 'Adam', 'max_epochs': 104}. Best is trial 27 with value: 7.372662965998451.
2025-05-07 17:56:04.7912Z [I 2025-05-07 20:56:04,791] Trial 61 finished with value: 9.498138646932233 and parameters: {'n_layers': 4, 'n_units_0': 68, 'n_units_1': 92, 'n_units_2': 95, 'n_units_3': 72, 'activation': 'tanh', 'learning_rate': 0.0031919228411587362, 'batch_size': 128, 'optimizer': 'Adam', 'max_epochs': 234}. Best is trial 27 with value: 7.372662965998451.
2025-05-07 18:02:59.6355Z [I 2025-05-07 21:02:59,635] Trial 62 finished with value: 8.26706618092211 and parameters: {'n_layers': 2, 'n_units_0': 64, 'n_units_1': 89, 'activation': 'tanh', 'learning_rate': 0.001992568565842929, 'batch_size': 128, 'optimizer': 'Adam', 'max_epochs': 199}. Best is trial 27 with value: 7.372662965998451.
2025-05-07 18:06:21.1046Z [I 2025-05-07 21:06:21,104] Trial 63 finished with value: 8.594581813436392 and parameters: {'n_layers': 4, 'n_units_0': 72, 'n_units_1': 98, 'n_units_2': 95, 'n_units_3': 58, 'activation': 'tanh', 'learning_rate': 0.003892416923782223, 'batch_size': 128, 'optimizer': 'Adam', 'max_epochs': 261}. Best is trial 27 with value: 7.372662965998451.
2025-05-07 18:07:50.2356Z [I 2025-05-07 21:07:50,235] Trial 64 finished with value: 67.47201749267062 and parameters: {'n_layers': 10, 'n_units_0': 96, 'n_units_1': 77, 'n_units_2': 88, 'n_units_3': 79, 'n_units_4': 1, 'n_units_5': 19, 'n_units_6': 42, 'n_units_7': 57, 'n_units_8': 75, 'n_units_9': 67, 'activation': 'tanh', 'learning_rate': 0.006828000674067805, 'batch_size': 128, 'optimizer': 'Adam', 'max_epochs': 227}. Best is trial 27 with value: 7.372662965998451.
2025-05-07 18:17:15.4654Z [I 2025-05-07 21:17:15,465] Trial 65 finished with value: 8.807344700800062 and parameters: {'n_layers': 2, 'n_units_0': 59, 'n_units_1': 88, 'activation': 'tanh', 'learning_rate': 0.0008158386782810374, 'batch_size': 128, 'optimizer': 'Adam', 'max_epochs': 183}. Best is trial 27 with value: 7.372662965998451.
2025-05-07 18:17:59.8738Z [I 2025-05-07 21:17:59,873] Trial 66 finished with value: 1000000.0 and parameters: {'n_layers': 3, 'n_units_0': 55, 'n_units_1': 95, 'n_units_2': 79, 'activation': 'relu', 'learning_rate': 0.054590270554193604, 'batch_size': 64, 'optimizer': 'SGD', 'max_epochs': 152}. Best is trial 27 with value: 7.372662965998451.
2025-05-07 18:18:49.3839Z [I 2025-05-07 21:18:49,383] Trial 67 finished with value: 728.0007297386453 and parameters: {'n_layers': 5, 'n_units_0': 64, 'n_units_1': 81, 'n_units_2': 96, 'n_units_3': 44, 'n_units_4': 36, 'activation': 'tanh', 'learning_rate': 0.0042120504758057994, 'batch_size': 128, 'optimizer': 'LBFGS', 'max_epochs': 215}. Best is trial 27 with value: 7.372662965998451.
2025-05-07 18:25:15.8992Z [I 2025-05-07 21:25:15,899] Trial 68 finished with value: 13.813256704738953 and parameters: {'n_layers': 1, 'n_units_0': 74, 'activation': 'logistic', 'learning_rate': 0.0111589078256017, 'batch_size': 128, 'optimizer': 'Adam', 'max_epochs': 138}. Best is trial 27 with value: 7.372662965998451.
2025-05-07 18:28:21.7101Z [I 2025-05-07 21:28:21,709] Trial 69 finished with value: 9.182687342285584 and parameters: {'n_layers': 3, 'n_units_0': 70, 'n_units_1': 97, 'n_units_2': 55, 'activation': 'tanh', 'learning_rate': 0.002570063324341389, 'batch_size': 128, 'optimizer': 'RMSprop', 'max_epochs': 169}. Best is trial 27 with value: 7.372662965998451.
2025-05-07 18:36:44.8950Z [I 2025-05-07 21:36:44,894] Trial 70 finished with value: 7.940708743347768 and parameters: {'n_layers': 2, 'n_units_0': 89, 'n_units_1': 92, 'activation': 'tanh', 'learning_rate': 0.0011865498758069303, 'batch_size': 128, 'optimizer': 'Adam', 'max_epochs': 383}. Best is trial 27 with value: 7.372662965998451.
2025-05-07 18:46:20.9981Z [I 2025-05-07 21:46:20,997] Trial 71 finished with value: 8.056084971369032 and parameters: {'n_layers': 2, 'n_units_0': 100, 'n_units_1': 89, 'activation': 'tanh', 'learning_rate': 0.0013255207886552574, 'batch_size': 128, 'optimizer': 'Adam', 'max_epochs': 386}. Best is trial 27 with value: 7.372662965998451.
2025-05-07 18:54:30.6437Z [I 2025-05-07 21:54:30,643] Trial 72 finished with value: 8.681846041228429 and parameters: {'n_layers': 2, 'n_units_0': 95, 'n_units_1': 85, 'activation': 'tanh', 'learning_rate': 0.0012380210218405296, 'batch_size': 128, 'optimizer': 'Adam', 'max_epochs': 385}. Best is trial 27 with value: 7.372662965998451.
2025-05-07 19:11:40.0136Z [I 2025-05-07 22:11:40,013] Trial 73 finished with value: 11.681424280359542 and parameters: {'n_layers': 1, 'n_units_0': 89, 'activation': 'tanh', 'learning_rate': 0.001996764079170087, 'batch_size': 128, 'optimizer': 'Adam', 'max_epochs': 368}. Best is trial 27 with value: 7.372662965998451.
2025-05-07 19:27:52.5087Z [I 2025-05-07 22:27:52,508] Trial 74 finished with value: 8.166115359427428 and parameters: {'n_layers': 2, 'n_units_0': 99, 'n_units_1': 92, 'activation': 'tanh', 'learning_rate': 0.0004217530950307164, 'batch_size': 128, 'optimizer': 'Adam', 'max_epochs': 404}. Best is trial 27 with value: 7.372662965998451.
2025-05-07 19:50:26.1607Z [I 2025-05-07 22:50:26,160] Trial 75 finished with value: 8.766617173126487 and parameters: {'n_layers': 2, 'n_units_0': 98, 'n_units_1': 92, 'activation': 'tanh', 'learning_rate': 0.0002780992581894997, 'batch_size': 128, 'optimizer': 'Adam', 'max_epochs': 473}. Best is trial 27 with value: 7.372662965998451.
2025-05-07 20:05:31.5462Z [I 2025-05-07 23:05:31,546] Trial 76 finished with value: 8.545443064462413 and parameters: {'n_layers': 2, 'n_units_0': 94, 'n_units_1': 92, 'activation': 'tanh', 'learning_rate': 0.00045255681082586436, 'batch_size': 128, 'optimizer': 'Adam', 'max_epochs': 403}. Best is trial 27 with value: 7.372662965998451.
2025-05-07 20:25:40.7706Z [I 2025-05-07 23:25:40,770] Trial 77 finished with value: 14.466675446913438 and parameters: {'n_layers': 1, 'n_units_0': 100, 'activation': 'tanh', 'learning_rate': 0.00042687176019498145, 'batch_size': 128, 'optimizer': 'Adam', 'max_epochs': 426}. Best is trial 27 with value: 7.372662965998451.
2025-05-07 20:26:00.9697Z [I 2025-05-07 23:26:00,969] Trial 78 finished with value: 35454.92236629492 and parameters: {'n_layers': 2, 'n_units_0': 89, 'n_units_1': 100, 'activation': 'relu', 'learning_rate': 0.00012157932163900059, 'batch_size': 128, 'optimizer': 'LBFGS', 'max_epochs': 449}. Best is trial 27 with value: 7.372662965998451.
2025-05-07 20:33:17.0053Z [I 2025-05-07 23:33:17,005] Trial 79 finished with value: 8.225422634409034 and parameters: {'n_layers': 3, 'n_units_0': 83, 'n_units_1': 89, 'n_units_2': 16, 'activation': 'tanh', 'learning_rate': 0.0011230453092849631, 'batch_size': 128, 'optimizer': 'Adam', 'max_epochs': 382}. Best is trial 27 with value: 7.372662965998451.
2025-05-07 21:38:04.6628Z [I 2025-05-08 00:38:04,662] Trial 80 finished with value: 11.744340548200626 and parameters: {'n_layers': 1, 'n_units_0': 100, 'activation': 'tanh', 'learning_rate': 0.000649318178271071, 'batch_size': 16, 'optimizer': 'Adam', 'max_epochs': 416}. Best is trial 27 with value: 7.372662965998451.
2025-05-07 21:47:13.8765Z [I 2025-05-08 00:47:13,876] Trial 81 finished with value: 8.013916309411885 and parameters: {'n_layers': 3, 'n_units_0': 91, 'n_units_1': 94, 'n_units_2': 39, 'activation': 'tanh', 'learning_rate': 0.000870810276389755, 'batch_size': 32, 'optimizer': 'Adam', 'max_epochs': 341}. Best is trial 27 with value: 7.372662965998451.
2025-05-07 22:01:30.3016Z [I 2025-05-08 01:01:30,301] Trial 82 finished with value: 8.36122615674509 and parameters: {'n_layers': 3, 'n_units_0': 90, 'n_units_1': 96, 'n_units_2': 36, 'activation': 'tanh', 'learning_rate': 0.0003545828547840267, 'batch_size': 32, 'optimizer': 'Adam', 'max_epochs': 344}. Best is trial 27 with value: 7.372662965998451.
2025-05-07 22:16:58.9797Z [I 2025-05-08 01:16:58,979] Trial 83 finished with value: 8.459096889764869 and parameters: {'n_layers': 2, 'n_units_0': 94, 'n_units_1': 93, 'activation': 'tanh', 'learning_rate': 0.0008853986151130967, 'batch_size': 32, 'optimizer': 'Adam', 'max_epochs': 361}. Best is trial 27 with value: 7.372662965998451.
2025-05-07 22:25:05.7625Z [I 2025-05-08 01:25:05,762] Trial 84 finished with value: 8.016185599609257 and parameters: {'n_layers': 3, 'n_units_0': 84, 'n_units_1': 87, 'n_units_2': 51, 'activation': 'tanh', 'learning_rate': 0.0015194774019985583, 'batch_size': 32, 'optimizer': 'Adam', 'max_epochs': 401}. Best is trial 27 with value: 7.372662965998451.
2025-05-07 22:34:14.9917Z [I 2025-05-08 01:34:14,991] Trial 85 finished with value: 8.614534524750887 and parameters: {'n_layers': 4, 'n_units_0': 79, 'n_units_1': 88, 'n_units_2': 27, 'n_units_3': 100, 'activation': 'tanh', 'learning_rate': 0.0013831600134655232, 'batch_size': 32, 'optimizer': 'SGD', 'max_epochs': 354}. Best is trial 27 with value: 7.372662965998451.
2025-05-07 22:35:55.4631Z [I 2025-05-08 01:35:55,462] Trial 86 finished with value: 11.272917060708696 and parameters: {'n_layers': 3, 'n_units_0': 85, 'n_units_1': 79, 'n_units_2': 51, 'activation': 'logistic', 'learning_rate': 0.0017162311273988273, 'batch_size': 32, 'optimizer': 'LBFGS', 'max_epochs': 331}. Best is trial 27 with value: 7.372662965998451.
2025-05-07 23:34:51.0379Z [I 2025-05-08 02:34:51,037] Trial 87 finished with value: 10.890394517602354 and parameters: {'n_layers': 4, 'n_units_0': 79, 'n_units_1': 83, 'n_units_2': 39, 'n_units_3': 22, 'activation': 'tanh', 'learning_rate': 2.9086523281567463e-05, 'batch_size': 32, 'optimizer': 'Adam', 'max_epochs': 381}. Best is trial 27 with value: 7.372662965998451.
2025-05-08 00:12:57.0913Z [I 2025-05-08 03:12:57,091] Trial 88 finished with value: 12.456912432798042 and parameters: {'n_layers': 9, 'n_units_0': 87, 'n_units_1': 5, 'n_units_2': 58, 'n_units_3': 34, 'n_units_4': 16, 'n_units_5': 60, 'n_units_6': 84, 'n_units_7': 59, 'n_units_8': 2, 'activation': 'tanh', 'learning_rate': 0.0007494932190837291, 'batch_size': 32, 'optimizer': 'RMSprop', 'max_epochs': 392}. Best is trial 27 with value: 7.372662965998451.
2025-05-08 00:20:59.0753Z [I 2025-05-08 03:20:59,075] Trial 89 finished with value: 14.439308218407552 and parameters: {'n_layers': 3, 'n_units_0': 3, 'n_units_1': 97, 'n_units_2': 47, 'activation': 'tanh', 'learning_rate': 0.0020385094147771735, 'batch_size': 32, 'optimizer': 'Adam', 'max_epochs': 450}. Best is trial 27 with value: 7.372662965998451.
2025-05-08 00:21:15.7587Z [I 2025-05-08 03:21:15,758] Trial 90 finished with value: 33677.56000662756 and parameters: {'n_layers': 12, 'n_units_0': 84, 'n_units_1': 58, 'n_units_2': 32, 'n_units_3': 14, 'n_units_4': 79, 'n_units_5': 85, 'n_units_6': 46, 'n_units_7': 19, 'n_units_8': 26, 'n_units_9': 100, 'n_units_10': 60, 'n_units_11': 59, 'activation': 'tanh', 'learning_rate': 0.0014121486564225582, 'batch_size': 32, 'optimizer': 'LBFGS', 'max_epochs': 317}. Best is trial 27 with value: 7.372662965998451.
2025-05-08 00:42:54.6265Z [I 2025-05-08 03:42:54,626] Trial 91 finished with value: 9.430269616844829 and parameters: {'n_layers': 2, 'n_units_0': 92, 'n_units_1': 93, 'activation': 'tanh', 'learning_rate': 0.00019401965168474575, 'batch_size': 128, 'optimizer': 'Adam', 'max_epochs': 416}. Best is trial 27 with value: 7.372662965998451.
2025-05-08 01:01:52.6949Z [I 2025-05-08 04:01:52,694] Trial 92 finished with value: 14.46956413071287 and parameters: {'n_layers': 1, 'n_units_0': 97, 'activation': 'tanh', 'learning_rate': 0.0005549174608867775, 'batch_size': 128, 'optimizer': 'Adam', 'max_epochs': 396}. Best is trial 27 with value: 7.372662965998451.
2025-05-08 01:07:48.7353Z [I 2025-05-08 04:07:48,735] Trial 93 finished with value: 8.14086679403386 and parameters: {'n_layers': 3, 'n_units_0': 76, 'n_units_1': 87, 'n_units_2': 43, 'activation': 'tanh', 'learning_rate': 0.0010049720948399283, 'batch_size': 64, 'optimizer': 'Adam', 'max_epochs': 433}. Best is trial 27 with value: 7.372662965998451.
2025-05-08 01:14:28.3640Z [I 2025-05-08 04:14:28,363] Trial 94 finished with value: 8.412491420611106 and parameters: {'n_layers': 3, 'n_units_0': 76, 'n_units_1': 86, 'n_units_2': 43, 'activation': 'tanh', 'learning_rate': 0.0009110081744143828, 'batch_size': 64, 'optimizer': 'Adam', 'max_epochs': 472}. Best is trial 27 with value: 7.372662965998451.
2025-05-08 01:20:16.5095Z [I 2025-05-08 04:20:16,509] Trial 95 finished with value: 8.32920088984405 and parameters: {'n_layers': 3, 'n_units_0': 66, 'n_units_1': 49, 'n_units_2': 38, 'activation': 'tanh', 'learning_rate': 0.0012132475910881743, 'batch_size': 64, 'optimizer': 'Adam', 'max_epochs': 207}. Best is trial 27 with value: 7.372662965998451.
2025-05-08 01:26:30.0740Z [I 2025-05-08 04:26:30,073] Trial 96 finished with value: 9.291368511074875 and parameters: {'n_layers': 3, 'n_units_0': 80, 'n_units_1': 87, 'n_units_2': 8, 'activation': 'tanh', 'learning_rate': 0.0024686665039750557, 'batch_size': 64, 'optimizer': 'Adam', 'max_epochs': 190}. Best is trial 27 with value: 7.372662965998451.
2025-05-08 01:33:12.6555Z [I 2025-05-08 04:33:12,655] Trial 97 finished with value: 8.88276268400719 and parameters: {'n_layers': 5, 'n_units_0': 76, 'n_units_1': 39, 'n_units_2': 33, 'n_units_3': 6, 'n_units_4': 91, 'activation': 'tanh', 'learning_rate': 0.0010684525827355648, 'batch_size': 64, 'optimizer': 'Adam', 'max_epochs': 439}. Best is trial 27 with value: 7.372662965998451.
2025-05-08 01:33:40.9264Z [I 2025-05-08 04:33:40,926] Trial 98 finished with value: 85.61559026763175 and parameters: {'n_layers': 4, 'n_units_0': 62, 'n_units_1': 90, 'n_units_2': 49, 'n_units_3': 93, 'activation': 'relu', 'learning_rate': 0.003219079529891656, 'batch_size': 32, 'optimizer': 'LBFGS', 'max_epochs': 131}. Best is trial 27 with value: 7.372662965998451.
2025-05-08 01:37:38.7046Z [I 2025-05-08 04:37:38,704] Trial 99 finished with value: 9.090249977493485 and parameters: {'n_layers': 2, 'n_units_0': 82, 'n_units_1': 72, 'activation': 'tanh', 'learning_rate': 0.018452794666845858, 'batch_size': 64, 'optimizer': 'Adam', 'max_epochs': 296}. Best is trial 27 with value: 7.372662965998451.
2025-05-08 01:44:42.7490Z [I 2025-05-08 04:44:42,748] Trial 100 finished with value: 11.5625752214614 and parameters: {'n_layers': 1, 'n_units_0': 87, 'activation': 'tanh', 'learning_rate': 0.0018001145727770376, 'batch_size': 16, 'optimizer': 'SGD', 'max_epochs': 169}. Best is trial 27 with value: 7.372662965998451.
2025-05-08 02:00:39.1708Z [I 2025-05-08 05:00:39,170] Trial 101 finished with value: 8.712935063843746 and parameters: {'n_layers': 2, 'n_units_0': 53, 'n_units_1': 98, 'activation': 'tanh', 'learning_rate': 0.0006614559888877228, 'batch_size': 128, 'optimizer': 'Adam', 'max_epochs': 374}. Best is trial 27 with value: 7.372662965998451.
2025-05-08 02:03:32.7616Z [I 2025-05-08 05:03:32,761] Trial 102 finished with value: 8.450516218861093 and parameters: {'n_layers': 2, 'n_units_0': 91, 'n_units_1': 93, 'activation': 'tanh', 'learning_rate': 0.014601702568814958, 'batch_size': 128, 'optimizer': 'Adam', 'max_epochs': 406}. Best is trial 27 with value: 7.372662965998451.
2025-05-08 02:06:13.3713Z [I 2025-05-08 05:06:13,371] Trial 103 finished with value: 10.208572031980227 and parameters: {'n_layers': 2, 'n_units_0': 94, 'n_units_1': 83, 'activation': 'tanh', 'learning_rate': 0.029773719857414917, 'batch_size': 128, 'optimizer': 'Adam', 'max_epochs': 435}. Best is trial 27 with value: 7.372662965998451.
2025-05-08 02:11:34.9166Z [I 2025-05-08 05:11:34,916] Trial 104 finished with value: 8.274090360218608 and parameters: {'n_layers': 3, 'n_units_0': 70, 'n_units_1': 91, 'n_units_2': 59, 'activation': 'tanh', 'learning_rate': 0.0014846431856237164, 'batch_size': 128, 'optimizer': 'Adam', 'max_epochs': 408}. Best is trial 27 with value: 7.372662965998451.
2025-05-08 02:19:24.8856Z [I 2025-05-08 05:19:24,885] Trial 105 finished with value: 14.337446169764629 and parameters: {'n_layers': 2, 'n_units_0': 72, 'n_units_1': 95, 'activation': 'logistic', 'learning_rate': 0.0004930644019454708, 'batch_size': 128, 'optimizer': 'Adam', 'max_epochs': 151}. Best is trial 27 with value: 7.372662965998451.
2025-05-08 02:27:24.5388Z [I 2025-05-08 05:27:24,538] Trial 106 finished with value: 8.694019533390332 and parameters: {'n_layers': 4, 'n_units_0': 97, 'n_units_1': 77, 'n_units_2': 52, 'n_units_3': 74, 'activation': 'tanh', 'learning_rate': 0.000372465360426652, 'batch_size': 128, 'optimizer': 'Adam', 'max_epochs': 423}. Best is trial 27 with value: 7.372662965998451.
2025-05-08 02:28:07.9125Z [I 2025-05-08 05:28:07,912] Trial 107 finished with value: 9.584322494099332 and parameters: {'n_layers': 1, 'n_units_0': 88, 'activation': 'tanh', 'learning_rate': 0.00489443778469534, 'batch_size': 128, 'optimizer': 'LBFGS', 'max_epochs': 179}. Best is trial 27 with value: 7.372662965998451.
2025-05-08 02:35:53.7998Z [I 2025-05-08 05:35:53,799] Trial 108 finished with value: 8.815613541566906 and parameters: {'n_layers': 3, 'n_units_0': 59, 'n_units_1': 90, 'n_units_2': 42, 'activation': 'tanh', 'learning_rate': 0.0007511962717075588, 'batch_size': 128, 'optimizer': 'Adam', 'max_epochs': 373}. Best is trial 27 with value: 7.372662965998451.
2025-05-08 02:39:07.1270Z [I 2025-05-08 05:39:07,126] Trial 109 finished with value: 20.060534609728748 and parameters: {'n_layers': 2, 'n_units_0': 78, 'n_units_1': 100, 'activation': 'tanh', 'learning_rate': 0.08811223999449623, 'batch_size': 32, 'optimizer': 'RMSprop', 'max_epochs': 459}. Best is trial 27 with value: 7.372662965998451.
2025-05-08 02:43:11.7271Z [I 2025-05-08 05:43:11,726] Trial 110 finished with value: 8.58261707860538 and parameters: {'n_layers': 3, 'n_units_0': 63, 'n_units_1': 87, 'n_units_2': 73, 'activation': 'tanh', 'learning_rate': 0.002197825829874212, 'batch_size': 128, 'optimizer': 'Adam', 'max_epochs': 397}. Best is trial 27 with value: 7.372662965998451.
2025-05-08 02:50:00.9490Z [I 2025-05-08 05:50:00,948] Trial 111 finished with value: 8.137492743282335 and parameters: {'n_layers': 3, 'n_units_0': 99, 'n_units_1': 94, 'n_units_2': 63, 'activation': 'tanh', 'learning_rate': 0.0009693151986270653, 'batch_size': 256, 'optimizer': 'Adam', 'max_epochs': 351}. Best is trial 27 with value: 7.372662965998451.
2025-05-08 03:01:22.4265Z [I 2025-05-08 06:01:22,426] Trial 112 finished with value: 8.18885943359893 and parameters: {'n_layers': 2, 'n_units_0': 100, 'n_units_1': 94, 'activation': 'tanh', 'learning_rate': 0.0009975669337815138, 'batch_size': 256, 'optimizer': 'Adam', 'max_epochs': 350}. Best is trial 27 with value: 7.372662965998451.
2025-05-08 03:07:06.4437Z [I 2025-05-08 06:07:06,443] Trial 113 finished with value: 8.245555720989897 and parameters: {'n_layers': 3, 'n_units_0': 93, 'n_units_1': 97, 'n_units_2': 46, 'activation': 'tanh', 'learning_rate': 0.0012360741748578899, 'batch_size': 256, 'optimizer': 'Adam', 'max_epochs': 337}. Best is trial 27 with value: 7.372662965998451.
2025-05-08 03:10:57.8340Z [I 2025-05-08 06:10:57,833] Trial 114 finished with value: 8.072422752447885 and parameters: {'n_layers': 3, 'n_units_0': 90, 'n_units_1': 90, 'n_units_2': 64, 'activation': 'tanh', 'learning_rate': 0.0030003375519375305, 'batch_size': 256, 'optimizer': 'Adam', 'max_epochs': 413}. Best is trial 27 with value: 7.372662965998451.
2025-05-08 03:16:11.9301Z [I 2025-05-08 06:16:11,929] Trial 115 finished with value: 8.606285246954874 and parameters: {'n_layers': 4, 'n_units_0': 48, 'n_units_1': 85, 'n_units_2': 64, 'n_units_3': 31, 'activation': 'tanh', 'learning_rate': 0.0027672034532572275, 'batch_size': 256, 'optimizer': 'Adam', 'max_epochs': 414}. Best is trial 27 with value: 7.372662965998451.
2025-05-08 03:19:32.8963Z [I 2025-05-08 06:19:32,896] Trial 116 finished with value: 8.426271101604456 and parameters: {'n_layers': 3, 'n_units_0': 86, 'n_units_1': 81, 'n_units_2': 54, 'activation': 'tanh', 'learning_rate': 0.0034699428385496023, 'batch_size': 256, 'optimizer': 'Adam', 'max_epochs': 162}. Best is trial 27 with value: 7.372662965998451.
2025-05-08 03:21:16.4632Z [I 2025-05-08 06:21:16,462] Trial 117 finished with value: 9.186133873506972 and parameters: {'n_layers': 3, 'n_units_0': 96, 'n_units_1': 89, 'n_units_2': 67, 'activation': 'tanh', 'learning_rate': 0.0016633994417676935, 'batch_size': 256, 'optimizer': 'LBFGS', 'max_epochs': 389}. Best is trial 27 with value: 7.372662965998451.
