2025-05-10 02:16:42.8780Z [I 2025-05-10 05:16:42,877] Trial 165 finished with value: 11.1089632840595 and parameters: {'n_layers': 2, 'n_units_0': 22, 'n_units_1': 56, 'activation': 'tanh', 'learning_rate': 0.001582978842238052, 'batch_size': 16, 'optimizer': 'RMSprop', 'max_epochs': 277}. Best is trial 120 with value: 9.774581439722999.
2025-05-10 02:26:58.7827Z [I 2025-05-10 05:26:58,782] Trial 166 finished with value: 10.580523220458067 and parameters: {'n_layers': 3, 'n_units_0': 26, 'n_units_1': 63, 'n_units_2': 58, 'activation': 'tanh', 'learning_rate': 0.0013502256378297311, 'batch_size': 16, 'optimizer': 'RMSprop', 'max_epochs': 277}. Best is trial 120 with value: 9.774581439722999.
2025-05-10 02:38:32.8517Z [I 2025-05-10 05:38:32,851] Trial 167 finished with value: 12.483691143073994 and parameters: {'n_layers': 3, 'n_units_0': 27, 'n_units_1': 66, 'n_units_2': 54, 'activation': 'tanh', 'learning_rate': 0.0012999256900678117, 'batch_size': 16, 'optimizer': 'RMSprop', 'max_epochs': 286}. Best is trial 120 with value: 9.774581439722999.
2025-05-10 02:55:55.1099Z [I 2025-05-10 05:55:55,109] Trial 168 finished with value: 20.24648527561327 and parameters: {'n_layers': 1, 'n_units_0': 24, 'activation': 'tanh', 'learning_rate': 0.0020150434570292562, 'batch_size': 16, 'optimizer': 'RMSprop', 'max_epochs': 271}. Best is trial 120 with value: 9.774581439722999.
2025-05-10 03:03:16.7704Z [I 2025-05-10 06:03:16,770] Trial 169 finished with value: 14.115063978881912 and parameters: {'n_layers': 3, 'n_units_0': 28, 'n_units_1': 70, 'n_units_2': 57, 'activation': 'tanh', 'learning_rate': 0.0010226771071523868, 'batch_size': 64, 'optimizer': 'RMSprop', 'max_epochs': 263}. Best is trial 120 with value: 9.774581439722999.
2025-05-10 03:37:34.7834Z [I 2025-05-10 06:37:34,783] Trial 170 finished with value: 13.338402992291304 and parameters: {'n_layers': 2, 'n_units_0': 22, 'n_units_1': 64, 'activation': 'logistic', 'learning_rate': 0.0017813336376039375, 'batch_size': 16, 'optimizer': 'RMSprop', 'max_epochs': 274}. Best is trial 120 with value: 9.774581439722999.
2025-05-10 03:49:58.8683Z [I 2025-05-10 06:49:58,868] Trial 171 finished with value: 10.375615113189713 and parameters: {'n_layers': 3, 'n_units_0': 21, 'n_units_1': 68, 'n_units_2': 64, 'activation': 'tanh', 'learning_rate': 0.0010911875826950075, 'batch_size': 16, 'optimizer': 'RMSprop', 'max_epochs': 261}. Best is trial 120 with value: 9.774581439722999.
2025-05-10 04:00:37.9596Z [I 2025-05-10 07:00:37,959] Trial 172 finished with value: 11.102391619394902 and parameters: {'n_layers': 3, 'n_units_0': 26, 'n_units_1': 64, 'n_units_2': 65, 'activation': 'tanh', 'learning_rate': 0.0013479345820601022, 'batch_size': 16, 'optimizer': 'RMSprop', 'max_epochs': 283}. Best is trial 120 with value: 9.774581439722999.
2025-05-10 04:18:07.5075Z [I 2025-05-10 07:18:07,507] Trial 173 finished with value: 9.613081252998843 and parameters: {'n_layers': 3, 'n_units_0': 21, 'n_units_1': 59, 'n_units_2': 61, 'activation': 'tanh', 'learning_rate': 0.0010161717017973491, 'batch_size': 16, 'optimizer': 'RMSprop', 'max_epochs': 259}. Best is trial 173 with value: 9.613081252998843.
2025-05-10 04:35:00.7676Z [I 2025-05-10 07:35:00,767] Trial 174 finished with value: 11.171417781837167 and parameters: {'n_layers': 3, 'n_units_0': 21, 'n_units_1': 54, 'n_units_2': 61, 'activation': 'tanh', 'learning_rate': 0.0010280240911271397, 'batch_size': 16, 'optimizer': 'RMSprop', 'max_epochs': 259}. Best is trial 173 with value: 9.613081252998843.
2025-05-10 05:09:00.2696Z [I 2025-05-10 08:09:00,269] Trial 175 finished with value: 11.481018987749751 and parameters: {'n_layers': 2, 'n_units_0': 15, 'n_units_1': 59, 'activation': 'tanh', 'learning_rate': 0.0007597313940994815, 'batch_size': 16, 'optimizer': 'RMSprop', 'max_epochs': 242}. Best is trial 173 with value: 9.613081252998843.
2025-05-10 05:23:31.8923Z [I 2025-05-10 08:23:31,892] Trial 176 finished with value: 10.808125399253845 and parameters: {'n_layers': 3, 'n_units_0': 19, 'n_units_1': 69, 'n_units_2': 62, 'activation': 'tanh', 'learning_rate': 0.0009303447918330306, 'batch_size': 16, 'optimizer': 'RMSprop', 'max_epochs': 231}. Best is trial 173 with value: 9.613081252998843.
2025-05-10 05:37:08.6918Z [I 2025-05-10 08:37:08,691] Trial 177 finished with value: 10.633525345203717 and parameters: {'n_layers': 2, 'n_units_0': 23, 'n_units_1': 57, 'activation': 'tanh', 'learning_rate': 0.003317159572850099, 'batch_size': 16, 'optimizer': 'RMSprop', 'max_epochs': 254}. Best is trial 173 with value: 9.613081252998843.
2025-05-10 05:58:33.5674Z [I 2025-05-10 08:58:33,567] Trial 178 finished with value: 10.399526629312007 and parameters: {'n_layers': 3, 'n_units_0': 16, 'n_units_1': 60, 'n_units_2': 65, 'activation': 'tanh', 'learning_rate': 0.0006066018581055187, 'batch_size': 16, 'optimizer': 'RMSprop', 'max_epochs': 243}. Best is trial 173 with value: 9.613081252998843.
2025-05-10 05:59:47.9666Z [I 2025-05-10 08:59:47,966] Trial 179 finished with value: 193.90458550856914 and parameters: {'n_layers': 3, 'n_units_0': 16, 'n_units_1': 59, 'n_units_2': 65, 'activation': 'tanh', 'learning_rate': 0.00070514550441007, 'batch_size': 16, 'optimizer': 'LBFGS', 'max_epochs': 263}. Best is trial 173 with value: 9.613081252998843.
2025-05-10 06:19:02.9916Z [I 2025-05-10 09:19:02,991] Trial 180 finished with value: 11.11866391230638 and parameters: {'n_layers': 4, 'n_units_0': 13, 'n_units_1': 55, 'n_units_2': 65, 'n_units_3': 100, 'activation': 'tanh', 'learning_rate': 0.0005291492809629932, 'batch_size': 16, 'optimizer': 'RMSprop', 'max_epochs': 248}. Best is trial 173 with value: 9.613081252998843.
2025-05-10 06:33:58.8543Z [I 2025-05-10 09:33:58,854] Trial 181 finished with value: 10.677859950160162 and parameters: {'n_layers': 3, 'n_units_0': 21, 'n_units_1': 67, 'n_units_2': 63, 'activation': 'tanh', 'learning_rate': 0.001186065526942946, 'batch_size': 16, 'optimizer': 'RMSprop', 'max_epochs': 237}. Best is trial 173 with value: 9.613081252998843.
2025-05-10 06:51:53.1144Z [I 2025-05-10 09:51:53,114] Trial 182 finished with value: 10.327689526678881 and parameters: {'n_layers': 3, 'n_units_0': 17, 'n_units_1': 61, 'n_units_2': 60, 'activation': 'tanh', 'learning_rate': 0.0008407334605857726, 'batch_size': 16, 'optimizer': 'RMSprop', 'max_epochs': 243}. Best is trial 173 with value: 9.613081252998843.
2025-05-10 07:13:49.1641Z [I 2025-05-10 10:13:49,163] Trial 183 finished with value: 10.362355811723027 and parameters: {'n_layers': 3, 'n_units_0': 17, 'n_units_1': 61, 'n_units_2': 59, 'activation': 'tanh', 'learning_rate': 0.0006334258053477523, 'batch_size': 16, 'optimizer': 'RMSprop', 'max_epochs': 227}. Best is trial 173 with value: 9.613081252998843.
2025-05-10 07:34:10.7630Z [I 2025-05-10 10:34:10,762] Trial 184 finished with value: 10.620240345909448 and parameters: {'n_layers': 3, 'n_units_0': 17, 'n_units_1': 61, 'n_units_2': 59, 'activation': 'tanh', 'learning_rate': 0.0006094736467818595, 'batch_size': 16, 'optimizer': 'RMSprop', 'max_epochs': 228}. Best is trial 173 with value: 9.613081252998843.
2025-05-10 07:51:01.4213Z [I 2025-05-10 10:51:01,421] Trial 185 finished with value: 10.432656266381105 and parameters: {'n_layers': 3, 'n_units_0': 24, 'n_units_1': 58, 'n_units_2': 56, 'activation': 'tanh', 'learning_rate': 0.0007676391629079523, 'batch_size': 16, 'optimizer': 'RMSprop', 'max_epochs': 210}. Best is trial 173 with value: 9.613081252998843.
2025-05-10 08:05:07.6045Z [I 2025-05-10 11:05:07,604] Trial 186 finished with value: 11.511254815473325 and parameters: {'n_layers': 4, 'n_units_0': 24, 'n_units_1': 62, 'n_units_2': 56, 'n_units_3': 94, 'activation': 'tanh', 'learning_rate': 0.0008162862433183703, 'batch_size': 16, 'optimizer': 'RMSprop', 'max_epochs': 208}. Best is trial 173 with value: 9.613081252998843.
2025-05-10 08:27:46.7654Z [I 2025-05-10 11:27:46,765] Trial 187 finished with value: 10.445585670979183 and parameters: {'n_layers': 3, 'n_units_0': 18, 'n_units_1': 57, 'n_units_2': 56, 'activation': 'tanh', 'learning_rate': 0.000588334184751629, 'batch_size': 16, 'optimizer': 'RMSprop', 'max_epochs': 248}. Best is trial 173 with value: 9.613081252998843.
2025-05-10 08:42:45.4826Z [I 2025-05-10 11:42:45,482] Trial 188 finished with value: 10.903375197535953 and parameters: {'n_layers': 4, 'n_units_0': 21, 'n_units_1': 60, 'n_units_2': 60, 'n_units_3': 91, 'activation': 'tanh', 'learning_rate': 0.0008388801542951809, 'batch_size': 16, 'optimizer': 'RMSprop', 'max_epochs': 214}. Best is trial 173 with value: 9.613081252998843.
2025-05-10 09:02:42.5293Z [I 2025-05-10 12:02:42,529] Trial 189 finished with value: 10.933097956224948 and parameters: {'n_layers': 3, 'n_units_0': 16, 'n_units_1': 53, 'n_units_2': 63, 'activation': 'tanh', 'learning_rate': 0.0007156983807661546, 'batch_size': 16, 'optimizer': 'RMSprop', 'max_epochs': 292}. Best is trial 173 with value: 9.613081252998843.
2025-05-10 09:12:38.3111Z [I 2025-05-10 12:12:38,310] Trial 190 finished with value: 12.721916835475305 and parameters: {'n_layers': 3, 'n_units_0': 22, 'n_units_1': 56, 'n_units_2': 61, 'activation': 'tanh', 'learning_rate': 0.00048008469129822887, 'batch_size': 256, 'optimizer': 'RMSprop', 'max_epochs': 235}. Best is trial 173 with value: 9.613081252998843.
2025-05-10 09:37:30.9677Z [I 2025-05-10 12:37:30,967] Trial 191 finished with value: 10.626122628536677 and parameters: {'n_layers': 3, 'n_units_0': 18, 'n_units_1': 58, 'n_units_2': 56, 'activation': 'tanh', 'learning_rate': 0.0005485831652897407, 'batch_size': 16, 'optimizer': 'RMSprop', 'max_epochs': 246}. Best is trial 173 with value: 9.613081252998843.
2025-05-10 09:58:46.1137Z [I 2025-05-10 12:58:46,113] Trial 192 finished with value: 10.380044469131736 and parameters: {'n_layers': 3, 'n_units_0': 19, 'n_units_1': 57, 'n_units_2': 59, 'activation': 'tanh', 'learning_rate': 0.0006222930202752403, 'batch_size': 16, 'optimizer': 'RMSprop', 'max_epochs': 253}. Best is trial 173 with value: 9.613081252998843.
2025-05-10 10:22:49.5105Z [I 2025-05-10 13:22:49,510] Trial 193 finished with value: 10.547935059574272 and parameters: {'n_layers': 3, 'n_units_0': 20, 'n_units_1': 55, 'n_units_2': 51, 'activation': 'tanh', 'learning_rate': 0.0006451004939639965, 'batch_size': 16, 'optimizer': 'RMSprop', 'max_epochs': 255}. Best is trial 173 with value: 9.613081252998843.
2025-05-10 10:33:04.3174Z [I 2025-05-10 13:33:04,317] Trial 194 finished with value: 10.368457983686516 and parameters: {'n_layers': 3, 'n_units_0': 77, 'n_units_1': 61, 'n_units_2': 59, 'activation': 'tanh', 'learning_rate': 0.0009015803678209603, 'batch_size': 16, 'optimizer': 'RMSprop', 'max_epochs': 269}. Best is trial 173 with value: 9.613081252998843.
2025-05-10 10:46:17.9863Z [I 2025-05-10 13:46:17,986] Trial 195 finished with value: 10.619068958685427 and parameters: {'n_layers': 4, 'n_units_0': 13, 'n_units_1': 62, 'n_units_2': 59, 'n_units_3': 88, 'activation': 'tanh', 'learning_rate': 0.0011316705298713135, 'batch_size': 16, 'optimizer': 'RMSprop', 'max_epochs': 271}. Best is trial 173 with value: 9.613081252998843.
2025-05-10 11:03:02.4874Z [I 2025-05-10 14:03:02,487] Trial 196 finished with value: 11.643844589365193 and parameters: {'n_layers': 3, 'n_units_0': 16, 'n_units_1': 60, 'n_units_2': 67, 'activation': 'tanh', 'learning_rate': 0.0008928141575427732, 'batch_size': 16, 'optimizer': 'RMSprop', 'max_epochs': 264}. Best is trial 173 with value: 9.613081252998843.
2025-05-10 11:18:03.7279Z [I 2025-05-10 14:18:03,727] Trial 197 finished with value: 11.12367154880015 and parameters: {'n_layers': 4, 'n_units_0': 70, 'n_units_1': 63, 'n_units_2': 67, 'n_units_3': 86, 'activation': 'tanh', 'learning_rate': 0.0004213415505452598, 'batch_size': 16, 'optimizer': 'RMSprop', 'max_epochs': 254}. Best is trial 173 with value: 9.613081252998843.
2025-05-10 11:35:07.1602Z [I 2025-05-10 14:35:07,160] Trial 198 finished with value: 11.860015731209266 and parameters: {'n_layers': 2, 'n_units_0': 18, 'n_units_1': 73, 'activation': 'tanh', 'learning_rate': 0.0010175097464978893, 'batch_size': 32, 'optimizer': 'RMSprop', 'max_epochs': 271}. Best is trial 173 with value: 9.613081252998843.
2025-05-10 11:49:25.4065Z [I 2025-05-10 14:49:25,406] Trial 199 finished with value: 11.043954595409597 and parameters: {'n_layers': 4, 'n_units_0': 81, 'n_units_1': 66, 'n_units_2': 64, 'n_units_3': 95, 'activation': 'tanh', 'learning_rate': 0.0005035677823247552, 'batch_size': 16, 'optimizer': 'RMSprop', 'max_epochs': 243}. Best is trial 173 with value: 9.613081252998843.
2025-05-10 11:49:25.4075Z Best Hyperparameters: {'n_layers': 3, 'n_units_0': 21, 'n_units_1': 59, 'n_units_2': 61, 'activation': 'tanh', 'learning_rate': 0.0010161717017973491, 'batch_size': 16, 'optimizer': 'RMSprop', 'max_epochs': 259}
2025-05-10 11:49:25.4097Z Оптимизация гиперпараметров MLP завершена!
2025-05-10 11:49:25.4131Z 2025-05-10 14:49:25,412 - INFO - GPU-MLP Model Training Log - 2025-05-10 14:49:25.412895
2025-05-10 11:49:25.4471Z Лучшие параметры MLP: {'n_layers': 3, 'n_units_0': 21, 'n_units_1': 59, 'n_units_2': 61, 'activation': 'tanh', 'learning_rate': 0.0010161717017973491, 'batch_size': 16, 'optimizer': 'RMSprop', 'max_epochs': 259}
2025-05-10 11:49:25.5359Z Лучшее значение метрики: 9.613081252998843
2025-05-10 11:49:25.4873Z 2025-05-10 14:49:25,413 - INFO - ==================================================
2025-05-10 11:49:25.5673Z ====================================
2025-05-10 11:49:25.6075Z 2025-05-10 14:49:25,413 - INFO - Component Number: 2
2025-05-10 11:49:25.6471Z Best GPU-MLP parameters: {'n_layers': 3, 'n_units_0': 21, 'n_units_1': 59, 'n_units_2': 61, 'activation': 'tanh', 'learning_rate': 0.0010161717017973491, 'batch_size': 16, 'optimizer': 'RMSprop', 'max_epochs': 259}
2025-05-10 11:49:25.7341Z Best GPU-MLP validation RMSE: 9.613081252998843
2025-05-10 11:49:25.6872Z 2025-05-10 14:49:25,413 - INFO - Number of Trials: 200
2025-05-10 11:49:25.7675Z Training logs and best parameters written to /output/MY_ARTIFACT
2025-05-10 11:49:25.8076Z 2025-05-10 14:49:25,413 - INFO - Device: cuda
2025-05-10 11:49:25.8871Z 2025-05-10 14:49:25,413 - INFO - ## GPU-MLP MODEL RESULTS ##
2025-05-10 11:49:25.9338Z 2025-05-10 14:49:25,413 - INFO - Best MLP Parameters: {'n_layers': 3, 'n_units_0': 21, 'n_units_1': 59, 'n_units_2': 61, 'activation': 'tanh', 'learning_rate': 0.0010161717017973491, 'batch_size': 16, 'optimizer': 'RMSprop', 'max_epochs': 259}
2025-05-10 11:49:25.9672Z 2025-05-10 14:49:25,413 - INFO - Best MLP Validation RMSE: 9.613081252998843
2025-05-10 11:49:26.0074Z 2025-05-10 14:49:25,413 - INFO - ==================================================
2025-05-10 11:49:26.0474Z 2025-05-10 14:49:25,413 - INFO - Тестовая выборка:
2025-05-10 11:49:26.1323Z 2025-05-10 14:49:25,413 - INFO -   X_test shape: (4800, 6)
2025-05-10 11:49:26.1323Z 2025-05-10 14:49:25,414 - INFO -   y_test shape: (4800,)
2025-05-10 11:49:27.5476Z [[init-process] Main process terminated]
