2025-05-14 10:22:34.4245Z [I 2025-05-14 13:22:34,424] Trial 176 finished with value: 6.507943801196446 and parameters: {'n_layers': 2, 'n_units_0': 46, 'n_units_1': 34, 'activation': 'tanh', 'learning_rate': 0.029035492413571944, 'batch_size': 32768, 'optimizer': 'LBFGS', 'max_epochs': 282}. Best is trial 142 with value: 5.438670766784165.
2025-05-14 10:24:38.3330Z [I 2025-05-14 13:24:38,332] Trial 177 finished with value: 6.95519467529065 and parameters: {'n_layers': 2, 'n_units_0': 65, 'n_units_1': 37, 'activation': 'tanh', 'learning_rate': 0.028170045264787655, 'batch_size': 32768, 'optimizer': 'LBFGS', 'max_epochs': 283}. Best is trial 142 with value: 5.438670766784165.
2025-05-14 10:25:30.0487Z [I 2025-05-14 13:25:30,048] Trial 178 finished with value: 6.8336754069732555 and parameters: {'n_layers': 2, 'n_units_0': 59, 'n_units_1': 37, 'activation': 'tanh', 'learning_rate': 0.02819324058402477, 'batch_size': 32768, 'optimizer': 'LBFGS', 'max_epochs': 233}. Best is trial 142 with value: 5.438670766784165.
2025-05-14 10:27:10.6137Z [I 2025-05-14 13:27:10,613] Trial 179 finished with value: 7.08770306008715 and parameters: {'n_layers': 2, 'n_units_0': 61, 'n_units_1': 45, 'activation': 'tanh', 'learning_rate': 0.02857367089248826, 'batch_size': 32768, 'optimizer': 'LBFGS', 'max_epochs': 203}. Best is trial 142 with value: 5.438670766784165.
2025-05-14 10:27:33.5426Z [I 2025-05-14 13:27:33,542] Trial 180 finished with value: 6.282586861680509 and parameters: {'n_layers': 2, 'n_units_0': 65, 'n_units_1': 37, 'activation': 'tanh', 'learning_rate': 0.027957198143810143, 'batch_size': 32768, 'optimizer': 'LBFGS', 'max_epochs': 207}. Best is trial 142 with value: 5.438670766784165.
2025-05-14 10:28:15.7569Z [I 2025-05-14 13:28:15,756] Trial 182 finished with value: 7.148455643761127 and parameters: {'n_layers': 2, 'n_units_0': 42, 'n_units_1': 32, 'activation': 'tanh', 'learning_rate': 0.028809775136893163, 'batch_size': 32768, 'optimizer': 'LBFGS', 'max_epochs': 304}. Best is trial 142 with value: 5.438670766784165.
2025-05-14 10:29:43.4676Z [I 2025-05-14 13:29:43,467] Trial 181 finished with value: 5.4927764620198 and parameters: {'n_layers': 2, 'n_units_0': 60, 'n_units_1': 33, 'activation': 'tanh', 'learning_rate': 0.027595712141021893, 'batch_size': 32768, 'optimizer': 'LBFGS', 'max_epochs': 236}. Best is trial 142 with value: 5.438670766784165.
2025-05-14 10:33:18.2979Z [I 2025-05-14 13:33:18,297] Trial 183 finished with value: 7.301031787016771 and parameters: {'n_layers': 2, 'n_units_0': 42, 'n_units_1': 37, 'activation': 'tanh', 'learning_rate': 0.015518326595316488, 'batch_size': 32768, 'optimizer': 'LBFGS', 'max_epochs': 306}. Best is trial 142 with value: 5.438670766784165.
2025-05-14 10:33:37.1710Z [I 2025-05-14 13:33:37,170] Trial 184 finished with value: 9.616652795350788 and parameters: {'n_layers': 2, 'n_units_0': 42, 'n_units_1': 32, 'activation': 'tanh', 'learning_rate': 0.015485381047425308, 'batch_size': 32768, 'optimizer': 'LBFGS', 'max_epochs': 305}. Best is trial 142 with value: 5.438670766784165.
2025-05-14 10:34:06.4682Z [I 2025-05-14 13:34:06,468] Trial 185 finished with value: 5.600364993326031 and parameters: {'n_layers': 3, 'n_units_0': 43, 'n_units_1': 32, 'n_units_2': 79, 'activation': 'tanh', 'learning_rate': 0.042972264738698696, 'batch_size': 32768, 'optimizer': 'LBFGS', 'max_epochs': 275}. Best is trial 142 with value: 5.438670766784165.
2025-05-14 10:39:27.9606Z [I 2025-05-14 13:39:27,960] Trial 186 finished with value: 6.301369702837308 and parameters: {'n_layers': 3, 'n_units_0': 43, 'n_units_1': 31, 'n_units_2': 72, 'activation': 'tanh', 'learning_rate': 0.045109381772935, 'batch_size': 32768, 'optimizer': 'LBFGS', 'max_epochs': 301}. Best is trial 142 with value: 5.438670766784165.
2025-05-14 10:39:43.1075Z [I 2025-05-14 13:39:43,107] Trial 190 finished with value: 6.873179801659309 and parameters: {'n_layers': 3, 'n_units_0': 38, 'n_units_1': 44, 'n_units_2': 23, 'activation': 'tanh', 'learning_rate': 0.016280556259704412, 'batch_size': 32768, 'optimizer': 'LBFGS', 'max_epochs': 263}. Best is trial 142 with value: 5.438670766784165.
2025-05-14 10:39:56.7701Z [I 2025-05-14 13:39:56,769] Trial 189 finished with value: 5.2876939453916805 and parameters: {'n_layers': 3, 'n_units_0': 52, 'n_units_1': 43, 'n_units_2': 71, 'activation': 'tanh', 'learning_rate': 0.01551343676461695, 'batch_size': 32768, 'optimizer': 'LBFGS', 'max_epochs': 262}. Best is trial 189 with value: 5.2876939453916805.
2025-05-14 10:40:17.4783Z [I 2025-05-14 13:40:17,478] Trial 187 finished with value: 6.477787799220388 and parameters: {'n_layers': 3, 'n_units_0': 42, 'n_units_1': 44, 'n_units_2': 67, 'activation': 'tanh', 'learning_rate': 0.01570883287987723, 'batch_size': 32768, 'optimizer': 'LBFGS', 'max_epochs': 304}. Best is trial 189 with value: 5.2876939453916805.
2025-05-14 10:41:29.2181Z [I 2025-05-14 13:41:29,217] Trial 192 finished with value: 12.88078163476351 and parameters: {'n_layers': 3, 'n_units_0': 38, 'n_units_1': 44, 'n_units_2': 68, 'activation': 'tanh', 'learning_rate': 0.043912299810549234, 'batch_size': 32768, 'optimizer': 'LBFGS', 'max_epochs': 264}. Best is trial 189 with value: 5.2876939453916805.
2025-05-14 10:43:04.6659Z [I 2025-05-14 13:43:04,665] Trial 193 finished with value: 5.383449389424146 and parameters: {'n_layers': 3, 'n_units_0': 39, 'n_units_1': 62, 'n_units_2': 71, 'activation': 'tanh', 'learning_rate': 0.03569137769467523, 'batch_size': 32768, 'optimizer': 'LBFGS', 'max_epochs': 259}. Best is trial 189 with value: 5.2876939453916805.
2025-05-14 10:43:30.4838Z [I 2025-05-14 13:43:30,483] Trial 188 finished with value: 22.30735604111168 and parameters: {'n_layers': 3, 'n_units_0': 42, 'n_units_1': 44, 'n_units_2': 68, 'activation': 'tanh', 'learning_rate': 1.649361212962305e-05, 'batch_size': 32768, 'optimizer': 'LBFGS', 'max_epochs': 305}. Best is trial 189 with value: 5.2876939453916805.
2025-05-14 10:44:32.8503Z [I 2025-05-14 13:44:32,850] Trial 191 finished with value: 5.472915022488819 and parameters: {'n_layers': 3, 'n_units_0': 45, 'n_units_1': 51, 'n_units_2': 67, 'activation': 'tanh', 'learning_rate': 0.043661173503031704, 'batch_size': 32768, 'optimizer': 'LBFGS', 'max_epochs': 262}. Best is trial 189 with value: 5.2876939453916805.
2025-05-14 10:47:39.2894Z [I 2025-05-14 13:47:39,289] Trial 194 finished with value: 5.89551646680767 and parameters: {'n_layers': 3, 'n_units_0': 39, 'n_units_1': 50, 'n_units_2': 67, 'activation': 'tanh', 'learning_rate': 0.037908641851944105, 'batch_size': 32768, 'optimizer': 'LBFGS', 'max_epochs': 276}. Best is trial 189 with value: 5.2876939453916805.
2025-05-14 10:47:51.6253Z [I 2025-05-14 13:47:51,625] Trial 195 finished with value: 6.2430393368240775 and parameters: {'n_layers': 3, 'n_units_0': 40, 'n_units_1': 50, 'n_units_2': 91, 'activation': 'tanh', 'learning_rate': 0.03887130088039403, 'batch_size': 32768, 'optimizer': 'LBFGS', 'max_epochs': 275}. Best is trial 189 with value: 5.2876939453916805.
2025-05-14 10:47:55.6976Z [I 2025-05-14 13:47:55,697] Trial 196 finished with value: 6.950011372728443 and parameters: {'n_layers': 3, 'n_units_0': 52, 'n_units_1': 51, 'n_units_2': 67, 'activation': 'tanh', 'learning_rate': 0.0197721898100878, 'batch_size': 32768, 'optimizer': 'LBFGS', 'max_epochs': 240}. Best is trial 189 with value: 5.2876939453916805.
2025-05-14 10:47:57.4280Z [I 2025-05-14 13:47:57,427] Trial 198 finished with value: 6.432574415491813 and parameters: {'n_layers': 3, 'n_units_0': 52, 'n_units_1': 51, 'n_units_2': 80, 'activation': 'tanh', 'learning_rate': 0.02001803729919338, 'batch_size': 32768, 'optimizer': 'LBFGS', 'max_epochs': 275}. Best is trial 189 with value: 5.2876939453916805.
2025-05-14 10:48:23.9518Z [I 2025-05-14 13:48:23,951] Trial 199 finished with value: 5.725936293353854 and parameters: {'n_layers': 3, 'n_units_0': 51, 'n_units_1': 48, 'n_units_2': 80, 'activation': 'tanh', 'learning_rate': 0.019250869020915093, 'batch_size': 32768, 'optimizer': 'LBFGS', 'max_epochs': 274}. Best is trial 189 with value: 5.2876939453916805.
2025-05-14 10:48:31.4260Z [I 2025-05-14 13:48:31,425] Trial 197 finished with value: 71.6176131934823 and parameters: {'n_layers': 3, 'n_units_0': 52, 'n_units_1': 60, 'n_units_2': 72, 'activation': 'tanh', 'learning_rate': 1.0699708363447852e-05, 'batch_size': 32768, 'optimizer': 'LBFGS', 'max_epochs': 274}. Best is trial 189 with value: 5.2876939453916805.
2025-05-14 10:48:31.4282Z Best Hyperparameters: {'n_layers': 3, 'n_units_0': 52, 'n_units_1': 43, 'n_units_2': 71, 'activation': 'tanh', 'learning_rate': 0.01551343676461695, 'batch_size': 32768, 'optimizer': 'LBFGS', 'max_epochs': 262}
2025-05-14 10:48:31.4328Z Оптимизация гиперпараметров MLP завершена!
2025-05-14 10:48:31.4343Z 2025-05-14 13:48:31,434 - INFO - GPU-MLP Model Training Log - 2025-05-14 13:48:31.434124
2025-05-14 10:48:31.4664Z Лучшие параметры MLP: {'n_layers': 3, 'n_units_0': 52, 'n_units_1': 43, 'n_units_2': 71, 'activation': 'tanh', 'learning_rate': 0.01551343676461695, 'batch_size': 32768, 'optimizer': 'LBFGS', 'max_epochs': 262}
2025-05-14 10:48:31.5065Z 2025-05-14 13:48:31,434 - INFO - ==================================================
2025-05-14 10:48:31.5467Z Лучшее значение метрики: 5.2876939453916805
2025-05-14 10:48:31.6107Z 2025-05-14 13:48:31,434 - INFO - Component Number: 0
2025-05-14 10:48:31.6270Z ====================================
2025-05-14 10:48:31.6671Z 2025-05-14 13:48:31,434 - INFO - Number of Trials: 200
2025-05-14 10:48:31.7061Z Best GPU-MLP parameters: {'n_layers': 3, 'n_units_0': 52, 'n_units_1': 43, 'n_units_2': 71, 'activation': 'tanh', 'learning_rate': 0.01551343676461695, 'batch_size': 32768, 'optimizer': 'LBFGS', 'max_epochs': 262}
2025-05-14 10:48:31.8121Z Best GPU-MLP validation RMSE: 5.2876939453916805
2025-05-14 10:48:31.7463Z 2025-05-14 13:48:31,434 - INFO - Device: cuda
2025-05-14 10:48:31.8265Z Training logs and best parameters written to /output/MY_ARTIFACT
2025-05-14 10:48:31.8666Z 2025-05-14 13:48:31,434 - INFO - ## GPU-MLP MODEL RESULTS ##
2025-05-14 10:48:31.9469Z 2025-05-14 13:48:31,434 - INFO - Best MLP Parameters: {'n_layers': 3, 'n_units_0': 52, 'n_units_1': 43, 'n_units_2': 71, 'activation': 'tanh', 'learning_rate': 0.01551343676461695, 'batch_size': 32768, 'optimizer': 'LBFGS', 'max_epochs': 262}
2025-05-14 10:48:32.0131Z 2025-05-14 13:48:31,434 - INFO - Best MLP Validation RMSE: 5.2876939453916805
2025-05-14 10:48:32.0264Z 2025-05-14 13:48:31,434 - INFO - ==================================================
2025-05-14 10:48:32.0666Z 2025-05-14 13:48:31,435 - INFO - Тестовая выборка:
2025-05-14 10:48:32.1067Z 2025-05-14 13:48:31,435 - INFO -   X_test shape: (4800, 6)
2025-05-14 10:48:32.2124Z 2025-05-14 13:48:31,435 - INFO -   y_test shape: (4800,)
2025-05-14 10:48:33.2091Z [[init-process] Main process terminated]
