2025-05-07 13:21:27.6277Z [I 2025-05-07 16:21:27,627] Trial 0 finished with value: 69.74282417164865 and parameters: {'n_layers': 15, 'n_units_0': 19, 'n_units_1': 64, 'n_units_2': 67, 'n_units_3': 79, 'n_units_4': 87, 'n_units_5': 6, 'n_units_6': 54, 'n_units_7': 97, 'n_units_8': 97, 'n_units_9': 52, 'n_units_10': 51, 'n_units_11': 55, 'n_units_12': 81, 'n_units_13': 54, 'n_units_14': 98, 'activation': 'relu', 'learning_rate': 0.03724360773561107, 'batch_size': 16, 'optimizer': 'Adam', 'max_epochs': 373}. Best is trial 0 with value: 69.74282417164865.
2025-05-07 13:24:10.7829Z [I 2025-05-07 16:24:10,782] Trial 1 finished with value: 12.142070905091018 and parameters: {'n_layers': 5, 'n_units_0': 36, 'n_units_1': 85, 'n_units_2': 12, 'n_units_3': 35, 'n_units_4': 53, 'activation': 'tanh', 'learning_rate': 0.0013991618016092385, 'batch_size': 256, 'optimizer': 'SGD', 'max_epochs': 398}. Best is trial 1 with value: 12.142070905091018.
2025-05-07 13:25:01.8766Z [I 2025-05-07 16:25:01,876] Trial 2 finished with value: 69.87986342645497 and parameters: {'n_layers': 14, 'n_units_0': 85, 'n_units_1': 33, 'n_units_2': 82, 'n_units_3': 77, 'n_units_4': 5, 'n_units_5': 73, 'n_units_6': 100, 'n_units_7': 43, 'n_units_8': 78, 'n_units_9': 2, 'n_units_10': 45, 'n_units_11': 99, 'n_units_12': 87, 'n_units_13': 87, 'activation': 'logistic', 'learning_rate': 0.025223835491162583, 'batch_size': 256, 'optimizer': 'SGD', 'max_epochs': 89}. Best is trial 1 with value: 12.142070905091018.
2025-05-07 13:36:31.0537Z [I 2025-05-07 16:36:31,053] Trial 3 finished with value: 33.50769865479611 and parameters: {'n_layers': 8, 'n_units_0': 32, 'n_units_1': 51, 'n_units_2': 89, 'n_units_3': 76, 'n_units_4': 25, 'n_units_5': 15, 'n_units_6': 32, 'n_units_7': 37, 'activation': 'relu', 'learning_rate': 1.0678702965586052e-05, 'batch_size': 32, 'optimizer': 'RMSprop', 'max_epochs': 56}. Best is trial 1 with value: 12.142070905091018.
2025-05-07 13:43:04.1474Z [I 2025-05-07 16:43:04,147] Trial 4 finished with value: 12.553307353550112 and parameters: {'n_layers': 11, 'n_units_0': 82, 'n_units_1': 61, 'n_units_2': 52, 'n_units_3': 19, 'n_units_4': 30, 'n_units_5': 51, 'n_units_6': 26, 'n_units_7': 94, 'n_units_8': 60, 'n_units_9': 15, 'n_units_10': 78, 'activation': 'tanh', 'learning_rate': 0.00017334789535532587, 'batch_size': 64, 'optimizer': 'SGD', 'max_epochs': 447}. Best is trial 1 with value: 12.142070905091018.
2025-05-07 13:44:22.0455Z [I 2025-05-07 16:44:22,045] Trial 5 finished with value: 50.790477527011646 and parameters: {'n_layers': 1, 'n_units_0': 12, 'activation': 'relu', 'learning_rate': 0.006788899518172711, 'batch_size': 256, 'optimizer': 'SGD', 'max_epochs': 408}. Best is trial 1 with value: 12.142070905091018.
2025-05-07 13:45:32.6360Z [I 2025-05-07 16:45:32,635] Trial 6 finished with value: 1000000.0 and parameters: {'n_layers': 3, 'n_units_0': 81, 'n_units_1': 69, 'n_units_2': 76, 'activation': 'tanh', 'learning_rate': 0.08857566405354754, 'batch_size': 32, 'optimizer': 'SGD', 'max_epochs': 420}. Best is trial 1 with value: 12.142070905091018.
2025-05-07 14:03:55.3456Z [I 2025-05-07 17:03:55,345] Trial 7 finished with value: 17.78972982663558 and parameters: {'n_layers': 6, 'n_units_0': 17, 'n_units_1': 75, 'n_units_2': 24, 'n_units_3': 36, 'n_units_4': 100, 'n_units_5': 97, 'activation': 'logistic', 'learning_rate': 0.00019723835967779406, 'batch_size': 256, 'optimizer': 'RMSprop', 'max_epochs': 390}. Best is trial 1 with value: 12.142070905091018.
2025-05-07 14:04:50.6637Z [I 2025-05-07 17:04:50,663] Trial 8 finished with value: 69.73570361998938 and parameters: {'n_layers': 13, 'n_units_0': 70, 'n_units_1': 31, 'n_units_2': 32, 'n_units_3': 11, 'n_units_4': 75, 'n_units_5': 96, 'n_units_6': 96, 'n_units_7': 72, 'n_units_8': 96, 'n_units_9': 95, 'n_units_10': 82, 'n_units_11': 2, 'n_units_12': 69, 'activation': 'logistic', 'learning_rate': 0.003091896048758027, 'batch_size': 256, 'optimizer': 'Adam', 'max_epochs': 446}. Best is trial 1 with value: 12.142070905091018.
2025-05-07 14:06:22.5773Z [I 2025-05-07 17:06:22,577] Trial 9 finished with value: 67.1457137500228 and parameters: {'n_layers': 5, 'n_units_0': 57, 'n_units_1': 18, 'n_units_2': 43, 'n_units_3': 94, 'n_units_4': 26, 'activation': 'logistic', 'learning_rate': 0.07649110636869276, 'batch_size': 16, 'optimizer': 'LBFGS', 'max_epochs': 387}. Best is trial 1 with value: 12.142070905091018.
2025-05-07 14:07:17.8541Z [I 2025-05-07 17:07:17,853] Trial 10 finished with value: 257.13751792572003 and parameters: {'n_layers': 9, 'n_units_0': 46, 'n_units_1': 99, 'n_units_2': 1, 'n_units_3': 47, 'n_units_4': 59, 'n_units_5': 35, 'n_units_6': 3, 'n_units_7': 4, 'n_units_8': 3, 'activation': 'tanh', 'learning_rate': 0.0005047758166259524, 'batch_size': 64, 'optimizer': 'LBFGS', 'max_epochs': 266}. Best is trial 1 with value: 12.142070905091018.
2025-05-07 14:12:23.9522Z [I 2025-05-07 17:12:23,951] Trial 11 finished with value: 57.840168632377576 and parameters: {'n_layers': 11, 'n_units_0': 100, 'n_units_1': 95, 'n_units_2': 56, 'n_units_3': 16, 'n_units_4': 44, 'n_units_5': 54, 'n_units_6': 36, 'n_units_7': 99, 'n_units_8': 42, 'n_units_9': 1, 'n_units_10': 95, 'activation': 'tanh', 'learning_rate': 8.004619746917353e-05, 'batch_size': 64, 'optimizer': 'SGD', 'max_epochs': 496}. Best is trial 1 with value: 12.142070905091018.
2025-05-07 14:13:29.3560Z [I 2025-05-07 17:13:29,355] Trial 12 finished with value: 67.05111156796731 and parameters: {'n_layers': 10, 'n_units_0': 46, 'n_units_1': 83, 'n_units_2': 8, 'n_units_3': 31, 'n_units_4': 45, 'n_units_5': 56, 'n_units_6': 5, 'n_units_7': 72, 'n_units_8': 44, 'n_units_9': 34, 'activation': 'tanh', 'learning_rate': 0.0015637296206536672, 'batch_size': 128, 'optimizer': 'SGD', 'max_epochs': 292}. Best is trial 1 with value: 12.142070905091018.
2025-05-07 14:17:36.0484Z [I 2025-05-07 17:17:36,048] Trial 13 finished with value: 22.010156541169735 and parameters: {'n_layers': 6, 'n_units_0': 33, 'n_units_1': 46, 'n_units_2': 49, 'n_units_3': 2, 'n_units_4': 27, 'n_units_5': 33, 'activation': 'tanh', 'learning_rate': 6.894189841565576e-05, 'batch_size': 64, 'optimizer': 'SGD', 'max_epochs': 301}. Best is trial 1 with value: 12.142070905091018.
2025-05-07 14:20:19.0493Z [I 2025-05-07 17:20:19,049] Trial 14 finished with value: 69.73239165059879 and parameters: {'n_layers': 12, 'n_units_0': 1, 'n_units_1': 57, 'n_units_2': 19, 'n_units_3': 27, 'n_units_4': 62, 'n_units_5': 76, 'n_units_6': 67, 'n_units_7': 71, 'n_units_8': 64, 'n_units_9': 37, 'n_units_10': 14, 'n_units_11': 1, 'activation': 'tanh', 'learning_rate': 0.0005338230711606647, 'batch_size': 128, 'optimizer': 'SGD', 'max_epochs': 494}. Best is trial 1 with value: 12.142070905091018.
2025-05-07 14:29:59.3273Z [I 2025-05-07 17:29:59,327] Trial 15 finished with value: 24.10143841134993 and parameters: {'n_layers': 7, 'n_units_0': 69, 'n_units_1': 81, 'n_units_2': 35, 'n_units_3': 54, 'n_units_4': 7, 'n_units_5': 33, 'n_units_6': 24, 'activation': 'tanh', 'learning_rate': 1.6921965330406806e-05, 'batch_size': 64, 'optimizer': 'SGD', 'max_epochs': 215}. Best is trial 1 with value: 12.142070905091018.
2025-05-07 14:34:16.8329Z [I 2025-05-07 17:34:16,832] Trial 16 finished with value: 10.019098355048948 and parameters: {'n_layers': 4, 'n_units_0': 98, 'n_units_1': 85, 'n_units_2': 61, 'n_units_3': 51, 'activation': 'tanh', 'learning_rate': 0.0058571168017358885, 'batch_size': 64, 'optimizer': 'Adam', 'max_epochs': 337}. Best is trial 16 with value: 10.019098355048948.
2025-05-07 14:37:08.3691Z [I 2025-05-07 17:37:08,369] Trial 17 finished with value: 8.206402804948725 and parameters: {'n_layers': 3, 'n_units_0': 98, 'n_units_1': 85, 'n_units_2': 64, 'activation': 'tanh', 'learning_rate': 0.004791794454530791, 'batch_size': 256, 'optimizer': 'Adam', 'max_epochs': 332}. Best is trial 17 with value: 8.206402804948725.
2025-05-07 14:46:06.6961Z [I 2025-05-07 17:46:06,695] Trial 18 finished with value: 11.794807869388176 and parameters: {'n_layers': 1, 'n_units_0': 97, 'activation': 'tanh', 'learning_rate': 0.007581615316882749, 'batch_size': 32, 'optimizer': 'Adam', 'max_epochs': 185}. Best is trial 17 with value: 8.206402804948725.
2025-05-07 15:00:18.5481Z [I 2025-05-07 18:00:18,547] Trial 19 finished with value: 11.31272660339341 and parameters: {'n_layers': 3, 'n_units_0': 92, 'n_units_1': 5, 'n_units_2': 62, 'activation': 'relu', 'learning_rate': 0.01081457449364294, 'batch_size': 16, 'optimizer': 'Adam', 'max_epochs': 346}. Best is trial 17 with value: 8.206402804948725.
2025-05-07 15:03:24.4680Z [I 2025-05-07 18:03:24,467] Trial 20 finished with value: 8.102921286426485 and parameters: {'n_layers': 3, 'n_units_0': 68, 'n_units_1': 91, 'n_units_2': 99, 'activation': 'tanh', 'learning_rate': 0.0027101586363502124, 'batch_size': 128, 'optimizer': 'Adam', 'max_epochs': 220}. Best is trial 20 with value: 8.102921286426485.
2025-05-07 15:06:30.8665Z [I 2025-05-07 18:06:30,866] Trial 21 finished with value: 8.208056088588696 and parameters: {'n_layers': 4, 'n_units_0': 70, 'n_units_1': 90, 'n_units_2': 95, 'n_units_3': 55, 'activation': 'tanh', 'learning_rate': 0.0037838958334374486, 'batch_size': 128, 'optimizer': 'Adam', 'max_epochs': 222}. Best is trial 20 with value: 8.102921286426485.
2025-05-07 15:13:22.3821Z [I 2025-05-07 18:13:22,381] Trial 22 finished with value: 7.405543297638812 and parameters: {'n_layers': 2, 'n_units_0': 68, 'n_units_1': 92, 'activation': 'tanh', 'learning_rate': 0.002564108946106448, 'batch_size': 128, 'optimizer': 'Adam', 'max_epochs': 171}. Best is trial 22 with value: 7.405543297638812.
2025-05-07 15:16:39.1609Z [I 2025-05-07 18:16:39,160] Trial 23 finished with value: 8.029277158437845 and parameters: {'n_layers': 2, 'n_units_0': 60, 'n_units_1': 99, 'activation': 'tanh', 'learning_rate': 0.017659691924269333, 'batch_size': 128, 'optimizer': 'Adam', 'max_epochs': 146}. Best is trial 22 with value: 7.405543297638812.
2025-05-07 15:21:16.4162Z [I 2025-05-07 18:21:16,415] Trial 24 finished with value: 12.63578230204864 and parameters: {'n_layers': 1, 'n_units_0': 61, 'activation': 'tanh', 'learning_rate': 0.01735938732553213, 'batch_size': 128, 'optimizer': 'Adam', 'max_epochs': 142}. Best is trial 22 with value: 7.405543297638812.
2025-05-07 15:27:34.5237Z [I 2025-05-07 18:27:34,523] Trial 25 finished with value: 8.747623229792774 and parameters: {'n_layers': 2, 'n_units_0': 54, 'n_units_1': 99, 'activation': 'tanh', 'learning_rate': 0.002355406791826452, 'batch_size': 128, 'optimizer': 'Adam', 'max_epochs': 141}. Best is trial 22 with value: 7.405543297638812.
2025-05-07 15:34:44.8278Z [I 2025-05-07 18:34:44,827] Trial 26 finished with value: 10.192254764768265 and parameters: {'n_layers': 2, 'n_units_0': 62, 'n_units_1': 74, 'activation': 'tanh', 'learning_rate': 0.0005728155752721142, 'batch_size': 128, 'optimizer': 'Adam', 'max_epochs': 138}. Best is trial 22 with value: 7.405543297638812.
2025-05-07 15:35:18.0331Z [I 2025-05-07 18:35:18,032] Trial 27 finished with value: 7.372662965998451 and parameters: {'n_layers': 2, 'n_units_0': 76, 'n_units_1': 90, 'activation': 'tanh', 'learning_rate': 0.015056225554015165, 'batch_size': 128, 'optimizer': 'LBFGS', 'max_epochs': 186}. Best is trial 27 with value: 7.372662965998451.
2025-05-07 15:36:12.1323Z [I 2025-05-07 18:36:12,132] Trial 28 finished with value: 9.549734733053043 and parameters: {'n_layers': 2, 'n_units_0': 77, 'n_units_1': 77, 'activation': 'relu', 'learning_rate': 0.03655806877554799, 'batch_size': 128, 'optimizer': 'LBFGS', 'max_epochs': 176}. Best is trial 27 with value: 7.372662965998451.
2025-05-07 15:36:41.8900Z [I 2025-05-07 18:36:41,889] Trial 29 finished with value: 154.27501190042088 and parameters: {'n_layers': 5, 'n_units_0': 48, 'n_units_1': 95, 'n_units_2': 73, 'n_units_3': 99, 'n_units_4': 72, 'activation': 'logistic', 'learning_rate': 0.01452321416581736, 'batch_size': 128, 'optimizer': 'LBFGS', 'max_epochs': 98}. Best is trial 27 with value: 7.372662965998451.
2025-05-07 15:37:56.6838Z [I 2025-05-07 18:37:56,683] Trial 30 finished with value: 11.082034348012433 and parameters: {'n_layers': 4, 'n_units_0': 76, 'n_units_1': 100, 'n_units_2': 40, 'n_units_3': 63, 'activation': 'relu', 'learning_rate': 0.03907582770519433, 'batch_size': 128, 'optimizer': 'LBFGS', 'max_epochs': 249}. Best is trial 27 with value: 7.372662965998451.
2025-05-07 15:45:42.3326Z [I 2025-05-07 18:45:42,332] Trial 31 finished with value: 8.838070828618635 and parameters: {'n_layers': 2, 'n_units_0': 64, 'n_units_1': 92, 'activation': 'tanh', 'learning_rate': 0.001987388553133622, 'batch_size': 128, 'optimizer': 'Adam', 'max_epochs': 178}. Best is trial 27 with value: 7.372662965998451.
2025-05-07 15:49:51.2042Z [I 2025-05-07 18:49:51,204] Trial 32 finished with value: 9.126778625217687 and parameters: {'n_layers': 3, 'n_units_0': 87, 'n_units_1': 90, 'n_units_2': 99, 'activation': 'tanh', 'learning_rate': 0.0008988376934022182, 'batch_size': 128, 'optimizer': 'RMSprop', 'max_epochs': 218}. Best is trial 27 with value: 7.372662965998451.
2025-05-07 15:53:59.2171Z [I 2025-05-07 18:53:59,216] Trial 33 finished with value: 14.779507879135018 and parameters: {'n_layers': 1, 'n_units_0': 40, 'activation': 'tanh', 'learning_rate': 0.023580094558591294, 'batch_size': 128, 'optimizer': 'Adam', 'max_epochs': 92}. Best is trial 27 with value: 7.372662965998451.
2025-05-07 15:54:19.0753Z [I 2025-05-07 18:54:19,075] Trial 34 finished with value: 5369.318392496389 and parameters: {'n_layers': 15, 'n_units_0': 73, 'n_units_1': 68, 'n_units_2': 86, 'n_units_3': 67, 'n_units_4': 99, 'n_units_5': 76, 'n_units_6': 81, 'n_units_7': 1, 'n_units_8': 19, 'n_units_9': 84, 'n_units_10': 9, 'n_units_11': 94, 'n_units_12': 5, 'n_units_13': 2, 'n_units_14': 4, 'activation': 'tanh', 'learning_rate': 0.012043142768418206, 'batch_size': 128, 'optimizer': 'LBFGS', 'max_epochs': 195}. Best is trial 27 with value: 7.372662965998451.
2025-05-07 16:00:07.2771Z [I 2025-05-07 19:00:07,276] Trial 35 finished with value: 39.48786372844114 and parameters: {'n_layers': 4, 'n_units_0': 65, 'n_units_1': 90, 'n_units_2': 77, 'n_units_3': 3, 'activation': 'tanh', 'learning_rate': 0.04038468106962432, 'batch_size': 16, 'optimizer': 'Adam', 'max_epochs': 116}. Best is trial 27 with value: 7.372662965998451.
2025-05-07 16:03:05.9163Z [I 2025-05-07 19:03:05,916] Trial 36 finished with value: 9.171108025321116 and parameters: {'n_layers': 2, 'n_units_0': 87, 'n_units_1': 79, 'activation': 'tanh', 'learning_rate': 0.008746961098900712, 'batch_size': 128, 'optimizer': 'RMSprop', 'max_epochs': 245}. Best is trial 27 with value: 7.372662965998451.
2025-05-07 16:33:06.0949Z [I 2025-05-07 19:33:06,094] Trial 37 finished with value: 12.815837741696186 and parameters: {'n_layers': 6, 'n_units_0': 56, 'n_units_1': 86, 'n_units_2': 91, 'n_units_3': 87, 'n_units_4': 14, 'n_units_5': 2, 'activation': 'relu', 'learning_rate': 0.0010273446425822612, 'batch_size': 32, 'optimizer': 'Adam', 'max_epochs': 160}. Best is trial 27 with value: 7.372662965998451.
2025-05-07 16:33:25.2286Z [I 2025-05-07 19:33:25,228] Trial 38 finished with value: 283.7291154208535 and parameters: {'n_layers': 3, 'n_units_0': 82, 'n_units_1': 70, 'n_units_2': 100, 'activation': 'logistic', 'learning_rate': 0.003799104114664475, 'batch_size': 128, 'optimizer': 'LBFGS', 'max_epochs': 62}. Best is trial 27 with value: 7.372662965998451.
2025-05-07 16:34:22.6190Z [I 2025-05-07 19:34:22,618] Trial 39 finished with value: 36.21579912752599 and parameters: {'n_layers': 5, 'n_units_0': 77, 'n_units_1': 43, 'n_units_2': 71, 'n_units_3': 64, 'n_units_4': 83, 'activation': 'tanh', 'learning_rate': 0.060767981260683876, 'batch_size': 128, 'optimizer': 'Adam', 'max_epochs': 212}. Best is trial 27 with value: 7.372662965998451.
2025-05-07 16:36:21.2943Z [I 2025-05-07 19:36:21,294] Trial 40 finished with value: 65.79089522518484 and parameters: {'n_layers': 8, 'n_units_0': 51, 'n_units_1': 63, 'n_units_2': 83, 'n_units_3': 25, 'n_units_4': 39, 'n_units_5': 21, 'n_units_6': 57, 'n_units_7': 25, 'activation': 'tanh', 'learning_rate': 0.024551293264058142, 'batch_size': 128, 'optimizer': 'RMSprop', 'max_epochs': 121}. Best is trial 27 with value: 7.372662965998451.
2025-05-07 16:39:20.1934Z [I 2025-05-07 19:39:20,193] Trial 41 finished with value: 8.804869899535932 and parameters: {'n_layers': 3, 'n_units_0': 92, 'n_units_1': 86, 'n_units_2': 61, 'activation': 'tanh', 'learning_rate': 0.005633502105535121, 'batch_size': 256, 'optimizer': 'Adam', 'max_epochs': 324}. Best is trial 27 with value: 7.372662965998451.
2025-05-07 16:48:28.1954Z [I 2025-05-07 19:48:28,195] Trial 42 finished with value: 13.361257748362018 and parameters: {'n_layers': 1, 'n_units_0': 67, 'activation': 'tanh', 'learning_rate': 0.003997432321206428, 'batch_size': 256, 'optimizer': 'Adam', 'max_epochs': 242}. Best is trial 27 with value: 7.372662965998451.
2025-05-07 16:52:27.8692Z [I 2025-05-07 19:52:27,869] Trial 43 finished with value: 8.497091356660672 and parameters: {'n_layers': 3, 'n_units_0': 61, 'n_units_1': 95, 'n_units_2': 67, 'activation': 'tanh', 'learning_rate': 0.002412120479436757, 'batch_size': 256, 'optimizer': 'Adam', 'max_epochs': 274}. Best is trial 27 with value: 7.372662965998451.
2025-05-07 16:56:03.8584Z [I 2025-05-07 19:56:03,858] Trial 44 finished with value: 8.825975436586404 and parameters: {'n_layers': 2, 'n_units_0': 24, 'n_units_1': 88, 'activation': 'tanh', 'learning_rate': 0.017128820537065517, 'batch_size': 256, 'optimizer': 'Adam', 'max_epochs': 363}. Best is trial 27 with value: 7.372662965998451.
2025-05-07 16:56:28.7492Z [I 2025-05-07 19:56:28,749] Trial 45 finished with value: 833.300553521957 and parameters: {'n_layers': 4, 'n_units_0': 92, 'n_units_1': 95, 'n_units_2': 47, 'n_units_3': 40, 'activation': 'logistic', 'learning_rate': 0.0011830007861111148, 'batch_size': 256, 'optimizer': 'LBFGS', 'max_epochs': 162}. Best is trial 27 with value: 7.372662965998451.
2025-05-07 17:09:17.9167Z [I 2025-05-07 20:09:17,916] Trial 46 finished with value: 12.172230393359445 and parameters: {'n_layers': 1, 'n_units_0': 81, 'activation': 'tanh', 'learning_rate': 0.00562027704010698, 'batch_size': 32, 'optimizer': 'Adam', 'max_epochs': 311}. Best is trial 27 with value: 7.372662965998451.
2025-05-07 17:18:14.0151Z [I 2025-05-07 20:18:14,014] Trial 47 finished with value: 24.023319359465606 and parameters: {'n_layers': 5, 'n_units_0': 72, 'n_units_1': 82, 'n_units_2': 79, 'n_units_3': 43, 'n_units_4': 16, 'activation': 'tanh', 'learning_rate': 0.009095572360276664, 'batch_size': 16, 'optimizer': 'Adam', 'max_epochs': 204}. Best is trial 27 with value: 7.372662965998451.
2025-05-07 17:19:06.1083Z [I 2025-05-07 20:19:06,108] Trial 48 finished with value: 7.731806658084387 and parameters: {'n_layers': 3, 'n_units_0': 57, 'n_units_1': 72, 'n_units_2': 68, 'activation': 'tanh', 'learning_rate': 0.0025895278544506148, 'batch_size': 128, 'optimizer': 'LBFGS', 'max_epochs': 161}. Best is trial 27 with value: 7.372662965998451.
2025-05-07 17:19:27.6487Z [I 2025-05-07 20:19:27,648] Trial 49 finished with value: 2228.736974162721 and parameters: {'n_layers': 6, 'n_units_0': 58, 'n_units_1': 73, 'n_units_2': 91, 'n_units_3': 83, 'n_units_4': 69, 'n_units_5': 68, 'activation': 'logistic', 'learning_rate': 0.00024319143325041858, 'batch_size': 128, 'optimizer': 'LBFGS', 'max_epochs': 73}. Best is trial 27 with value: 7.372662965998451.
2025-05-07 17:20:02.2207Z [I 2025-05-07 20:20:02,220] Trial 50 finished with value: 4700.516780099822 and parameters: {'n_layers': 2, 'n_units_0': 40, 'n_units_1': 57, 'activation': 'tanh', 'learning_rate': 0.0003234411895506644, 'batch_size': 128, 'optimizer': 'LBFGS', 'max_epochs': 158}. Best is trial 27 with value: 7.372662965998451.
2025-05-07 17:20:35.6663Z [I 2025-05-07 20:20:35,666] Trial 51 finished with value: 68.12483873260729 and parameters: {'n_layers': 3, 'n_units_0': 67, 'n_units_1': 79, 'n_units_2': 66, 'activation': 'tanh', 'learning_rate': 0.0015536842882667484, 'batch_size': 128, 'optimizer': 'LBFGS', 'max_epochs': 118}. Best is trial 27 with value: 7.372662965998451.
2025-05-07 17:21:46.0894Z [I 2025-05-07 20:21:46,089] Trial 52 finished with value: 13.058195874323049 and parameters: {'n_layers': 4, 'n_units_0': 58, 'n_units_1': 95, 'n_units_2': 55, 'n_units_3': 69, 'activation': 'tanh', 'learning_rate': 0.0028433473966963337, 'batch_size': 128, 'optimizer': 'LBFGS', 'max_epochs': 229}. Best is trial 27 with value: 7.372662965998451.
2025-05-07 17:29:20.8121Z [I 2025-05-07 20:29:20,812] Trial 53 finished with value: 14.669723076680226 and parameters: {'n_layers': 1, 'n_units_0': 51, 'activation': 'tanh', 'learning_rate': 0.004840182993856911, 'batch_size': 256, 'optimizer': 'Adam', 'max_epochs': 191}. Best is trial 27 with value: 7.372662965998451.
2025-05-07 17:31:29.7297Z [I 2025-05-07 20:31:29,729] Trial 54 finished with value: 10.265979499444162 and parameters: {'n_layers': 3, 'n_units_0': 74, 'n_units_1': 100, 'n_units_2': 71, 'activation': 'tanh', 'learning_rate': 0.007760279374461687, 'batch_size': 128, 'optimizer': 'RMSprop', 'max_epochs': 264}. Best is trial 27 with value: 7.372662965998451.
2025-05-07 17:32:17.7848Z [I 2025-05-07 20:32:17,784] Trial 55 finished with value: 377715.89814568305 and parameters: {'n_layers': 2, 'n_units_0': 45, 'n_units_1': 83, 'activation': 'tanh', 'learning_rate': 0.0016547706785717303, 'batch_size': 64, 'optimizer': 'LBFGS', 'max_epochs': 285}. Best is trial 27 with value: 7.372662965998451.
2025-05-07 17:42:27.8694Z [I 2025-05-07 20:42:27,869] Trial 56 finished with value: 8.358401118796305 and parameters: {'n_layers': 4, 'n_units_0': 85, 'n_units_1': 92, 'n_units_2': 83, 'n_units_3': 90, 'activation': 'tanh', 'learning_rate': 0.0006689637105681052, 'batch_size': 32, 'optimizer': 'Adam', 'max_epochs': 171}. Best is trial 27 with value: 7.372662965998451.
