2025-05-08 03:23:57.8142Z [I 2025-05-08 06:23:57,814] Trial 118 finished with value: 12.008510750477594 and parameters: {'n_layers': 5, 'n_units_0': 90, 'n_units_1': 98, 'n_units_2': 71, 'n_units_3': 82, 'n_units_4': 66, 'activation': 'tanh', 'learning_rate': 0.009384111318253107, 'batch_size': 256, 'optimizer': 'Adam', 'max_epochs': 374}. Best is trial 27 with value: 7.372662965998451.
2025-05-08 03:29:38.2723Z [I 2025-05-08 06:29:38,272] Trial 119 finished with value: 10.024729478187421 and parameters: {'n_layers': 4, 'n_units_0': 74, 'n_units_1': 95, 'n_units_2': 58, 'n_units_3': 16, 'activation': 'relu', 'learning_rate': 0.002345218156253724, 'batch_size': 256, 'optimizer': 'Adam', 'max_epochs': 433}. Best is trial 27 with value: 7.372662965998451.
2025-05-08 03:35:49.0781Z [I 2025-05-08 06:35:49,078] Trial 120 finished with value: 8.092960510632691 and parameters: {'n_layers': 3, 'n_units_0': 83, 'n_units_1': 85, 'n_units_2': 64, 'activation': 'tanh', 'learning_rate': 0.0013581592624544695, 'batch_size': 256, 'optimizer': 'Adam', 'max_epochs': 358}. Best is trial 27 with value: 7.372662965998451.
2025-05-08 03:41:52.2809Z [I 2025-05-08 06:41:52,280] Trial 121 finished with value: 7.962199072788059 and parameters: {'n_layers': 3, 'n_units_0': 83, 'n_units_1': 90, 'n_units_2': 62, 'activation': 'tanh', 'learning_rate': 0.001382768542734253, 'batch_size': 256, 'optimizer': 'Adam', 'max_epochs': 357}. Best is trial 27 with value: 7.372662965998451.
2025-05-08 03:47:45.3519Z [I 2025-05-08 06:47:45,351] Trial 122 finished with value: 8.01457555493013 and parameters: {'n_layers': 3, 'n_units_0': 84, 'n_units_1': 90, 'n_units_2': 63, 'activation': 'tanh', 'learning_rate': 0.0013638695010403383, 'batch_size': 256, 'optimizer': 'Adam', 'max_epochs': 360}. Best is trial 27 with value: 7.372662965998451.
2025-05-08 03:56:31.0219Z [I 2025-05-08 06:56:31,021] Trial 123 finished with value: 8.388838082244595 and parameters: {'n_layers': 2, 'n_units_0': 82, 'n_units_1': 90, 'activation': 'tanh', 'learning_rate': 0.0014037014097276587, 'batch_size': 256, 'optimizer': 'Adam', 'max_epochs': 356}. Best is trial 27 with value: 7.372662965998451.
2025-05-08 04:01:48.5764Z [I 2025-05-08 07:01:48,576] Trial 124 finished with value: 8.212710638262621 and parameters: {'n_layers': 3, 'n_units_0': 84, 'n_units_1': 91, 'n_units_2': 69, 'activation': 'tanh', 'learning_rate': 0.001746488084809758, 'batch_size': 256, 'optimizer': 'Adam', 'max_epochs': 365}. Best is trial 27 with value: 7.372662965998451.
2025-05-08 04:03:17.4276Z [I 2025-05-08 07:03:17,427] Trial 125 finished with value: 8.92829004334786 and parameters: {'n_layers': 4, 'n_units_0': 81, 'n_units_1': 65, 'n_units_2': 60, 'n_units_3': 49, 'activation': 'tanh', 'learning_rate': 0.002691304348283052, 'batch_size': 256, 'optimizer': 'LBFGS', 'max_epochs': 340}. Best is trial 27 with value: 7.372662965998451.
2025-05-08 04:13:31.5640Z [I 2025-05-08 07:13:31,563] Trial 126 finished with value: 8.447074826241163 and parameters: {'n_layers': 2, 'n_units_0': 85, 'n_units_1': 84, 'activation': 'logistic', 'learning_rate': 0.004275442953907626, 'batch_size': 256, 'optimizer': 'Adam', 'max_epochs': 324}. Best is trial 27 with value: 7.372662965998451.
2025-05-08 04:17:42.2147Z [I 2025-05-08 07:17:42,214] Trial 127 finished with value: 8.414876262731962 and parameters: {'n_layers': 3, 'n_units_0': 88, 'n_units_1': 81, 'n_units_2': 74, 'activation': 'tanh', 'learning_rate': 0.0020645700262730583, 'batch_size': 256, 'optimizer': 'Adam', 'max_epochs': 311}. Best is trial 27 with value: 7.372662965998451.
2025-05-08 04:19:46.3676Z [I 2025-05-08 07:19:46,367] Trial 128 finished with value: 21.5398396271214 and parameters: {'n_layers': 1, 'n_units_0': 84, 'activation': 'tanh', 'learning_rate': 0.05043203317298399, 'batch_size': 256, 'optimizer': 'SGD', 'max_epochs': 381}. Best is trial 27 with value: 7.372662965998451.
2025-05-08 04:25:59.2524Z [I 2025-05-08 07:25:59,252] Trial 129 finished with value: 8.919323771892776 and parameters: {'n_layers': 2, 'n_units_0': 57, 'n_units_1': 88, 'activation': 'tanh', 'learning_rate': 0.006139686497898695, 'batch_size': 32, 'optimizer': 'Adam', 'max_epochs': 361}. Best is trial 27 with value: 7.372662965998451.
2025-05-08 04:31:30.8370Z [I 2025-05-08 07:31:30,836] Trial 130 finished with value: 8.154163312903176 and parameters: {'n_layers': 7, 'n_units_0': 91, 'n_units_1': 96, 'n_units_2': 65, 'n_units_3': 36, 'n_units_4': 51, 'n_units_5': 44, 'n_units_6': 66, 'activation': 'tanh', 'learning_rate': 0.0013528224904306879, 'batch_size': 256, 'optimizer': 'Adam', 'max_epochs': 256}. Best is trial 27 with value: 7.372662965998451.
2025-05-08 04:38:42.0329Z [I 2025-05-08 07:38:42,032] Trial 131 finished with value: 8.09545550548631 and parameters: {'n_layers': 3, 'n_units_0': 90, 'n_units_1': 94, 'n_units_2': 63, 'activation': 'tanh', 'learning_rate': 0.0008349175120045218, 'batch_size': 256, 'optimizer': 'Adam', 'max_epochs': 350}. Best is trial 27 with value: 7.372662965998451.
2025-05-08 04:45:40.2336Z [I 2025-05-08 07:45:40,233] Trial 132 finished with value: 8.80407398594537 and parameters: {'n_layers': 3, 'n_units_0': 86, 'n_units_1': 93, 'n_units_2': 69, 'activation': 'tanh', 'learning_rate': 0.0008128208933033086, 'batch_size': 256, 'optimizer': 'Adam', 'max_epochs': 369}. Best is trial 27 with value: 7.372662965998451.
2025-05-08 04:53:52.6542Z [I 2025-05-08 07:53:52,654] Trial 133 finished with value: 9.255387670310432 and parameters: {'n_layers': 4, 'n_units_0': 82, 'n_units_1': 90, 'n_units_2': 62, 'n_units_3': 20, 'activation': 'tanh', 'learning_rate': 0.0011084506562525714, 'batch_size': 256, 'optimizer': 'Adam', 'max_epochs': 344}. Best is trial 27 with value: 7.372662965998451.
2025-05-08 04:59:57.2897Z [I 2025-05-08 07:59:57,289] Trial 134 finished with value: 8.250684305189859 and parameters: {'n_layers': 2, 'n_units_0': 89, 'n_units_1': 85, 'activation': 'tanh', 'learning_rate': 0.0016165772669452126, 'batch_size': 256, 'optimizer': 'Adam', 'max_epochs': 145}. Best is trial 27 with value: 7.372662965998451.
2025-05-08 05:19:48.2550Z [I 2025-05-08 08:19:48,254] Trial 135 finished with value: 8.247425486819782 and parameters: {'n_layers': 3, 'n_units_0': 80, 'n_units_1': 98, 'n_units_2': 57, 'activation': 'tanh', 'learning_rate': 0.0005935376364206312, 'batch_size': 16, 'optimizer': 'Adam', 'max_epochs': 332}. Best is trial 27 with value: 7.372662965998451.
2025-05-08 05:20:57.4709Z [I 2025-05-08 08:20:57,470] Trial 136 finished with value: 59.22762548924066 and parameters: {'n_layers': 2, 'n_units_0': 67, 'n_units_1': 88, 'activation': 'tanh', 'learning_rate': 0.0018949209091613972, 'batch_size': 256, 'optimizer': 'LBFGS', 'max_epochs': 285}. Best is trial 27 with value: 7.372662965998451.
2025-05-08 05:31:14.7275Z [I 2025-05-08 08:31:14,727] Trial 137 finished with value: 8.121542326926974 and parameters: {'n_layers': 3, 'n_units_0': 93, 'n_units_1': 91, 'n_units_2': 68, 'activation': 'tanh', 'learning_rate': 0.0008014883040144911, 'batch_size': 32, 'optimizer': 'Adam', 'max_epochs': 389}. Best is trial 27 with value: 7.372662965998451.
2025-05-08 05:35:41.1966Z [I 2025-05-08 08:35:41,196] Trial 138 finished with value: 9.425791772424711 and parameters: {'n_layers': 4, 'n_units_0': 78, 'n_units_1': 93, 'n_units_2': 75, 'n_units_3': 28, 'activation': 'tanh', 'learning_rate': 0.0012287083898174886, 'batch_size': 128, 'optimizer': 'RMSprop', 'max_epochs': 379}. Best is trial 27 with value: 7.372662965998451.
2025-05-08 05:40:57.1420Z [I 2025-05-08 08:40:57,141] Trial 139 finished with value: 7.767897336758759 and parameters: {'n_layers': 2, 'n_units_0': 90, 'n_units_1': 96, 'activation': 'tanh', 'learning_rate': 0.0029559147045339026, 'batch_size': 128, 'optimizer': 'Adam', 'max_epochs': 184}. Best is trial 27 with value: 7.372662965998451.
2025-05-08 05:46:26.5656Z [I 2025-05-08 08:46:26,565] Trial 140 finished with value: 13.946560365212198 and parameters: {'n_layers': 1, 'n_units_0': 91, 'activation': 'tanh', 'learning_rate': 0.0035030577836254262, 'batch_size': 256, 'optimizer': 'Adam', 'max_epochs': 135}. Best is trial 27 with value: 7.372662965998451.
2025-05-08 05:52:53.0917Z [I 2025-05-08 08:52:53,091] Trial 141 finished with value: 8.00893189584633 and parameters: {'n_layers': 2, 'n_units_0': 87, 'n_units_1': 100, 'activation': 'tanh', 'learning_rate': 0.0023904302279554937, 'batch_size': 128, 'optimizer': 'Adam', 'max_epochs': 202}. Best is trial 27 with value: 7.372662965998451.
2025-05-08 05:59:06.9319Z [I 2025-05-08 08:59:06,931] Trial 142 finished with value: 7.79205528010943 and parameters: {'n_layers': 2, 'n_units_0': 87, 'n_units_1': 100, 'activation': 'tanh', 'learning_rate': 0.0029997955619313573, 'batch_size': 128, 'optimizer': 'Adam', 'max_epochs': 195}. Best is trial 27 with value: 7.372662965998451.
2025-05-08 06:03:37.4543Z [I 2025-05-08 09:03:37,454] Trial 143 finished with value: 7.946951457986008 and parameters: {'n_layers': 2, 'n_units_0': 87, 'n_units_1': 100, 'activation': 'tanh', 'learning_rate': 0.0029979508954231632, 'batch_size': 128, 'optimizer': 'Adam', 'max_epochs': 201}. Best is trial 27 with value: 7.372662965998451.
2025-05-08 06:13:29.5092Z [I 2025-05-08 09:13:29,508] Trial 144 finished with value: 12.67108445341542 and parameters: {'n_layers': 1, 'n_units_0': 87, 'activation': 'tanh', 'learning_rate': 0.003047623827429659, 'batch_size': 128, 'optimizer': 'Adam', 'max_epochs': 205}. Best is trial 27 with value: 7.372662965998451.
2025-05-08 06:18:36.6559Z [I 2025-05-08 09:18:36,655] Trial 145 finished with value: 7.97498774512614 and parameters: {'n_layers': 2, 'n_units_0': 95, 'n_units_1': 100, 'activation': 'tanh', 'learning_rate': 0.004998817714107859, 'batch_size': 128, 'optimizer': 'Adam', 'max_epochs': 180}. Best is trial 27 with value: 7.372662965998451.
2025-05-08 06:26:10.4626Z [I 2025-05-08 09:26:10,462] Trial 146 finished with value: 8.10917507505845 and parameters: {'n_layers': 2, 'n_units_0': 94, 'n_units_1': 100, 'activation': 'tanh', 'learning_rate': 0.002236915182958655, 'batch_size': 128, 'optimizer': 'Adam', 'max_epochs': 196}. Best is trial 27 with value: 7.372662965998451.
2025-05-08 06:26:33.8222Z [I 2025-05-08 09:26:33,822] Trial 147 finished with value: 1000000.0 and parameters: {'n_layers': 1, 'n_units_0': 86, 'activation': 'relu', 'learning_rate': 0.005144063392766057, 'batch_size': 128, 'optimizer': 'LBFGS', 'max_epochs': 187}. Best is trial 27 with value: 7.372662965998451.
2025-05-08 06:30:40.2142Z [I 2025-05-08 09:30:40,214] Trial 148 finished with value: 8.468193232966485 and parameters: {'n_layers': 2, 'n_units_0': 88, 'n_units_1': 100, 'activation': 'tanh', 'learning_rate': 0.006735149510999822, 'batch_size': 128, 'optimizer': 'Adam', 'max_epochs': 173}. Best is trial 27 with value: 7.372662965998451.
2025-05-08 06:35:12.2916Z [I 2025-05-08 09:35:12,291] Trial 149 finished with value: 8.127594518895133 and parameters: {'n_layers': 2, 'n_units_0': 97, 'n_units_1': 98, 'activation': 'tanh', 'learning_rate': 0.004446034025883105, 'batch_size': 128, 'optimizer': 'Adam', 'max_epochs': 182}. Best is trial 27 with value: 7.372662965998451.
2025-05-08 06:43:28.9018Z [I 2025-05-08 09:43:28,901] Trial 150 finished with value: 8.332589790233568 and parameters: {'n_layers': 2, 'n_units_0': 92, 'n_units_1': 96, 'activation': 'logistic', 'learning_rate': 0.0024733544129946407, 'batch_size': 128, 'optimizer': 'Adam', 'max_epochs': 160}. Best is trial 27 with value: 7.372662965998451.
2025-05-08 06:49:32.6730Z [I 2025-05-08 09:49:32,672] Trial 151 finished with value: 7.882731441992189 and parameters: {'n_layers': 2, 'n_units_0': 89, 'n_units_1': 97, 'activation': 'tanh', 'learning_rate': 0.003022789356836311, 'batch_size': 128, 'optimizer': 'Adam', 'max_epochs': 197}. Best is trial 27 with value: 7.372662965998451.
2025-05-08 06:54:22.1977Z [I 2025-05-08 09:54:22,197] Trial 152 finished with value: 8.355153723899997 and parameters: {'n_layers': 2, 'n_units_0': 84, 'n_units_1': 97, 'activation': 'tanh', 'learning_rate': 0.003780107729491633, 'batch_size': 128, 'optimizer': 'Adam', 'max_epochs': 193}. Best is trial 27 with value: 7.372662965998451.
2025-05-08 07:04:37.9732Z [I 2025-05-08 10:04:37,973] Trial 153 finished with value: 12.667144833289743 and parameters: {'n_layers': 1, 'n_units_0': 95, 'activation': 'tanh', 'learning_rate': 0.0027489983627765864, 'batch_size': 128, 'optimizer': 'Adam', 'max_epochs': 215}. Best is trial 27 with value: 7.372662965998451.
2025-05-08 07:11:25.6898Z [I 2025-05-08 10:11:25,689] Trial 154 finished with value: 8.067144904134105 and parameters: {'n_layers': 2, 'n_units_0': 88, 'n_units_1': 99, 'activation': 'tanh', 'learning_rate': 0.001971619581185409, 'batch_size': 128, 'optimizer': 'Adam', 'max_epochs': 198}. Best is trial 27 with value: 7.372662965998451.
2025-05-08 07:13:58.2091Z [I 2025-05-08 10:13:58,208] Trial 155 finished with value: 9.199111762912901 and parameters: {'n_layers': 2, 'n_units_0': 92, 'n_units_1': 96, 'activation': 'tanh', 'learning_rate': 0.020556830844484605, 'batch_size': 128, 'optimizer': 'Adam', 'max_epochs': 175}. Best is trial 27 with value: 7.372662965998451.
2025-05-08 07:23:51.6470Z [I 2025-05-08 10:23:51,646] Trial 156 finished with value: 12.844350536256872 and parameters: {'n_layers': 1, 'n_units_0': 86, 'activation': 'tanh', 'learning_rate': 0.003672194690162196, 'batch_size': 128, 'optimizer': 'Adam', 'max_epochs': 226}. Best is trial 27 with value: 7.372662965998451.
2025-05-08 07:31:41.5679Z [I 2025-05-08 10:31:41,567] Trial 157 finished with value: 7.958723155222489 and parameters: {'n_layers': 2, 'n_units_0': 95, 'n_units_1': 99, 'activation': 'tanh', 'learning_rate': 0.001640527829147482, 'batch_size': 128, 'optimizer': 'Adam', 'max_epochs': 183}. Best is trial 27 with value: 7.372662965998451.
2025-05-08 07:34:54.3825Z [I 2025-05-08 10:34:54,382] Trial 158 finished with value: 16.370019519307238 and parameters: {'n_layers': 1, 'n_units_0': 23, 'activation': 'tanh', 'learning_rate': 0.0022990324092545074, 'batch_size': 128, 'optimizer': 'SGD', 'max_epochs': 164}. Best is trial 27 with value: 7.372662965998451.
2025-05-08 07:35:50.1681Z [I 2025-05-08 10:35:50,167] Trial 159 finished with value: 119.19907684992782 and parameters: {'n_layers': 2, 'n_units_0': 89, 'n_units_1': 100, 'activation': 'tanh', 'learning_rate': 0.001578638712251, 'batch_size': 128, 'optimizer': 'LBFGS', 'max_epochs': 239}. Best is trial 27 with value: 7.372662965998451.
2025-05-08 07:39:38.6605Z [I 2025-05-08 10:39:38,660] Trial 160 finished with value: 8.234571885247027 and parameters: {'n_layers': 2, 'n_units_0': 83, 'n_units_1': 98, 'activation': 'tanh', 'learning_rate': 0.012933695670164141, 'batch_size': 128, 'optimizer': 'Adam', 'max_epochs': 182}. Best is trial 27 with value: 7.372662965998451.
2025-05-08 07:46:30.7371Z [I 2025-05-08 10:46:30,736] Trial 161 finished with value: 7.9092073601388035 and parameters: {'n_layers': 2, 'n_units_0': 96, 'n_units_1': 96, 'activation': 'tanh', 'learning_rate': 0.0018177649175668857, 'batch_size': 128, 'optimizer': 'Adam', 'max_epochs': 206}. Best is trial 27 with value: 7.372662965998451.
2025-05-08 07:53:48.7751Z [I 2025-05-08 10:53:48,774] Trial 162 finished with value: 8.149369066775872 and parameters: {'n_layers': 2, 'n_units_0': 96, 'n_units_1': 96, 'activation': 'tanh', 'learning_rate': 0.0018762472398746507, 'batch_size': 128, 'optimizer': 'Adam', 'max_epochs': 210}. Best is trial 27 with value: 7.372662965998451.
2025-05-08 07:58:55.1502Z [I 2025-05-08 10:58:55,149] Trial 163 finished with value: 8.110237208047664 and parameters: {'n_layers': 2, 'n_units_0': 94, 'n_units_1': 100, 'activation': 'tanh', 'learning_rate': 0.0031639588522208266, 'batch_size': 128, 'optimizer': 'Adam', 'max_epochs': 201}. Best is trial 27 with value: 7.372662965998451.
2025-05-08 08:08:03.4806Z [I 2025-05-08 11:08:03,480] Trial 164 finished with value: 12.807272537835619 and parameters: {'n_layers': 1, 'n_units_0': 91, 'activation': 'tanh', 'learning_rate': 0.0026655611446531223, 'batch_size': 128, 'optimizer': 'Adam', 'max_epochs': 190}. Best is trial 27 with value: 7.372662965998451.
2025-05-08 08:15:48.8346Z [I 2025-05-08 11:15:48,834] Trial 165 finished with value: 7.631830126857193 and parameters: {'n_layers': 2, 'n_units_0': 60, 'n_units_1': 95, 'activation': 'tanh', 'learning_rate': 0.0022159501612969822, 'batch_size': 128, 'optimizer': 'Adam', 'max_epochs': 150}. Best is trial 27 with value: 7.372662965998451.
2025-05-08 08:22:47.9302Z [I 2025-05-08 11:22:47,929] Trial 166 finished with value: 8.270840764142468 and parameters: {'n_layers': 2, 'n_units_0': 93, 'n_units_1': 94, 'activation': 'tanh', 'learning_rate': 0.0022675253097937105, 'batch_size': 128, 'optimizer': 'Adam', 'max_epochs': 151}. Best is trial 27 with value: 7.372662965998451.
2025-05-08 08:30:41.4996Z [I 2025-05-08 11:30:41,499] Trial 167 finished with value: 8.61748984836194 and parameters: {'n_layers': 2, 'n_units_0': 53, 'n_units_1': 96, 'activation': 'tanh', 'learning_rate': 0.0016655591302095997, 'batch_size': 128, 'optimizer': 'Adam', 'max_epochs': 170}. Best is trial 27 with value: 7.372662965998451.
2025-05-08 08:39:24.2056Z [I 2025-05-08 11:39:24,205] Trial 168 finished with value: 12.802848046072418 and parameters: {'n_layers': 1, 'n_units_0': 85, 'activation': 'tanh', 'learning_rate': 0.004173794439183645, 'batch_size': 128, 'optimizer': 'Adam', 'max_epochs': 181}. Best is trial 27 with value: 7.372662965998451.
2025-05-08 08:45:09.8470Z [I 2025-05-08 11:45:09,846] Trial 169 finished with value: 8.46112280138154 and parameters: {'n_layers': 2, 'n_units_0': 89, 'n_units_1': 98, 'activation': 'tanh', 'learning_rate': 0.00199954814720286, 'batch_size': 128, 'optimizer': 'RMSprop', 'max_epochs': 217}. Best is trial 27 with value: 7.372662965998451.
2025-05-08 08:47:31.5449Z [I 2025-05-08 11:47:31,544] Trial 170 finished with value: 8.188735519254292 and parameters: {'n_layers': 3, 'n_units_0': 81, 'n_units_1': 93, 'n_units_2': 53, 'activation': 'tanh', 'learning_rate': 0.005382577808848233, 'batch_size': 128, 'optimizer': 'Adam', 'max_epochs': 204}. Best is trial 27 with value: 7.372662965998451.
2025-05-08 08:52:53.3773Z [I 2025-05-08 11:52:53,377] Trial 171 finished with value: 8.152944545422972 and parameters: {'n_layers': 2, 'n_units_0': 58, 'n_units_1': 98, 'activation': 'tanh', 'learning_rate': 0.002634110858229303, 'batch_size': 128, 'optimizer': 'Adam', 'max_epochs': 155}. Best is trial 27 with value: 7.372662965998451.
2025-05-08 08:56:45.8867Z [I 2025-05-08 11:56:45,886] Trial 172 finished with value: 7.860278462532031 and parameters: {'n_layers': 2, 'n_units_0': 61, 'n_units_1': 95, 'activation': 'tanh', 'learning_rate': 0.016141997938842228, 'batch_size': 128, 'optimizer': 'Adam', 'max_epochs': 166}. Best is trial 27 with value: 7.372662965998451.
2025-05-08 09:01:21.3684Z [I 2025-05-08 12:01:21,368] Trial 173 finished with value: 7.846958917422022 and parameters: {'n_layers': 2, 'n_units_0': 95, 'n_units_1': 95, 'activation': 'tanh', 'learning_rate': 0.003321438994496186, 'batch_size': 128, 'optimizer': 'Adam', 'max_epochs': 187}. Best is trial 27 with value: 7.372662965998451.
2025-05-08 09:07:26.1033Z [I 2025-05-08 12:07:26,103] Trial 174 finished with value: 8.000641320272052 and parameters: {'n_layers': 2, 'n_units_0': 61, 'n_units_1': 95, 'activation': 'tanh', 'learning_rate': 0.003498737626857368, 'batch_size': 128, 'optimizer': 'Adam', 'max_epochs': 188}. Best is trial 27 with value: 7.372662965998451.
2025-05-08 09:11:52.3572Z [I 2025-05-08 12:11:52,356] Trial 175 finished with value: 8.315167680197717 and parameters: {'n_layers': 2, 'n_units_0': 96, 'n_units_1': 95, 'activation': 'tanh', 'learning_rate': 0.0036759755759173895, 'batch_size': 128, 'optimizer': 'Adam', 'max_epochs': 190}. Best is trial 27 with value: 7.372662965998451.
2025-05-08 09:19:59.5241Z [I 2025-05-08 12:19:59,523] Trial 176 finished with value: 13.896264629543325 and parameters: {'n_layers': 1, 'n_units_0': 62, 'activation': 'tanh', 'learning_rate': 0.0030803858766094085, 'batch_size': 128, 'optimizer': 'Adam', 'max_epochs': 169}. Best is trial 27 with value: 7.372662965998451.
2025-05-08 09:20:29.7387Z [I 2025-05-08 12:20:29,738] Trial 177 finished with value: 9.580019789896296 and parameters: {'n_layers': 2, 'n_units_0': 55, 'n_units_1': 97, 'activation': 'tanh', 'learning_rate': 0.007885134149756919, 'batch_size': 128, 'optimizer': 'LBFGS', 'max_epochs': 179}. Best is trial 27 with value: 7.372662965998451.
2025-05-08 09:24:49.5639Z [I 2025-05-08 12:24:49,563] Trial 178 finished with value: 8.299785785898145 and parameters: {'n_layers': 2, 'n_units_0': 66, 'n_units_1': 95, 'activation': 'tanh', 'learning_rate': 0.004297019101536158, 'batch_size': 128, 'optimizer': 'Adam', 'max_epochs': 195}. Best is trial 27 with value: 7.372662965998451.
2025-05-08 09:33:45.5042Z [I 2025-05-08 12:33:45,503] Trial 179 finished with value: 14.195296913688471 and parameters: {'n_layers': 1, 'n_units_0': 60, 'activation': 'relu', 'learning_rate': 0.003069315046490857, 'batch_size': 128, 'optimizer': 'Adam', 'max_epochs': 185}. Best is trial 27 with value: 7.372662965998451.
2025-05-08 09:36:48.5680Z [I 2025-05-08 12:36:48,567] Trial 180 finished with value: 8.4941269275154 and parameters: {'n_layers': 2, 'n_units_0': 98, 'n_units_1': 100, 'activation': 'tanh', 'learning_rate': 0.014867412984598925, 'batch_size': 128, 'optimizer': 'Adam', 'max_epochs': 160}. Best is trial 27 with value: 7.372662965998451.
2025-05-08 09:43:11.2412Z [I 2025-05-08 12:43:11,240] Trial 181 finished with value: 8.814519988875023 and parameters: {'n_layers': 2, 'n_units_0': 60, 'n_units_1': 93, 'activation': 'tanh', 'learning_rate': 0.0022778984355520003, 'batch_size': 128, 'optimizer': 'Adam', 'max_epochs': 206}. Best is trial 27 with value: 7.372662965998451.
