2025-05-14 08:46:03.3502Z [I 2025-05-14 11:46:03,350] Trial 119 finished with value: 7.188148270272388 and parameters: {'n_layers': 3, 'n_units_0': 63, 'n_units_1': 92, 'n_units_2': 53, 'activation': 'tanh', 'learning_rate': 0.03164106625428449, 'batch_size': 32768, 'optimizer': 'LBFGS', 'max_epochs': 279}. Best is trial 90 with value: 5.515917718916803.
2025-05-14 08:49:17.5107Z [I 2025-05-14 11:49:17,510] Trial 105 finished with value: 30.09837893559687 and parameters: {'n_layers': 4, 'n_units_0': 42, 'n_units_1': 49, 'n_units_2': 51, 'n_units_3': 91, 'activation': 'logistic', 'learning_rate': 0.006745311707137621, 'batch_size': 32768, 'optimizer': 'RMSprop', 'max_epochs': 282}. Best is trial 90 with value: 5.515917718916803.
2025-05-14 08:53:28.6612Z [I 2025-05-14 11:53:28,660] Trial 109 finished with value: 23.519132576861093 and parameters: {'n_layers': 4, 'n_units_0': 62, 'n_units_1': 23, 'n_units_2': 42, 'n_units_3': 93, 'activation': 'tanh', 'learning_rate': 0.004736879231996288, 'batch_size': 32768, 'optimizer': 'RMSprop', 'max_epochs': 343}. Best is trial 90 with value: 5.515917718916803.
2025-05-14 08:57:28.1572Z [I 2025-05-14 11:57:28,157] Trial 104 finished with value: 73.35809536956369 and parameters: {'n_layers': 4, 'n_units_0': 40, 'n_units_1': 69, 'n_units_2': 51, 'n_units_3': 93, 'activation': 'tanh', 'learning_rate': 8.056117199937124e-05, 'batch_size': 32768, 'optimizer': 'RMSprop', 'max_epochs': 308}. Best is trial 90 with value: 5.515917718916803.
2025-05-14 09:00:41.6233Z [I 2025-05-14 12:00:41,623] Trial 120 finished with value: 7.166135930953878 and parameters: {'n_layers': 3, 'n_units_0': 63, 'n_units_1': 39, 'n_units_2': 54, 'activation': 'tanh', 'learning_rate': 0.005762625760738692, 'batch_size': 32768, 'optimizer': 'LBFGS', 'max_epochs': 283}. Best is trial 90 with value: 5.515917718916803.
2025-05-14 09:01:40.3630Z [I 2025-05-14 12:01:40,362] Trial 121 finished with value: 6.770151364143065 and parameters: {'n_layers': 2, 'n_units_0': 44, 'n_units_1': 47, 'activation': 'tanh', 'learning_rate': 0.03588730667375191, 'batch_size': 32768, 'optimizer': 'LBFGS', 'max_epochs': 279}. Best is trial 90 with value: 5.515917718916803.
2025-05-14 09:01:42.9437Z [I 2025-05-14 12:01:42,943] Trial 122 finished with value: 7.026207501768657 and parameters: {'n_layers': 2, 'n_units_0': 36, 'n_units_1': 23, 'activation': 'tanh', 'learning_rate': 0.04004138403163404, 'batch_size': 32768, 'optimizer': 'LBFGS', 'max_epochs': 262}. Best is trial 90 with value: 5.515917718916803.
2025-05-14 09:04:40.9749Z [I 2025-05-14 12:04:40,974] Trial 123 finished with value: 6.494333585009235 and parameters: {'n_layers': 2, 'n_units_0': 44, 'n_units_1': 80, 'activation': 'tanh', 'learning_rate': 0.011630604830671305, 'batch_size': 32768, 'optimizer': 'LBFGS', 'max_epochs': 359}. Best is trial 90 with value: 5.515917718916803.
2025-05-14 09:08:04.8696Z [I 2025-05-14 12:08:04,869] Trial 125 finished with value: 5.674817039464487 and parameters: {'n_layers': 2, 'n_units_0': 50, 'n_units_1': 77, 'activation': 'tanh', 'learning_rate': 0.03960963701103604, 'batch_size': 32768, 'optimizer': 'LBFGS', 'max_epochs': 265}. Best is trial 90 with value: 5.515917718916803.
2025-05-14 09:14:39.6650Z [I 2025-05-14 12:14:39,664] Trial 127 finished with value: 8.725596375291042 and parameters: {'n_layers': 2, 'n_units_0': 34, 'n_units_1': 48, 'activation': 'relu', 'learning_rate': 0.03881127030456932, 'batch_size': 32768, 'optimizer': 'LBFGS', 'max_epochs': 256}. Best is trial 90 with value: 5.515917718916803.
2025-05-14 09:14:48.8272Z [I 2025-05-14 12:14:48,826] Trial 124 finished with value: 7.087387390856815 and parameters: {'n_layers': 2, 'n_units_0': 45, 'n_units_1': 26, 'activation': 'tanh', 'learning_rate': 0.09706437484430701, 'batch_size': 32768, 'optimizer': 'LBFGS', 'max_epochs': 258}. Best is trial 90 with value: 5.515917718916803.
2025-05-14 09:15:09.0096Z [I 2025-05-14 12:15:09,009] Trial 126 finished with value: 6.223094860071729 and parameters: {'n_layers': 2, 'n_units_0': 45, 'n_units_1': 41, 'activation': 'tanh', 'learning_rate': 0.03701580254557634, 'batch_size': 32768, 'optimizer': 'LBFGS', 'max_epochs': 300}. Best is trial 90 with value: 5.515917718916803.
2025-05-14 09:16:13.1724Z [I 2025-05-14 12:16:13,172] Trial 111 finished with value: 24.47572712426985 and parameters: {'n_layers': 4, 'n_units_0': 36, 'n_units_1': 49, 'n_units_2': 50, 'n_units_3': 72, 'activation': 'tanh', 'learning_rate': 0.0043933468133523544, 'batch_size': 32768, 'optimizer': 'RMSprop', 'max_epochs': 319}. Best is trial 90 with value: 5.515917718916803.
2025-05-14 09:18:23.4956Z [I 2025-05-14 12:18:23,495] Trial 128 finished with value: 6.3772229077695615 and parameters: {'n_layers': 2, 'n_units_0': 32, 'n_units_1': 47, 'activation': 'tanh', 'learning_rate': 0.03684805883497274, 'batch_size': 32768, 'optimizer': 'LBFGS', 'max_epochs': 261}. Best is trial 90 with value: 5.515917718916803.
2025-05-14 09:20:28.0274Z [I 2025-05-14 12:20:28,027] Trial 131 finished with value: 10.44617216100629 and parameters: {'n_layers': 1, 'n_units_0': 50, 'activation': 'tanh', 'learning_rate': 0.06441475970999481, 'batch_size': 32768, 'optimizer': 'LBFGS', 'max_epochs': 298}. Best is trial 90 with value: 5.515917718916803.
2025-05-14 09:24:38.4633Z [I 2025-05-14 12:24:38,463] Trial 133 finished with value: 9.64619391298122 and parameters: {'n_layers': 1, 'n_units_0': 51, 'activation': 'tanh', 'learning_rate': 0.013280924826347653, 'batch_size': 32768, 'optimizer': 'LBFGS', 'max_epochs': 299}. Best is trial 90 with value: 5.515917718916803.
2025-05-14 09:24:45.9711Z [I 2025-05-14 12:24:45,970] Trial 129 finished with value: 5.78407309397076 and parameters: {'n_layers': 2, 'n_units_0': 45, 'n_units_1': 47, 'activation': 'tanh', 'learning_rate': 0.07025392263839067, 'batch_size': 32768, 'optimizer': 'LBFGS', 'max_epochs': 297}. Best is trial 90 with value: 5.515917718916803.
2025-05-14 09:25:14.1333Z [I 2025-05-14 12:25:14,133] Trial 130 finished with value: 10.09498045422049 and parameters: {'n_layers': 1, 'n_units_0': 44, 'activation': 'tanh', 'learning_rate': 0.06891424507569965, 'batch_size': 32768, 'optimizer': 'LBFGS', 'max_epochs': 300}. Best is trial 90 with value: 5.515917718916803.
2025-05-14 09:25:50.6115Z [I 2025-05-14 12:25:50,611] Trial 132 finished with value: 11.834374896851068 and parameters: {'n_layers': 1, 'n_units_0': 52, 'activation': 'tanh', 'learning_rate': 0.012952311641616393, 'batch_size': 32768, 'optimizer': 'LBFGS', 'max_epochs': 359}. Best is trial 90 with value: 5.515917718916803.
2025-05-14 09:28:52.3353Z [I 2025-05-14 12:28:52,335] Trial 134 finished with value: 11.480858172197633 and parameters: {'n_layers': 1, 'n_units_0': 29, 'activation': 'tanh', 'learning_rate': 0.06848662489885289, 'batch_size': 32768, 'optimizer': 'LBFGS', 'max_epochs': 360}. Best is trial 90 with value: 5.515917718916803.
2025-05-14 09:28:57.8555Z [I 2025-05-14 12:28:57,855] Trial 135 finished with value: 2493.43307509947 and parameters: {'n_layers': 1, 'n_units_0': 23, 'activation': 'tanh', 'learning_rate': 0.012220611634506263, 'batch_size': 32768, 'optimizer': 'LBFGS', 'max_epochs': 361}. Best is trial 90 with value: 5.515917718916803.
2025-05-14 09:29:10.3023Z [I 2025-05-14 12:29:10,302] Trial 110 finished with value: 23.369245667466597 and parameters: {'n_layers': 4, 'n_units_0': 63, 'n_units_1': 56, 'n_units_2': 51, 'n_units_3': 73, 'activation': 'tanh', 'learning_rate': 0.00427355057288892, 'batch_size': 32768, 'optimizer': 'RMSprop', 'max_epochs': 378}. Best is trial 90 with value: 5.515917718916803.
2025-05-14 09:33:53.3916Z [I 2025-05-14 12:33:53,391] Trial 112 finished with value: 36.816452461841024 and parameters: {'n_layers': 4, 'n_units_0': 41, 'n_units_1': 51, 'n_units_2': 50, 'n_units_3': 72, 'activation': 'tanh', 'learning_rate': 0.0026222447230241103, 'batch_size': 32768, 'optimizer': 'RMSprop', 'max_epochs': 302}. Best is trial 90 with value: 5.515917718916803.
2025-05-14 09:34:52.0581Z [I 2025-05-14 12:34:52,057] Trial 136 finished with value: 6.708889987509257 and parameters: {'n_layers': 2, 'n_units_0': 28, 'n_units_1': 79, 'activation': 'tanh', 'learning_rate': 0.030171386803069484, 'batch_size': 32768, 'optimizer': 'LBFGS', 'max_epochs': 240}. Best is trial 90 with value: 5.515917718916803.
2025-05-14 09:34:58.5117Z [I 2025-05-14 12:34:58,511] Trial 139 finished with value: 5.982678524020603 and parameters: {'n_layers': 2, 'n_units_0': 55, 'n_units_1': 42, 'activation': 'tanh', 'learning_rate': 0.030210260015666433, 'batch_size': 32768, 'optimizer': 'LBFGS', 'max_epochs': 246}. Best is trial 90 with value: 5.515917718916803.
2025-05-14 09:36:10.9688Z [I 2025-05-14 12:36:10,968] Trial 137 finished with value: 6.896091360314529 and parameters: {'n_layers': 2, 'n_units_0': 30, 'n_units_1': 56, 'activation': 'tanh', 'learning_rate': 0.03263804950893259, 'batch_size': 32768, 'optimizer': 'LBFGS', 'max_epochs': 242}. Best is trial 90 with value: 5.515917718916803.
2025-05-14 09:36:31.4021Z [I 2025-05-14 12:36:31,401] Trial 138 finished with value: 6.781388663706863 and parameters: {'n_layers': 2, 'n_units_0': 29, 'n_units_1': 53, 'activation': 'tanh', 'learning_rate': 0.030737273688580535, 'batch_size': 32768, 'optimizer': 'LBFGS', 'max_epochs': 244}. Best is trial 90 with value: 5.515917718916803.
2025-05-14 09:37:57.7465Z [I 2025-05-14 12:37:57,746] Trial 142 finished with value: 5.438670766784165 and parameters: {'n_layers': 2, 'n_units_0': 55, 'n_units_1': 52, 'activation': 'tanh', 'learning_rate': 0.0298189919588123, 'batch_size': 32768, 'optimizer': 'LBFGS', 'max_epochs': 245}. Best is trial 142 with value: 5.438670766784165.
2025-05-14 09:38:13.9856Z [I 2025-05-14 12:38:13,985] Trial 141 finished with value: 6.428980254237448 and parameters: {'n_layers': 2, 'n_units_0': 56, 'n_units_1': 53, 'activation': 'tanh', 'learning_rate': 0.08092084086313991, 'batch_size': 32768, 'optimizer': 'LBFGS', 'max_epochs': 423}. Best is trial 142 with value: 5.438670766784165.
2025-05-14 09:38:46.1750Z [I 2025-05-14 12:38:46,174] Trial 140 finished with value: 6.359672520681587 and parameters: {'n_layers': 2, 'n_units_0': 54, 'n_units_1': 53, 'activation': 'tanh', 'learning_rate': 0.08824088398061623, 'batch_size': 32768, 'optimizer': 'LBFGS', 'max_epochs': 405}. Best is trial 142 with value: 5.438670766784165.
2025-05-14 09:45:19.7147Z [I 2025-05-14 12:45:19,714] Trial 145 finished with value: 6.253876056395726 and parameters: {'n_layers': 2, 'n_units_0': 56, 'n_units_1': 45, 'activation': 'tanh', 'learning_rate': 0.043958948801564715, 'batch_size': 32768, 'optimizer': 'LBFGS', 'max_epochs': 267}. Best is trial 142 with value: 5.438670766784165.
2025-05-14 09:45:25.4683Z [I 2025-05-14 12:45:25,468] Trial 150 finished with value: 6.65177086218605 and parameters: {'n_layers': 2, 'n_units_0': 54, 'n_units_1': 45, 'activation': 'tanh', 'learning_rate': 0.04010052817466522, 'batch_size': 32768, 'optimizer': 'LBFGS', 'max_epochs': 415}. Best is trial 142 with value: 5.438670766784165.
2025-05-14 09:45:34.6732Z [I 2025-05-14 12:45:34,673] Trial 143 finished with value: 9.969839771938414 and parameters: {'n_layers': 2, 'n_units_0': 18, 'n_units_1': 78, 'activation': 'tanh', 'learning_rate': 0.032078590898415714, 'batch_size': 32768, 'optimizer': 'LBFGS', 'max_epochs': 264}. Best is trial 142 with value: 5.438670766784165.
2025-05-14 09:46:28.5577Z [I 2025-05-14 12:46:28,557] Trial 147 finished with value: 7.334672487692207 and parameters: {'n_layers': 2, 'n_units_0': 55, 'n_units_1': 42, 'activation': 'tanh', 'learning_rate': 0.04273513360829304, 'batch_size': 32768, 'optimizer': 'LBFGS', 'max_epochs': 225}. Best is trial 142 with value: 5.438670766784165.
2025-05-14 09:46:47.7043Z [I 2025-05-14 12:46:47,704] Trial 146 finished with value: 5.5991268635307 and parameters: {'n_layers': 2, 'n_units_0': 55, 'n_units_1': 43, 'activation': 'tanh', 'learning_rate': 0.0410478859375131, 'batch_size': 32768, 'optimizer': 'LBFGS', 'max_epochs': 268}. Best is trial 142 with value: 5.438670766784165.
2025-05-14 09:48:12.6646Z [I 2025-05-14 12:48:12,664] Trial 149 finished with value: 6.5053102369753955 and parameters: {'n_layers': 2, 'n_units_0': 53, 'n_units_1': 43, 'activation': 'tanh', 'learning_rate': 0.04493573494435772, 'batch_size': 32768, 'optimizer': 'LBFGS', 'max_epochs': 222}. Best is trial 142 with value: 5.438670766784165.
2025-05-14 09:48:27.0001Z [I 2025-05-14 12:48:26,999] Trial 148 finished with value: 6.255062646834188 and parameters: {'n_layers': 2, 'n_units_0': 55, 'n_units_1': 42, 'activation': 'tanh', 'learning_rate': 0.023651901841787507, 'batch_size': 32768, 'optimizer': 'LBFGS', 'max_epochs': 227}. Best is trial 142 with value: 5.438670766784165.
2025-05-14 09:48:39.2750Z [I 2025-05-14 12:48:39,274] Trial 144 finished with value: 9.794036015835973 and parameters: {'n_layers': 2, 'n_units_0': 11, 'n_units_1': 42, 'activation': 'tanh', 'learning_rate': 0.08304969997092718, 'batch_size': 32768, 'optimizer': 'LBFGS', 'max_epochs': 268}. Best is trial 142 with value: 5.438670766784165.
2025-05-14 09:54:15.0842Z [I 2025-05-14 12:54:15,083] Trial 151 finished with value: 5.990784561666914 and parameters: {'n_layers': 2, 'n_units_0': 54, 'n_units_1': 43, 'activation': 'tanh', 'learning_rate': 0.04351428559179008, 'batch_size': 32768, 'optimizer': 'LBFGS', 'max_epochs': 264}. Best is trial 142 with value: 5.438670766784165.
2025-05-14 09:54:22.7108Z [I 2025-05-14 12:54:22,710] Trial 155 finished with value: 206.01953980448067 and parameters: {'n_layers': 3, 'n_units_0': 53, 'n_units_1': 41, 'n_units_2': 33, 'activation': 'logistic', 'learning_rate': 0.055208825833165116, 'batch_size': 32768, 'optimizer': 'LBFGS', 'max_epochs': 222}. Best is trial 142 with value: 5.438670766784165.
2025-05-14 09:56:28.3265Z [I 2025-05-14 12:56:28,326] Trial 153 finished with value: 7.275928828666771 and parameters: {'n_layers': 3, 'n_units_0': 54, 'n_units_1': 42, 'n_units_2': 38, 'activation': 'tanh', 'learning_rate': 0.04520116972994785, 'batch_size': 32768, 'optimizer': 'LBFGS', 'max_epochs': 225}. Best is trial 142 with value: 5.438670766784165.
2025-05-14 09:58:18.1877Z [I 2025-05-14 12:58:18,187] Trial 158 finished with value: 6.6423090695473235 and parameters: {'n_layers': 3, 'n_units_0': 57, 'n_units_1': 40, 'n_units_2': 76, 'activation': 'tanh', 'learning_rate': 0.057600345010978556, 'batch_size': 32768, 'optimizer': 'LBFGS', 'max_epochs': 254}. Best is trial 142 with value: 5.438670766784165.
2025-05-14 09:59:07.7499Z [I 2025-05-14 12:59:07,749] Trial 154 finished with value: 9.367877747061323 and parameters: {'n_layers': 3, 'n_units_0': 49, 'n_units_1': 40, 'n_units_2': 32, 'activation': 'tanh', 'learning_rate': 0.054094872393215906, 'batch_size': 32768, 'optimizer': 'LBFGS', 'max_epochs': 251}. Best is trial 142 with value: 5.438670766784165.
2025-05-14 09:59:08.6112Z [I 2025-05-14 12:59:08,611] Trial 156 finished with value: 7.090595098359302 and parameters: {'n_layers': 3, 'n_units_0': 50, 'n_units_1': 40, 'n_units_2': 37, 'activation': 'logistic', 'learning_rate': 0.02172889453777798, 'batch_size': 32768, 'optimizer': 'LBFGS', 'max_epochs': 249}. Best is trial 142 with value: 5.438670766784165.
2025-05-14 09:59:13.2735Z [I 2025-05-14 12:59:13,273] Trial 152 finished with value: 10.459453588623003 and parameters: {'n_layers': 3, 'n_units_0': 19, 'n_units_1': 40, 'n_units_2': 36, 'activation': 'tanh', 'learning_rate': 0.042921180659417454, 'batch_size': 32768, 'optimizer': 'LBFGS', 'max_epochs': 268}. Best is trial 142 with value: 5.438670766784165.
2025-05-14 10:03:27.2121Z [I 2025-05-14 13:03:27,211] Trial 164 finished with value: 1000000.0 and parameters: {'n_layers': 1, 'n_units_0': 56, 'activation': 'relu', 'learning_rate': 0.026932742141320177, 'batch_size': 32768, 'optimizer': 'SGD', 'max_epochs': 272}. Best is trial 142 with value: 5.438670766784165.
2025-05-14 10:03:41.3446Z [I 2025-05-14 13:03:41,344] Trial 157 finished with value: 6.539857877534466 and parameters: {'n_layers': 3, 'n_units_0': 50, 'n_units_1': 39, 'n_units_2': 33, 'activation': 'logistic', 'learning_rate': 0.05801803050385375, 'batch_size': 32768, 'optimizer': 'LBFGS', 'max_epochs': 268}. Best is trial 142 with value: 5.438670766784165.
2025-05-14 10:03:41.7850Z [I 2025-05-14 13:03:41,784] Trial 165 finished with value: 70.74925118309557 and parameters: {'n_layers': 1, 'n_units_0': 60, 'activation': 'relu', 'learning_rate': 0.023138848919184024, 'batch_size': 32768, 'optimizer': 'SGD', 'max_epochs': 235}. Best is trial 142 with value: 5.438670766784165.
2025-05-14 10:03:47.1994Z [I 2025-05-14 13:03:47,199] Trial 162 finished with value: 17.651816022345088 and parameters: {'n_layers': 1, 'n_units_0': 50, 'activation': 'relu', 'learning_rate': 0.0226677749333857, 'batch_size': 32768, 'optimizer': 'LBFGS', 'max_epochs': 248}. Best is trial 142 with value: 5.438670766784165.
2025-05-14 10:05:23.3677Z [I 2025-05-14 13:05:23,367] Trial 161 finished with value: 32.767415082837054 and parameters: {'n_layers': 1, 'n_units_0': 57, 'activation': 'relu', 'learning_rate': 0.023333738584376644, 'batch_size': 32768, 'optimizer': 'LBFGS', 'max_epochs': 251}. Best is trial 142 with value: 5.438670766784165.
2025-05-14 10:06:54.0008Z [I 2025-05-14 13:06:54,000] Trial 160 finished with value: 5.727758098033632 and parameters: {'n_layers': 3, 'n_units_0': 50, 'n_units_1': 39, 'n_units_2': 66, 'activation': 'tanh', 'learning_rate': 0.022898668088229338, 'batch_size': 32768, 'optimizer': 'LBFGS', 'max_epochs': 251}. Best is trial 142 with value: 5.438670766784165.
2025-05-14 10:07:26.8893Z [I 2025-05-14 13:07:26,888] Trial 159 finished with value: 6.944155413228896 and parameters: {'n_layers': 3, 'n_units_0': 56, 'n_units_1': 39, 'n_units_2': 32, 'activation': 'tanh', 'learning_rate': 0.0539568755643232, 'batch_size': 32768, 'optimizer': 'LBFGS', 'max_epochs': 252}. Best is trial 142 with value: 5.438670766784165.
2025-05-14 10:07:52.2276Z [I 2025-05-14 13:07:52,227] Trial 163 finished with value: 9.365939224974609 and parameters: {'n_layers': 1, 'n_units_0': 50, 'activation': 'tanh', 'learning_rate': 0.0230885231629091, 'batch_size': 32768, 'optimizer': 'LBFGS', 'max_epochs': 274}. Best is trial 142 with value: 5.438670766784165.
2025-05-14 10:11:39.7903Z [I 2025-05-14 13:11:39,790] Trial 167 finished with value: 6.124916854605463 and parameters: {'n_layers': 2, 'n_units_0': 59, 'n_units_1': 37, 'activation': 'tanh', 'learning_rate': 0.024114527573647182, 'batch_size': 32768, 'optimizer': 'LBFGS', 'max_epochs': 211}. Best is trial 142 with value: 5.438670766784165.
2025-05-14 10:11:41.6647Z [I 2025-05-14 13:11:41,664] Trial 168 finished with value: 6.046319507249037 and parameters: {'n_layers': 2, 'n_units_0': 46, 'n_units_1': 46, 'activation': 'tanh', 'learning_rate': 0.027738164050219092, 'batch_size': 32768, 'optimizer': 'LBFGS', 'max_epochs': 288}. Best is trial 142 with value: 5.438670766784165.
2025-05-14 10:12:54.9917Z [I 2025-05-14 13:12:54,991] Trial 169 finished with value: 6.889836895566525 and parameters: {'n_layers': 2, 'n_units_0': 47, 'n_units_1': 46, 'activation': 'tanh', 'learning_rate': 0.035458904856666376, 'batch_size': 32768, 'optimizer': 'LBFGS', 'max_epochs': 292}. Best is trial 142 with value: 5.438670766784165.
2025-05-14 10:15:57.8165Z [I 2025-05-14 13:15:57,816] Trial 166 finished with value: 7.785532313028878 and parameters: {'n_layers': 2, 'n_units_0': 47, 'n_units_1': 33, 'activation': 'tanh', 'learning_rate': 0.02141209307998587, 'batch_size': 32768, 'optimizer': 'LBFGS', 'max_epochs': 286}. Best is trial 142 with value: 5.438670766784165.
2025-05-14 10:16:58.9985Z [I 2025-05-14 13:16:58,998] Trial 170 finished with value: 6.706064571152794 and parameters: {'n_layers': 2, 'n_units_0': 52, 'n_units_1': 45, 'activation': 'tanh', 'learning_rate': 0.036606171968398306, 'batch_size': 32768, 'optimizer': 'LBFGS', 'max_epochs': 285}. Best is trial 142 with value: 5.438670766784165.
2025-05-14 10:18:29.4194Z [I 2025-05-14 13:18:29,419] Trial 171 finished with value: 72.43849087976295 and parameters: {'n_layers': 2, 'n_units_0': 46, 'n_units_1': 36, 'activation': 'tanh', 'learning_rate': 0.0001894326589366401, 'batch_size': 32768, 'optimizer': 'LBFGS', 'max_epochs': 287}. Best is trial 142 with value: 5.438670766784165.
2025-05-14 10:18:34.9839Z [I 2025-05-14 13:18:34,983] Trial 175 finished with value: 6.522577834448993 and parameters: {'n_layers': 2, 'n_units_0': 47, 'n_units_1': 45, 'activation': 'tanh', 'learning_rate': 0.033986258839725336, 'batch_size': 32768, 'optimizer': 'LBFGS', 'max_epochs': 287}. Best is trial 142 with value: 5.438670766784165.
2025-05-14 10:19:01.3760Z [I 2025-05-14 13:19:01,375] Trial 173 finished with value: 6.2392393939752 and parameters: {'n_layers': 2, 'n_units_0': 46, 'n_units_1': 33, 'activation': 'tanh', 'learning_rate': 0.030290140194863244, 'batch_size': 32768, 'optimizer': 'LBFGS', 'max_epochs': 288}. Best is trial 142 with value: 5.438670766784165.
2025-05-14 10:19:14.4465Z [I 2025-05-14 13:19:14,446] Trial 172 finished with value: 6.073186834573486 and parameters: {'n_layers': 2, 'n_units_0': 47, 'n_units_1': 45, 'activation': 'tanh', 'learning_rate': 0.027910685450234726, 'batch_size': 32768, 'optimizer': 'LBFGS', 'max_epochs': 284}. Best is trial 142 with value: 5.438670766784165.
2025-05-14 10:22:27.4822Z [I 2025-05-14 13:22:27,481] Trial 174 finished with value: 7.371360786100976 and parameters: {'n_layers': 2, 'n_units_0': 47, 'n_units_1': 36, 'activation': 'tanh', 'learning_rate': 0.028230186272871077, 'batch_size': 32768, 'optimizer': 'LBFGS', 'max_epochs': 284}. Best is trial 142 with value: 5.438670766784165.
