2025-05-07 13:00:05.6280Z Looking in indexes: https://artifactory.tcsbank.ru/artifactory/api/pypi/python-all/simple
2025-05-07 13:00:05.9743Z Collecting alembic==1.14.0
2025-05-07 13:00:06.0356Z   Downloading https://artifactory.tcsbank.ru/artifactory/api/pypi/python-all/packages/packages/alembic/1.14.0/alembic-1.14.0-py3-none-any.whl (233 kB)
2025-05-07 13:00:06.1313Z      ━━━━━━━━━━━━━━━━━━━━━━━━━━━━━━━━━━━━━━━ 233.5/233.5 kB 9.5 MB/s eta 0:00:00
2025-05-07 13:00:06.2424Z Collecting anyio==4.8.0
2025-05-07 13:00:06.3314Z   Downloading https://artifactory.tcsbank.ru/artifactory/api/pypi/python-all/packages/packages/anyio/4.8.0/anyio-4.8.0-py3-none-any.whl (96 kB)
2025-05-07 13:00:06.3314Z      ━━━━━━━━━━━━━━━━━━━━━━━━━━━━━━━━━━━━━━━━ 96.0/96.0 kB 8.7 MB/s eta 0:00:00
2025-05-07 13:00:06.4387Z Collecting appnope==0.1.4
2025-05-07 13:00:06.5357Z   Downloading https://artifactory.tcsbank.ru/artifactory/api/pypi/python-all/packages/packages/appnope/0.1.4/appnope-0.1.4-py2.py3-none-any.whl (4.3 kB)
2025-05-07 13:00:06.6733Z Collecting argon2-cffi==23.1.0
2025-05-07 13:00:06.7350Z   Downloading https://artifactory.tcsbank.ru/artifactory/api/pypi/python-all/packages/packages/argon2-cffi/23.1.0/argon2_cffi-23.1.0-py3-none-any.whl (15 kB)
2025-05-07 13:00:06.8500Z Collecting argon2-cffi-bindings==21.2.0
2025-05-07 13:00:06.9326Z   Downloading https://artifactory.tcsbank.ru/artifactory/api/pypi/python-all/packages/packages/argon2-cffi-bindings/21.2.0/argon2_cffi_bindings-21.2.0-cp36-abi3-manylinux_2_17_x86_64.manylinux2014_x86_64.whl (86 kB)
2025-05-07 13:00:06.9326Z      ━━━━━━━━━━━━━━━━━━━━━━━━━━━━━━━━━━━━━━━━ 86.2/86.2 kB 17.8 MB/s eta 0:00:00
2025-05-07 13:00:07.1006Z Collecting arrow==1.3.0
2025-05-07 13:00:07.1338Z   Downloading https://artifactory.tcsbank.ru/artifactory/api/pypi/python-all/packages/packages/arrow/1.3.0/arrow-1.3.0-py3-none-any.whl (66 kB)
2025-05-07 13:00:07.1375Z      ━━━━━━━━━━━━━━━━━━━━━━━━━━━━━━━━━━━━━━━━ 66.4/66.4 kB 33.9 MB/s eta 0:00:00
2025-05-07 13:00:07.2649Z Collecting asttokens==3.0.0
2025-05-07 13:00:07.3336Z   Downloading https://artifactory.tcsbank.ru/artifactory/api/pypi/python-all/packages/packages/asttokens/3.0.0/asttokens-3.0.0-py3-none-any.whl (26 kB)
2025-05-07 13:00:07.4344Z Collecting async-lru==2.0.4
2025-05-07 13:00:07.5314Z   Downloading https://artifactory.tcsbank.ru/artifactory/api/pypi/python-all/packages/packages/async-lru/2.0.4/async_lru-2.0.4-py3-none-any.whl (6.1 kB)
2025-05-07 13:00:07.6573Z Collecting attrs==24.3.0
2025-05-07 13:00:07.7325Z   Downloading https://artifactory.tcsbank.ru/artifactory/api/pypi/python-all/packages/packages/attrs/24.3.0/attrs-24.3.0-py3-none-any.whl (63 kB)
2025-05-07 13:00:07.7325Z      ━━━━━━━━━━━━━━━━━━━━━━━━━━━━━━━━━━━━━━━━ 63.4/63.4 kB 31.0 MB/s eta 0:00:00
2025-05-07 13:00:07.8845Z Collecting babel==2.16.0
2025-05-07 13:00:07.9185Z   Downloading https://artifactory.tcsbank.ru/artifactory/api/pypi/python-all/packages/packages/babel/2.16.0/babel-2.16.0-py3-none-any.whl (9.6 MB)
2025-05-07 13:00:08.0373Z      ━━━━━━━━━━━━━━━━━━━━━━━━━━━━━━━━━━━━━━━━ 9.6/9.6 MB 83.7 MB/s eta 0:00:00
2025-05-07 13:00:08.2494Z Collecting bayesian-optimization==2.0.3
2025-05-07 13:00:08.3124Z   Downloading https://artifactory.tcsbank.ru/artifactory/api/pypi/python-all/packages/packages/bayesian-optimization/2.0.3/bayesian_optimization-2.0.3-py3-none-any.whl (31 kB)
2025-05-07 13:00:08.4557Z Collecting beautifulsoup4==4.12.3
2025-05-07 13:00:08.5060Z   Downloading https://artifactory.tcsbank.ru/artifactory/api/pypi/python-all/packages/packages/beautifulsoup4/4.12.3/beautifulsoup4-4.12.3-py3-none-any.whl (147 kB)
2025-05-07 13:00:08.5133Z      ━━━━━━━━━━━━━━━━━━━━━━━━━━━━━━━━━━━━━━ 147.9/147.9 kB 53.8 MB/s eta 0:00:00
2025-05-07 13:00:08.6482Z Collecting bleach==6.2.0
2025-05-07 13:00:08.7185Z   Downloading https://artifactory.tcsbank.ru/artifactory/api/pypi/python-all/packages/packages/bleach/6.2.0/bleach-6.2.0-py3-none-any.whl (163 kB)
2025-05-07 13:00:08.7411Z      ━━━━━━━━━━━━━━━━━━━━━━━━━━━━━━━━━━━━━━━ 163.4/163.4 kB 8.6 MB/s eta 0:00:00
2025-05-07 13:00:08.8934Z Collecting certifi==2024.12.14
2025-05-07 13:00:08.9273Z   Downloading https://artifactory.tcsbank.ru/artifactory/api/pypi/python-all/packages/packages/certifi/2024.12.14/certifi-2024.12.14-py3-none-any.whl (164 kB)
2025-05-07 13:00:08.9366Z      ━━━━━━━━━━━━━━━━━━━━━━━━━━━━━━━━━━━━━━ 164.9/164.9 kB 32.1 MB/s eta 0:00:00
2025-05-07 13:00:10.0400Z Collecting cffi==1.17.1
2025-05-07 13:00:10.0766Z   Downloading https://artifactory.tcsbank.ru/artifactory/api/pypi/python-all/packages/packages/cffi/1.17.1/cffi-1.17.1-cp39-cp39-manylinux_2_17_x86_64.manylinux2014_x86_64.whl (445 kB)
2025-05-07 13:00:10.0970Z      ━━━━━━━━━━━━━━━━━━━━━━━━━━━━━━━━━━━━━━ 445.2/445.2 kB 27.5 MB/s eta 0:00:00
2025-05-07 13:00:10.9629Z Collecting charset-normalizer==3.4.1
2025-05-07 13:00:10.9982Z   Downloading https://artifactory.tcsbank.ru/artifactory/api/pypi/python-all/packages/packages/charset-normalizer/3.4.1/charset_normalizer-3.4.1-cp39-cp39-manylinux_2_17_x86_64.manylinux2014_x86_64.whl (146 kB)
2025-05-07 13:00:11.0172Z      ━━━━━━━━━━━━━━━━━━━━━━━━━━━━━━━━━━━━━━━ 146.2/146.2 kB 9.6 MB/s eta 0:00:00
2025-05-07 13:00:11.2035Z Collecting colorama==0.4.6
2025-05-07 13:00:11.2443Z   Downloading https://artifactory.tcsbank.ru/artifactory/api/pypi/python-all/packages/packages/colorama/0.4.6/colorama-0.4.6-py2.py3-none-any.whl (25 kB)
2025-05-07 13:00:11.3860Z Collecting colorlog==6.9.0
2025-05-07 13:00:11.4520Z   Downloading https://artifactory.tcsbank.ru/artifactory/api/pypi/python-all/packages/packages/colorlog/6.9.0/colorlog-6.9.0-py3-none-any.whl (11 kB)
2025-05-07 13:00:11.5457Z Collecting comm==0.2.2
2025-05-07 13:00:11.6058Z   Downloading https://artifactory.tcsbank.ru/artifactory/api/pypi/python-all/packages/packages/comm/0.2.2/comm-0.2.2-py3-none-any.whl (7.2 kB)
2025-05-07 13:00:12.3037Z Collecting contourpy==1.3.0
2025-05-07 13:00:12.3672Z   Downloading https://artifactory.tcsbank.ru/artifactory/api/pypi/python-all/packages/packages/contourpy/1.3.0/contourpy-1.3.0-cp39-cp39-manylinux_2_17_x86_64.manylinux2014_x86_64.whl (321 kB)
2025-05-07 13:00:12.4316Z      ━━━━━━━━━━━━━━━━━━━━━━━━━━━━━━━━━━━━━━ 321.9/321.9 kB 12.6 MB/s eta 0:00:00
2025-05-07 13:00:12.4880Z Collecting cycler==0.12.1
2025-05-07 13:00:12.5200Z   Downloading https://artifactory.tcsbank.ru/artifactory/api/pypi/python-all/packages/packages/cycler/0.12.1/cycler-0.12.1-py3-none-any.whl (8.3 kB)
2025-05-07 13:00:13.5053Z Collecting debugpy==1.8.11
2025-05-07 13:00:13.5418Z   Downloading https://artifactory.tcsbank.ru/artifactory/api/pypi/python-all/packages/packages/debugpy/1.8.11/debugpy-1.8.11-cp39-cp39-manylinux_2_5_x86_64.manylinux1_x86_64.manylinux_2_17_x86_64.manylinux2014_x86_64.whl (3.6 MB)
2025-05-07 13:00:13.6320Z      ━━━━━━━━━━━━━━━━━━━━━━━━━━━━━━━━━━━━━━━━ 3.6/3.6 MB 61.3 MB/s eta 0:00:00
2025-05-07 13:00:13.7745Z Collecting decorator==5.1.1
2025-05-07 13:00:13.8324Z   Downloading https://artifactory.tcsbank.ru/artifactory/api/pypi/python-all/packages/packages/decorator/5.1.1/decorator-5.1.1-py3-none-any.whl (9.1 kB)
2025-05-07 13:00:13.9813Z Collecting defusedxml==0.7.1
2025-05-07 13:00:14.0321Z   Downloading https://artifactory.tcsbank.ru/artifactory/api/pypi/python-all/packages/packages/defusedxml/0.7.1/defusedxml-0.7.1-py2.py3-none-any.whl (25 kB)
2025-05-07 13:00:14.1894Z Collecting exceptiongroup==1.2.2
2025-05-07 13:00:14.2322Z   Downloading https://artifactory.tcsbank.ru/artifactory/api/pypi/python-all/packages/packages/exceptiongroup/1.2.2/exceptiongroup-1.2.2-py3-none-any.whl (16 kB)
2025-05-07 13:00:14.3347Z Collecting executing==2.1.0
2025-05-07 13:00:14.4331Z   Downloading https://artifactory.tcsbank.ru/artifactory/api/pypi/python-all/packages/packages/executing/2.1.0/executing-2.1.0-py2.py3-none-any.whl (25 kB)
2025-05-07 13:00:14.5117Z Collecting fastjsonschema==2.21.1
2025-05-07 13:00:14.5753Z   Downloading https://artifactory.tcsbank.ru/artifactory/api/pypi/python-all/packages/packages/fastjsonschema/2.21.1/fastjsonschema-2.21.1-py3-none-any.whl (23 kB)
2025-05-07 13:00:14.7245Z Collecting filelock==3.17.0
2025-05-07 13:00:14.7862Z   Downloading https://artifactory.tcsbank.ru/artifactory/api/pypi/python-all/packages/packages/filelock/3.17.0/filelock-3.17.0-py3-none-any.whl (16 kB)
2025-05-07 13:00:16.0246Z Collecting fonttools==4.55.3
2025-05-07 13:00:16.0867Z   Downloading https://artifactory.tcsbank.ru/artifactory/api/pypi/python-all/packages/packages/fonttools/4.55.3/fonttools-4.55.3-cp39-cp39-manylinux_2_17_x86_64.manylinux2014_x86_64.whl (4.6 MB)
2025-05-07 13:00:16.1700Z      ━━━━━━━━━━━━━━━━━━━━━━━━━━━━━━━━━━━━━━━━ 4.6/4.6 MB 58.4 MB/s eta 0:00:00
2025-05-07 13:00:16.2686Z Collecting fpdf==1.7.2
2025-05-07 13:00:16.3325Z   Downloading https://artifactory.tcsbank.ru/artifactory/api/pypi/python-all/packages/packages/fpdf/1.7.2/fpdf-1.7.2.tar.gz (39 kB)
2025-05-07 13:00:16.3399Z   Preparing metadata (setup.py): started
2025-05-07 13:00:17.0178Z   Preparing metadata (setup.py): finished with status 'done'
2025-05-07 13:00:17.1238Z Collecting fqdn==1.5.1
2025-05-07 13:00:17.1852Z   Downloading https://artifactory.tcsbank.ru/artifactory/api/pypi/python-all/packages/packages/fqdn/1.5.1/fqdn-1.5.1-py3-none-any.whl (9.1 kB)
2025-05-07 13:00:17.3642Z Collecting fsspec==2025.2.0
2025-05-07 13:00:17.4000Z   Downloading https://artifactory.tcsbank.ru/artifactory/api/pypi/python-all/packages/packages/fsspec/2025.2.0/fsspec-2025.2.0-py3-none-any.whl (184 kB)
2025-05-07 13:00:17.4078Z      ━━━━━━━━━━━━━━━━━━━━━━━━━━━━━━━━━━━━━━ 184.5/184.5 kB 59.4 MB/s eta 0:00:00
2025-05-07 13:00:17.4974Z Collecting h11==0.14.0
2025-05-07 13:00:17.5324Z   Downloading https://artifactory.tcsbank.ru/artifactory/api/pypi/python-all/packages/packages/h11/0.14.0/h11-0.14.0-py3-none-any.whl (58 kB)
2025-05-07 13:00:17.5359Z      ━━━━━━━━━━━━━━━━━━━━━━━━━━━━━━━━━━━━━━━━ 58.3/58.3 kB 29.4 MB/s eta 0:00:00
2025-05-07 13:00:17.6976Z Collecting httpcore==1.0.7
2025-05-07 13:00:17.7337Z   Downloading https://artifactory.tcsbank.ru/artifactory/api/pypi/python-all/packages/packages/httpcore/1.0.7/httpcore-1.0.7-py3-none-any.whl (78 kB)
2025-05-07 13:00:17.7394Z      ━━━━━━━━━━━━━━━━━━━━━━━━━━━━━━━━━━━━━━━━ 78.6/78.6 kB 38.9 MB/s eta 0:00:00
2025-05-07 13:00:17.9151Z Collecting httpx==0.28.1
2025-05-07 13:00:17.9756Z   Downloading https://artifactory.tcsbank.ru/artifactory/api/pypi/python-all/packages/packages/httpx/0.28.1/httpx-0.28.1-py3-none-any.whl (73 kB)
2025-05-07 13:00:17.9918Z      ━━━━━━━━━━━━━━━━━━━━━━━━━━━━━━━━━━━━━━━━ 73.5/73.5 kB 5.4 MB/s eta 0:00:00
2025-05-07 13:00:18.1079Z Collecting idna==3.10
2025-05-07 13:00:18.1560Z   Downloading https://artifactory.tcsbank.ru/artifactory/api/pypi/python-all/packages/packages/idna/3.10/idna-3.10-py3-none-any.whl (70 kB)
2025-05-07 13:00:18.1622Z      ━━━━━━━━━━━━━━━━━━━━━━━━━━━━━━━━━━━━━━━━ 70.4/70.4 kB 31.9 MB/s eta 0:00:00
2025-05-07 13:00:18.3600Z Collecting imageio==2.37.0
2025-05-07 13:00:18.3929Z   Downloading https://artifactory.tcsbank.ru/artifactory/api/pypi/python-all/packages/packages/imageio/2.37.0/imageio-2.37.0-py3-none-any.whl (315 kB)
2025-05-07 13:00:18.4079Z      ━━━━━━━━━━━━━━━━━━━━━━━━━━━━━━━━━━━━━━ 315.8/315.8 kB 29.7 MB/s eta 0:00:00
2025-05-07 13:00:18.6120Z Collecting imageio-ffmpeg==0.6.0
2025-05-07 13:00:18.6475Z   Downloading https://artifactory.tcsbank.ru/artifactory/api/pypi/python-all/packages/packages/imageio-ffmpeg/0.6.0/imageio_ffmpeg-0.6.0-py3-none-manylinux2014_x86_64.whl (29.5 MB)
2025-05-07 13:00:18.9841Z      ━━━━━━━━━━━━━━━━━━━━━━━━━━━━━━━━━━━━━━━━ 29.5/29.5 MB 62.0 MB/s eta 0:00:00
2025-05-07 13:00:19.3471Z Collecting importlib_metadata==8.5.0
2025-05-07 13:00:19.4104Z   Downloading https://artifactory.tcsbank.ru/artifactory/api/pypi/python-all/packages/packages/importlib-metadata/8.5.0/importlib_metadata-8.5.0-py3-none-any.whl (26 kB)
2025-05-07 13:00:19.6231Z Collecting importlib_resources==6.5.2
2025-05-07 13:00:19.6553Z   Downloading https://artifactory.tcsbank.ru/artifactory/api/pypi/python-all/packages/packages/importlib-resources/6.5.2/importlib_resources-6.5.2-py3-none-any.whl (37 kB)
2025-05-07 13:00:20.0424Z Collecting ipykernel==6.29.5
2025-05-07 13:00:20.0781Z   Downloading https://artifactory.tcsbank.ru/artifactory/api/pypi/python-all/packages/packages/ipykernel/6.29.5/ipykernel-6.29.5-py3-none-any.whl (117 kB)
2025-05-07 13:00:20.0865Z      ━━━━━━━━━━━━━━━━━━━━━━━━━━━━━━━━━━━━━━ 117.2/117.2 kB 28.4 MB/s eta 0:00:00
2025-05-07 13:00:20.4151Z Collecting ipython==8.18.1
2025-05-07 13:00:20.4538Z   Downloading https://artifactory.tcsbank.ru/artifactory/api/pypi/python-all/packages/packages/ipython/8.18.1/ipython-8.18.1-py3-none-any.whl (808 kB)
2025-05-07 13:00:20.5328Z      ━━━━━━━━━━━━━━━━━━━━━━━━━━━━━━━━━━━━━━ 808.2/808.2 kB 56.8 MB/s eta 0:00:00
2025-05-07 13:00:20.7083Z Collecting ipywidgets==8.1.5
2025-05-07 13:00:20.7738Z   Downloading https://artifactory.tcsbank.ru/artifactory/api/pypi/python-all/packages/packages/ipywidgets/8.1.5/ipywidgets-8.1.5-py3-none-any.whl (139 kB)
2025-05-07 13:00:20.8318Z      ━━━━━━━━━━━━━━━━━━━━━━━━━━━━━━━━━━━━━━ 139.8/139.8 kB 11.1 MB/s eta 0:00:00
2025-05-07 13:00:20.8839Z Collecting isoduration==20.11.0
2025-05-07 13:00:20.9169Z   Downloading https://artifactory.tcsbank.ru/artifactory/api/pypi/python-all/packages/packages/isoduration/20.11.0/isoduration-20.11.0-py3-none-any.whl (11 kB)
2025-05-07 13:00:21.1069Z Collecting jedi==0.19.2
2025-05-07 13:00:21.1451Z   Downloading https://artifactory.tcsbank.ru/artifactory/api/pypi/python-all/packages/packages/jedi/0.19.2/jedi-0.19.2-py2.py3-none-any.whl (1.6 MB)
2025-05-07 13:00:21.2326Z      ━━━━━━━━━━━━━━━━━━━━━━━━━━━━━━━━━━━━━━━━ 1.6/1.6 MB 27.8 MB/s eta 0:00:00
2025-05-07 13:00:21.3824Z Collecting Jinja2==3.1.5
2025-05-07 13:00:21.4421Z   Downloading https://artifactory.tcsbank.ru/artifactory/api/pypi/python-all/packages/packages/jinja2/3.1.5/jinja2-3.1.5-py3-none-any.whl (134 kB)
2025-05-07 13:00:21.4578Z      ━━━━━━━━━━━━━━━━━━━━━━━━━━━━━━━━━━━━━━ 134.6/134.6 kB 11.2 MB/s eta 0:00:00
2025-05-07 13:00:21.6236Z Collecting joblib==1.4.2
2025-05-07 13:00:21.6547Z   Downloading https://artifactory.tcsbank.ru/artifactory/api/pypi/python-all/packages/packages/joblib/1.4.2/joblib-1.4.2-py3-none-any.whl (301 kB)
2025-05-07 13:00:21.6748Z      ━━━━━━━━━━━━━━━━━━━━━━━━━━━━━━━━━━━━━━ 301.8/301.8 kB 19.1 MB/s eta 0:00:00
2025-05-07 13:00:21.8771Z Collecting json5==0.10.0
2025-05-07 13:00:21.9128Z   Downloading https://artifactory.tcsbank.ru/artifactory/api/pypi/python-all/packages/packages/json5/0.10.0/json5-0.10.0-py3-none-any.whl (34 kB)
2025-05-07 13:00:22.0224Z Collecting jsonpointer==3.0.0
2025-05-07 13:00:22.0837Z   Downloading https://artifactory.tcsbank.ru/artifactory/api/pypi/python-all/packages/packages/jsonpointer/3.0.0/jsonpointer-3.0.0-py2.py3-none-any.whl (7.6 kB)
2025-05-07 13:00:22.2844Z Collecting jsonschema==4.23.0
2025-05-07 13:00:22.3160Z   Downloading https://artifactory.tcsbank.ru/artifactory/api/pypi/python-all/packages/packages/jsonschema/4.23.0/jsonschema-4.23.0-py3-none-any.whl (88 kB)
2025-05-07 13:00:22.3236Z      ━━━━━━━━━━━━━━━━━━━━━━━━━━━━━━━━━━━━━━━━ 88.5/88.5 kB 21.4 MB/s eta 0:00:00
2025-05-07 13:00:22.5000Z Collecting jsonschema-specifications==2024.10.1
2025-05-07 13:00:22.5367Z   Downloading https://artifactory.tcsbank.ru/artifactory/api/pypi/python-all/packages/packages/jsonschema-specifications/2024.10.1/jsonschema_specifications-2024.10.1-py3-none-any.whl (18 kB)
2025-05-07 13:00:22.6332Z Collecting jupyter==1.1.1
2025-05-07 13:00:22.6754Z   Downloading https://artifactory.tcsbank.ru/artifactory/api/pypi/python-all/packages/packages/jupyter/1.1.1/jupyter-1.1.1-py2.py3-none-any.whl (2.7 kB)
2025-05-07 13:00:22.7958Z Collecting jupyter-console==6.6.3
2025-05-07 13:00:22.8322Z   Downloading https://artifactory.tcsbank.ru/artifactory/api/pypi/python-all/packages/packages/jupyter-console/6.6.3/jupyter_console-6.6.3-py3-none-any.whl (24 kB)
2025-05-07 13:00:22.9960Z Collecting jupyter-events==0.11.0
2025-05-07 13:00:23.0340Z   Downloading https://artifactory.tcsbank.ru/artifactory/api/pypi/python-all/packages/packages/jupyter-events/0.11.0/jupyter_events-0.11.0-py3-none-any.whl (19 kB)
2025-05-07 13:00:23.1455Z Collecting jupyter-lsp==2.2.5
2025-05-07 13:00:23.2326Z   Downloading https://artifactory.tcsbank.ru/artifactory/api/pypi/python-all/packages/packages/jupyter-lsp/2.2.5/jupyter_lsp-2.2.5-py3-none-any.whl (69 kB)
2025-05-07 13:00:23.2326Z      ━━━━━━━━━━━━━━━━━━━━━━━━━━━━━━━━━━━━━━━━ 69.1/69.1 kB 5.4 MB/s eta 0:00:00
2025-05-07 13:00:23.4383Z Collecting jupyter_client==8.6.3
2025-05-07 13:00:23.4747Z   Downloading https://artifactory.tcsbank.ru/artifactory/api/pypi/python-all/packages/packages/jupyter-client/8.6.3/jupyter_client-8.6.3-py3-none-any.whl (106 kB)
2025-05-07 13:00:23.4931Z      ━━━━━━━━━━━━━━━━━━━━━━━━━━━━━━━━━━━━━━━ 106.1/106.1 kB 7.0 MB/s eta 0:00:00
2025-05-07 13:00:23.7154Z Collecting jupyter_core==5.7.2
2025-05-07 13:00:23.7553Z   Downloading https://artifactory.tcsbank.ru/artifactory/api/pypi/python-all/packages/packages/jupyter-core/5.7.2/jupyter_core-5.7.2-py3-none-any.whl (28 kB)
2025-05-07 13:00:24.0332Z Collecting jupyter_server==2.15.0
2025-05-07 13:00:24.0954Z   Downloading https://artifactory.tcsbank.ru/artifactory/api/pypi/python-all/packages/packages/jupyter-server/2.15.0/jupyter_server-2.15.0-py3-none-any.whl (385 kB)
2025-05-07 13:00:24.1255Z      ━━━━━━━━━━━━━━━━━━━━━━━━━━━━━━━━━━━━━━ 385.8/385.8 kB 14.8 MB/s eta 0:00:00
2025-05-07 13:00:24.2290Z Collecting jupyter_server_terminals==0.5.3
2025-05-07 13:00:24.2620Z   Downloading https://artifactory.tcsbank.ru/artifactory/api/pypi/python-all/packages/packages/jupyter-server-terminals/0.5.3/jupyter_server_terminals-0.5.3-py3-none-any.whl (13 kB)
2025-05-07 13:00:25.0794Z Collecting jupyterlab==4.3.4
2025-05-07 13:00:25.1428Z   Downloading https://artifactory.tcsbank.ru/artifactory/api/pypi/python-all/packages/packages/jupyterlab/4.3.4/jupyterlab-4.3.4-py3-none-any.whl (11.7 MB)
2025-05-07 13:00:25.2989Z      ━━━━━━━━━━━━━━━━━━━━━━━━━━━━━━━━━━━━━━━━ 11.7/11.7 MB 83.5 MB/s eta 0:00:00
2025-05-07 13:00:25.4520Z Collecting jupyterlab_pygments==0.3.0
2025-05-07 13:00:25.4868Z   Downloading https://artifactory.tcsbank.ru/artifactory/api/pypi/python-all/packages/packages/jupyterlab-pygments/0.3.0/jupyterlab_pygments-0.3.0-py3-none-any.whl (15 kB)
2025-05-07 13:00:25.7314Z Collecting jupyterlab_server==2.27.3
2025-05-07 13:00:25.7668Z   Downloading https://artifactory.tcsbank.ru/artifactory/api/pypi/python-all/packages/packages/jupyterlab-server/2.27.3/jupyterlab_server-2.27.3-py3-none-any.whl (59 kB)
2025-05-07 13:00:25.7750Z      ━━━━━━━━━━━━━━━━━━━━━━━━━━━━━━━━━━━━━━━━ 59.7/59.7 kB 12.1 MB/s eta 0:00:00
2025-05-07 13:00:25.9420Z Collecting jupyterlab_widgets==3.0.13
2025-05-07 13:00:26.0030Z   Downloading https://artifactory.tcsbank.ru/artifactory/api/pypi/python-all/packages/packages/jupyterlab-widgets/3.0.13/jupyterlab_widgets-3.0.13-py3-none-any.whl (214 kB)
2025-05-07 13:00:26.0257Z      ━━━━━━━━━━━━━━━━━━━━━━━━━━━━━━━━━━━━━━ 214.4/214.4 kB 11.3 MB/s eta 0:00:00
2025-05-07 13:00:26.5764Z Collecting kiwisolver==1.4.7
2025-05-07 13:00:26.6123Z   Downloading https://artifactory.tcsbank.ru/artifactory/api/pypi/python-all/packages/packages/kiwisolver/1.4.7/kiwisolver-1.4.7-cp39-cp39-manylinux_2_12_x86_64.manylinux2010_x86_64.whl (1.6 MB)
2025-05-07 13:00:26.6348Z      ━━━━━━━━━━━━━━━━━━━━━━━━━━━━━━━━━━━━━━━━ 1.6/1.6 MB 87.6 MB/s eta 0:00:00
2025-05-07 13:00:28.6245Z Collecting lxml==5.3.2
2025-05-07 13:00:28.6608Z   Downloading https://artifactory.tcsbank.ru/artifactory/api/pypi/python-all/packages/packages/lxml/5.3.2/lxml-5.3.2-cp39-cp39-manylinux_2_28_x86_64.whl (5.2 MB)
2025-05-07 13:00:28.7317Z      ━━━━━━━━━━━━━━━━━━━━━━━━━━━━━━━━━━━━━━━━ 5.2/5.2 MB 86.0 MB/s eta 0:00:00
2025-05-07 13:00:28.9357Z Collecting Mako==1.3.8
2025-05-07 13:00:28.9976Z   Downloading https://artifactory.tcsbank.ru/artifactory/api/pypi/python-all/packages/packages/mako/1.3.8/Mako-1.3.8-py3-none-any.whl (78 kB)
2025-05-07 13:00:29.0037Z      ━━━━━━━━━━━━━━━━━━━━━━━━━━━━━━━━━━━━━━━━ 78.6/78.6 kB 35.9 MB/s eta 0:00:00
2025-05-07 13:00:29.5367Z Collecting MarkupSafe==3.0.2
2025-05-07 13:00:29.5707Z   Downloading https://artifactory.tcsbank.ru/artifactory/api/pypi/python-all/packages/packages/markupsafe/3.0.2/MarkupSafe-3.0.2-cp39-cp39-manylinux_2_17_x86_64.manylinux2014_x86_64.whl (20 kB)
2025-05-07 13:00:30.8788Z Collecting matplotlib==3.9.4
2025-05-07 13:00:30.9143Z   Downloading https://artifactory.tcsbank.ru/artifactory/api/pypi/python-all/packages/packages/matplotlib/3.9.4/matplotlib-3.9.4-cp39-cp39-manylinux_2_17_x86_64.manylinux2014_x86_64.whl (8.3 MB)
2025-05-07 13:00:31.0086Z      ━━━━━━━━━━━━━━━━━━━━━━━━━━━━━━━━━━━━━━━━ 8.3/8.3 MB 92.4 MB/s eta 0:00:00
2025-05-07 13:00:31.1471Z Collecting matplotlib-inline==0.1.7
2025-05-07 13:00:31.2317Z   Downloading https://artifactory.tcsbank.ru/artifactory/api/pypi/python-all/packages/packages/matplotlib-inline/0.1.7/matplotlib_inline-0.1.7-py3-none-any.whl (9.9 kB)
2025-05-07 13:00:31.3610Z Collecting mistune==3.1.0
2025-05-07 13:00:31.4341Z   Downloading https://artifactory.tcsbank.ru/artifactory/api/pypi/python-all/packages/packages/mistune/3.1.0/mistune-3.1.0-py3-none-any.whl (53 kB)
2025-05-07 13:00:31.4341Z      ━━━━━━━━━━━━━━━━━━━━━━━━━━━━━━━━━━━━━━━━ 53.7/53.7 kB 25.5 MB/s eta 0:00:00
2025-05-07 13:00:31.5546Z Collecting moviepy==2.1.2
2025-05-07 13:00:31.6333Z   Downloading https://artifactory.tcsbank.ru/artifactory/api/pypi/python-all/packages/packages/moviepy/2.1.2/moviepy-2.1.2-py3-none-any.whl (126 kB)
2025-05-07 13:00:31.6333Z      ━━━━━━━━━━━━━━━━━━━━━━━━━━━━━━━━━━━━━━ 126.7/126.7 kB 27.9 MB/s eta 0:00:00
2025-05-07 13:00:31.7645Z Collecting mpmath==1.3.0
2025-05-07 13:00:31.8340Z   Downloading https://artifactory.tcsbank.ru/artifactory/api/pypi/python-all/packages/packages/mpmath/1.3.0/m