2025-05-13 22:35:01.0732Z [I 2025-05-14 01:35:01,073] Trial 0 finished with value: 19.390940550665743 and parameters: {'n_layers': 2, 'n_units_0': 39, 'n_units_1': 21, 'activation': 'relu', 'learning_rate': 0.027981152018929686, 'batch_size': 32768, 'optimizer': 'LBFGS', 'max_epochs': 148}. Best is trial 0 with value: 19.390940550665743.
2025-05-13 22:36:16.0322Z [I 2025-05-14 01:36:16,032] Trial 1 finished with value: 77.02704412960263 and parameters: {'n_layers': 11, 'n_units_0': 56, 'n_units_1': 69, 'n_units_2': 40, 'n_units_3': 79, 'n_units_4': 17, 'n_units_5': 2, 'n_units_6': 95, 'n_units_7': 89, 'n_units_8': 66, 'n_units_9': 80, 'n_units_10': 57, 'activation': 'logistic', 'learning_rate': 2.27971137219991e-05, 'batch_size': 32768, 'optimizer': 'LBFGS', 'max_epochs': 353}. Best is trial 0 with value: 19.390940550665743.
2025-05-13 22:38:14.0124Z [I 2025-05-14 01:38:14,012] Trial 5 finished with value: 56.961142696962725 and parameters: {'n_layers': 7, 'n_units_0': 82, 'n_units_1': 37, 'n_units_2': 86, 'n_units_3': 58, 'n_units_4': 90, 'n_units_5': 57, 'n_units_6': 72, 'activation': 'tanh', 'learning_rate': 0.007397763913652814, 'batch_size': 32768, 'optimizer': 'LBFGS', 'max_epochs': 141}. Best is trial 0 with value: 19.390940550665743.
2025-05-13 22:42:52.7545Z [I 2025-05-14 01:42:52,754] Trial 2 finished with value: 77.02441019329521 and parameters: {'n_layers': 9, 'n_units_0': 72, 'n_units_1': 35, 'n_units_2': 34, 'n_units_3': 70, 'n_units_4': 15, 'n_units_5': 7, 'n_units_6': 6, 'n_units_7': 72, 'n_units_8': 94, 'activation': 'logistic', 'learning_rate': 0.043722055786897286, 'batch_size': 32768, 'optimizer': 'SGD', 'max_epochs': 89}. Best is trial 0 with value: 19.390940550665743.
2025-05-13 22:53:29.0523Z [I 2025-05-14 01:53:29,052] Trial 4 finished with value: 77.0735463240712 and parameters: {'n_layers': 3, 'n_units_0': 26, 'n_units_1': 65, 'n_units_2': 29, 'activation': 'logistic', 'learning_rate': 0.0009533718461073839, 'batch_size': 32768, 'optimizer': 'SGD', 'max_epochs': 59}. Best is trial 0 with value: 19.390940550665743.
2025-05-13 22:57:10.0994Z [I 2025-05-14 01:57:10,099] Trial 7 finished with value: 54.27076935376907 and parameters: {'n_layers': 8, 'n_units_0': 85, 'n_units_1': 83, 'n_units_2': 91, 'n_units_3': 68, 'n_units_4': 18, 'n_units_5': 86, 'n_units_6': 43, 'n_units_7': 49, 'activation': 'tanh', 'learning_rate': 0.0012012508613555078, 'batch_size': 32768, 'optimizer': 'SGD', 'max_epochs': 457}. Best is trial 0 with value: 19.390940550665743.
2025-05-13 23:06:48.9893Z [I 2025-05-14 02:06:48,989] Trial 12 finished with value: 1000000.0 and parameters: {'n_layers': 10, 'n_units_0': 73, 'n_units_1': 35, 'n_units_2': 17, 'n_units_3': 88, 'n_units_4': 34, 'n_units_5': 54, 'n_units_6': 22, 'n_units_7': 62, 'n_units_8': 34, 'n_units_9': 94, 'activation': 'relu', 'learning_rate': 3.4777688491964215e-05, 'batch_size': 32768, 'optimizer': 'LBFGS', 'max_epochs': 300}. Best is trial 0 with value: 19.390940550665743.
2025-05-13 23:13:46.8819Z [I 2025-05-14 02:13:46,881] Trial 14 finished with value: 315.85619008102407 and parameters: {'n_layers': 1, 'n_units_0': 56, 'activation': 'relu', 'learning_rate': 0.00010476127413906278, 'batch_size': 32768, 'optimizer': 'LBFGS', 'max_epochs': 362}. Best is trial 0 with value: 19.390940550665743.
2025-05-13 23:19:00.3888Z [I 2025-05-14 02:19:00,388] Trial 3 finished with value: 72.16163294667915 and parameters: {'n_layers': 13, 'n_units_0': 93, 'n_units_1': 42, 'n_units_2': 99, 'n_units_3': 91, 'n_units_4': 68, 'n_units_5': 70, 'n_units_6': 10, 'n_units_7': 63, 'n_units_8': 11, 'n_units_9': 18, 'n_units_10': 48, 'n_units_11': 30, 'n_units_12': 21, 'activation': 'tanh', 'learning_rate': 0.005722000409632176, 'batch_size': 32768, 'optimizer': 'Adam', 'max_epochs': 113}. Best is trial 0 with value: 19.390940550665743.
2025-05-13 23:19:57.4106Z [I 2025-05-14 02:19:57,410] Trial 9 finished with value: 36.50801395594962 and parameters: {'n_layers': 6, 'n_units_0': 45, 'n_units_1': 74, 'n_units_2': 74, 'n_units_3': 47, 'n_units_4': 75, 'n_units_5': 96, 'activation': 'tanh', 'learning_rate': 0.009115804504357491, 'batch_size': 32768, 'optimizer': 'RMSprop', 'max_epochs': 194}. Best is trial 0 with value: 19.390940550665743.
2025-05-13 23:51:01.3718Z [I 2025-05-14 02:51:01,371] Trial 6 finished with value: 77.02436264849096 and parameters: {'n_layers': 9, 'n_units_0': 9, 'n_units_1': 75, 'n_units_2': 83, 'n_units_3': 29, 'n_units_4': 8, 'n_units_5': 87, 'n_units_6': 5, 'n_units_7': 80, 'n_units_8': 80, 'activation': 'logistic', 'learning_rate': 0.002274095112435381, 'batch_size': 32768, 'optimizer': 'Adam', 'max_epochs': 365}. Best is trial 0 with value: 19.390940550665743.
2025-05-14 00:28:08.6905Z [I 2025-05-14 03:28:08,690] Trial 16 finished with value: 73.78528684424491 and parameters: {'n_layers': 1, 'n_units_0': 50, 'activation': 'tanh', 'learning_rate': 0.0017892268934408561, 'batch_size': 32768, 'optimizer': 'Adam', 'max_epochs': 126}. Best is trial 0 with value: 19.390940550665743.
2025-05-14 00:40:15.9385Z [I 2025-05-14 03:40:15,938] Trial 18 finished with value: 77.02517090617197 and parameters: {'n_layers': 5, 'n_units_0': 35, 'n_units_1': 1, 'n_units_2': 64, 'n_units_3': 6, 'n_units_4': 100, 'activation': 'relu', 'learning_rate': 0.07048372648927106, 'batch_size': 32768, 'optimizer': 'RMSprop', 'max_epochs': 201}. Best is trial 0 with value: 19.390940550665743.
2025-05-14 00:51:21.4386Z [I 2025-05-14 03:51:21,438] Trial 10 finished with value: 76.19741398786117 and parameters: {'n_layers': 15, 'n_units_0': 15, 'n_units_1': 45, 'n_units_2': 65, 'n_units_3': 90, 'n_units_4': 62, 'n_units_5': 13, 'n_units_6': 36, 'n_units_7': 23, 'n_units_8': 47, 'n_units_9': 45, 'n_units_10': 41, 'n_units_11': 61, 'n_units_12': 46, 'n_units_13': 55, 'n_units_14': 18, 'activation': 'tanh', 'learning_rate': 0.015735454932986937, 'batch_size': 32768, 'optimizer': 'Adam', 'max_epochs': 378}. Best is trial 0 with value: 19.390940550665743.
2025-05-14 01:00:19.2705Z [I 2025-05-14 04:00:19,270] Trial 21 finished with value: 77.02440702364251 and parameters: {'n_layers': 5, 'n_units_0': 39, 'n_units_1': 97, 'n_units_2': 3, 'n_units_3': 36, 'n_units_4': 79, 'activation': 'relu', 'learning_rate': 0.021794008739984338, 'batch_size': 32768, 'optimizer': 'RMSprop', 'max_epochs': 212}. Best is trial 0 with value: 19.390940550665743.
2025-05-14 01:10:30.9768Z [I 2025-05-14 04:10:30,976] Trial 8 finished with value: 74.06167918848958 and parameters: {'n_layers': 13, 'n_units_0': 17, 'n_units_1': 50, 'n_units_2': 46, 'n_units_3': 73, 'n_units_4': 28, 'n_units_5': 3, 'n_units_6': 55, 'n_units_7': 28, 'n_units_8': 80, 'n_units_9': 33, 'n_units_10': 53, 'n_units_11': 14, 'n_units_12': 21, 'activation': 'tanh', 'learning_rate': 0.0004450686456209394, 'batch_size': 32768, 'optimizer': 'RMSprop', 'max_epochs': 287}. Best is trial 0 with value: 19.390940550665743.
2025-05-14 01:16:24.1585Z [I 2025-05-14 04:16:24,158] Trial 17 finished with value: 77.06307658948934 and parameters: {'n_layers': 4, 'n_units_0': 3, 'n_units_1': 1, 'n_units_2': 3, 'n_units_3': 3, 'activation': 'relu', 'learning_rate': 0.0759527414696654, 'batch_size': 32768, 'optimizer': 'Adam', 'max_epochs': 212}. Best is trial 0 with value: 19.390940550665743.
2025-05-14 01:26:03.2495Z [I 2025-05-14 04:26:03,249] Trial 23 finished with value: 77.02441019329521 and parameters: {'n_layers': 4, 'n_units_0': 44, 'n_units_1': 1, 'n_units_2': 62, 'n_units_3': 41, 'activation': 'relu', 'learning_rate': 0.09793335692810577, 'batch_size': 32768, 'optimizer': 'RMSprop', 'max_epochs': 215}. Best is trial 0 with value: 19.390940550665743.
2025-05-14 01:26:54.9684Z [I 2025-05-14 04:26:54,968] Trial 19 finished with value: 78.0194943838157 and parameters: {'n_layers': 5, 'n_units_0': 34, 'n_units_1': 8, 'n_units_2': 63, 'n_units_3': 3, 'n_units_4': 100, 'activation': 'relu', 'learning_rate': 0.06155392286709888, 'batch_size': 32768, 'optimizer': 'RMSprop', 'max_epochs': 203}. Best is trial 0 with value: 19.390940550665743.
2025-05-14 01:43:02.3502Z [I 2025-05-14 04:43:02,349] Trial 26 finished with value: 6.512729797409263 and parameters: {'n_layers': 2, 'n_units_0': 67, 'n_units_1': 23, 'activation': 'tanh', 'learning_rate': 0.006235348802556205, 'batch_size': 32768, 'optimizer': 'LBFGS', 'max_epochs': 170}. Best is trial 26 with value: 6.512729797409263.
2025-05-14 01:45:37.4722Z [I 2025-05-14 04:45:37,472] Trial 20 finished with value: 34.67170424417168 and parameters: {'n_layers': 5, 'n_units_0': 34, 'n_units_1': 100, 'n_units_2': 62, 'n_units_3': 36, 'n_units_4': 67, 'activation': 'relu', 'learning_rate': 0.01851909921538345, 'batch_size': 32768, 'optimizer': 'RMSprop', 'max_epochs': 213}. Best is trial 26 with value: 6.512729797409263.
2025-05-14 01:46:18.8703Z [I 2025-05-14 04:46:18,870] Trial 25 finished with value: 8.91639618745599 and parameters: {'n_layers': 6, 'n_units_0': 65, 'n_units_1': 21, 'n_units_2': 74, 'n_units_3': 23, 'n_units_4': 49, 'n_units_5': 99, 'activation': 'tanh', 'learning_rate': 0.005231762864618245, 'batch_size': 32768, 'optimizer': 'LBFGS', 'max_epochs': 172}. Best is trial 26 with value: 6.512729797409263.
2025-05-14 01:51:10.0572Z [I 2025-05-14 04:51:10,057] Trial 13 finished with value: 77.02591259399333 and parameters: {'n_layers': 8, 'n_units_0': 23, 'n_units_1': 40, 'n_units_2': 77, 'n_units_3': 13, 'n_units_4': 35, 'n_units_5': 39, 'n_units_6': 63, 'n_units_7': 21, 'activation': 'logistic', 'learning_rate': 0.0052087980641886715, 'batch_size': 32768, 'optimizer': 'Adam', 'max_epochs': 362}. Best is trial 26 with value: 6.512729797409263.
2025-05-14 01:54:53.6997Z [I 2025-05-14 04:54:53,699] Trial 28 finished with value: 67.40920180718096 and parameters: {'n_layers': 2, 'n_units_0': 64, 'n_units_1': 21, 'activation': 'relu', 'learning_rate': 0.0193899511119166, 'batch_size': 32768, 'optimizer': 'LBFGS', 'max_epochs': 160}. Best is trial 26 with value: 6.512729797409263.
2025-05-14 01:56:46.6119Z [I 2025-05-14 04:56:46,611] Trial 29 finished with value: 180.60190163727512 and parameters: {'n_layers': 2, 'n_units_0': 66, 'n_units_1': 21, 'activation': 'tanh', 'learning_rate': 0.003782188693718346, 'batch_size': 32768, 'optimizer': 'LBFGS', 'max_epochs': 155}. Best is trial 26 with value: 6.512729797409263.
2025-05-14 01:57:01.1716Z [I 2025-05-14 04:57:01,171] Trial 27 finished with value: 21.399827246993652 and parameters: {'n_layers': 2, 'n_units_0': 66, 'n_units_1': 21, 'activation': 'tanh', 'learning_rate': 0.0002674096094682113, 'batch_size': 32768, 'optimizer': 'LBFGS', 'max_epochs': 167}. Best is trial 26 with value: 6.512729797409263.
2025-05-14 01:59:08.5140Z [I 2025-05-14 04:59:08,513] Trial 31 finished with value: 11.004885195627681 and parameters: {'n_layers': 3, 'n_units_0': 67, 'n_units_1': 22, 'n_units_2': 53, 'activation': 'tanh', 'learning_rate': 0.003446804994590576, 'batch_size': 32768, 'optimizer': 'LBFGS', 'max_epochs': 50}. Best is trial 26 with value: 6.512729797409263.
2025-05-14 02:01:36.5186Z [I 2025-05-14 05:01:36,518] Trial 33 finished with value: 8.494573768488962 and parameters: {'n_layers': 3, 'n_units_0': 98, 'n_units_1': 13, 'n_units_2': 53, 'activation': 'tanh', 'learning_rate': 0.03134259670038179, 'batch_size': 32768, 'optimizer': 'LBFGS', 'max_epochs': 52}. Best is trial 26 with value: 6.512729797409263.
2025-05-14 02:02:36.6895Z [I 2025-05-14 05:02:36,689] Trial 30 finished with value: 1057.6441982065614 and parameters: {'n_layers': 2, 'n_units_0': 62, 'n_units_1': 17, 'activation': 'tanh', 'learning_rate': 0.00042591644232496, 'batch_size': 32768, 'optimizer': 'LBFGS', 'max_epochs': 157}. Best is trial 26 with value: 6.512729797409263.
2025-05-14 02:03:33.0093Z [I 2025-05-14 05:03:33,009] Trial 34 finished with value: 68.2182024428323 and parameters: {'n_layers': 3, 'n_units_0': 77, 'n_units_1': 14, 'n_units_2': 55, 'activation': 'tanh', 'learning_rate': 0.0004764180831905418, 'batch_size': 32768, 'optimizer': 'LBFGS', 'max_epochs': 55}. Best is trial 26 with value: 6.512729797409263.
2025-05-14 02:10:07.3517Z [I 2025-05-14 05:10:07,351] Trial 37 finished with value: 6944.451310218828 and parameters: {'n_layers': 6, 'n_units_0': 98, 'n_units_1': 27, 'n_units_2': 23, 'n_units_3': 22, 'n_units_4': 51, 'n_units_5': 33, 'activation': 'tanh', 'learning_rate': 0.01091264342411135, 'batch_size': 32768, 'optimizer': 'LBFGS', 'max_epochs': 245}. Best is trial 26 with value: 6.512729797409263.
2025-05-14 02:15:04.4200Z [I 2025-05-14 05:15:04,419] Trial 32 finished with value: 68.38704261522244 and parameters: {'n_layers': 3, 'n_units_0': 60, 'n_units_1': 22, 'n_units_2': 52, 'activation': 'tanh', 'learning_rate': 0.0003055438664624472, 'batch_size': 32768, 'optimizer': 'LBFGS', 'max_epochs': 247}. Best is trial 26 with value: 6.512729797409263.
2025-05-14 02:15:14.6004Z [I 2025-05-14 05:15:14,600] Trial 36 finished with value: 102.2421728743208 and parameters: {'n_layers': 6, 'n_units_0': 98, 'n_units_1': 29, 'n_units_2': 52, 'n_units_3': 20, 'n_units_4': 49, 'n_units_5': 27, 'activation': 'tanh', 'learning_rate': 0.012032640347390305, 'batch_size': 32768, 'optimizer': 'LBFGS', 'max_epochs': 254}. Best is trial 26 with value: 6.512729797409263.
2025-05-14 02:15:26.1362Z [I 2025-05-14 05:15:26,136] Trial 15 finished with value: 78.12569999686403 and parameters: {'n_layers': 6, 'n_units_0': 51, 'n_units_1': 54, 'n_units_2': 22, 'n_units_3': 55, 'n_units_4': 59, 'n_units_5': 30, 'activation': 'tanh', 'learning_rate': 1.2529846121754814e-05, 'batch_size': 32768, 'optimizer': 'RMSprop', 'max_epochs': 353}. Best is trial 26 with value: 6.512729797409263.
2025-05-14 02:18:43.4354Z [I 2025-05-14 05:18:43,435] Trial 38 finished with value: 8.945651092118117 and parameters: {'n_layers': 3, 'n_units_0': 87, 'n_units_1': 29, 'n_units_2': 50, 'activation': 'tanh', 'learning_rate': 0.002980927059812389, 'batch_size': 32768, 'optimizer': 'LBFGS', 'max_epochs': 99}. Best is trial 26 with value: 6.512729797409263.
2025-05-14 02:21:09.9153Z [I 2025-05-14 05:21:09,915] Trial 39 finished with value: 7214.0454670039335 and parameters: {'n_layers': 4, 'n_units_0': 87, 'n_units_1': 12, 'n_units_2': 45, 'n_units_3': 56, 'activation': 'tanh', 'learning_rate': 0.002821787804951641, 'batch_size': 32768, 'optimizer': 'LBFGS', 'max_epochs': 88}. Best is trial 26 with value: 6.512729797409263.
2025-05-14 02:21:23.6867Z [I 2025-05-14 05:21:23,686] Trial 41 finished with value: 63.48913961938195 and parameters: {'n_layers': 4, 'n_units_0': 87, 'n_units_1': 11, 'n_units_2': 74, 'n_units_3': 24, 'activation': 'tanh', 'learning_rate': 0.038689589729870216, 'batch_size': 32768, 'optimizer': 'LBFGS', 'max_epochs': 92}. Best is trial 26 with value: 6.512729797409263.
2025-05-14 02:23:47.2206Z [I 2025-05-14 05:23:47,220] Trial 40 finished with value: 9.127949695150988 and parameters: {'n_layers': 4, 'n_units_0': 86, 'n_units_1': 12, 'n_units_2': 74, 'n_units_3': 99, 'activation': 'tanh', 'learning_rate': 0.039232951981219705, 'batch_size': 32768, 'optimizer': 'LBFGS', 'max_epochs': 91}. Best is trial 26 with value: 6.512729797409263.
2025-05-14 02:24:11.9440Z [I 2025-05-14 05:24:11,943] Trial 42 finished with value: 3362850749.5460806 and parameters: {'n_layers': 4, 'n_units_0': 88, 'n_units_1': 12, 'n_units_2': 73, 'n_units_3': 24, 'activation': 'tanh', 'learning_rate': 0.0334504274052947, 'batch_size': 32768, 'optimizer': 'LBFGS', 'max_epochs': 94}. Best is trial 26 with value: 6.512729797409263.
2025-05-14 02:27:35.4908Z [I 2025-05-14 05:27:35,490] Trial 35 finished with value: 7.888750454161125 and parameters: {'n_layers': 7, 'n_units_0': 99, 'n_units_1': 12, 'n_units_2': 48, 'n_units_3': 18, 'n_units_4': 50, 'n_units_5': 28, 'n_units_6': 98, 'activation': 'tanh', 'learning_rate': 0.011346479389615645, 'batch_size': 32768, 'optimizer': 'LBFGS', 'max_epochs': 260}. Best is trial 26 with value: 6.512729797409263.
2025-05-14 02:28:39.6682Z [I 2025-05-14 05:28:39,667] Trial 11 finished with value: 77.51682340083507 and parameters: {'n_layers': 7, 'n_units_0': 62, 'n_units_1': 76, 'n_units_2': 80, 'n_units_3': 69, 'n_units_4': 8, 'n_units_5': 87, 'n_units_6': 28, 'activation': 'logistic', 'learning_rate': 0.0003083856595992235, 'batch_size': 32768, 'optimizer': 'RMSprop', 'max_epochs': 443}. Best is trial 26 with value: 6.512729797409263.
2025-05-14 02:33:26.7523Z [I 2025-05-14 05:33:26,752] Trial 24 finished with value: 21.76767617533435 and parameters: {'n_layers': 6, 'n_units_0': 45, 'n_units_1': 59, 'n_units_2': 65, 'n_units_3': 40, 'n_units_4': 47, 'n_units_5': 100, 'activation': 'relu', 'learning_rate': 0.00781762027572439, 'batch_size': 32768, 'optimizer': 'RMSprop', 'max_epochs': 175}. Best is trial 26 with value: 6.512729797409263.
2025-05-14 02:39:26.8154Z [I 2025-05-14 05:39:26,815] Trial 22 finished with value: 44.93903340786061 and parameters: {'n_layers': 4, 'n_units_0': 24, 'n_units_1': 12, 'n_units_2': 65, 'n_units_3': 40, 'activation': 'relu', 'learning_rate': 0.000355524453993193, 'batch_size': 32768, 'optimizer': 'RMSprop', 'max_epochs': 208}. Best is trial 26 with value: 6.512729797409263.
2025-05-14 02:41:19.6656Z [I 2025-05-14 05:41:19,665] Trial 47 finished with value: 77.02441019329521 and parameters: {'n_layers': 7, 'n_units_0': 79, 'n_units_1': 6, 'n_units_2': 30, 'n_units_3': 15, 'n_units_4': 45, 'n_units_5': 69, 'n_units_6': 100, 'activation': 'logistic', 'learning_rate': 0.0059089430685499485, 'batch_size': 32768, 'optimizer': 'SGD', 'max_epochs': 310}. Best is trial 26 with value: 6.512729797409263.
2025-05-14 02:59:05.9091Z [I 2025-05-14 05:59:05,908] Trial 50 finished with value: 55.23178034924164 and parameters: {'n_layers': 7, 'n_units_0': 95, 'n_units_1': 31, 'n_units_2': 35, 'n_units_3': 15, 'n_units_4': 41, 'n_units_5': 67, 'n_units_6': 99, 'activation': 'tanh', 'learning_rate': 0.001352313647052638, 'batch_size': 32768, 'optimizer': 'SGD', 'max_epochs': 123}. Best is trial 26 with value: 6.512729797409263.
2025-05-14 03:00:04.6707Z [I 2025-05-14 06:00:04,670] Trial 44 finished with value: 27.041352429398525 and parameters: {'n_layers': 1, 'n_units_0': 79, 'activation': 'logistic', 'learning_rate': 0.0363365690806082, 'batch_size': 32768, 'optimizer': 'SGD', 'max_epochs': 106}. Best is trial 26 with value: 6.512729797409263.
2025-05-14 03:02:15.8890Z [I 2025-05-14 06:02:15,888] Trial 52 finished with value: 464.8478077553986 and parameters: {'n_layers': 9, 'n_units_0': 92, 'n_units_1': 28, 'n_units_2': 41, 'n_units_3': 29, 'n_units_4': 27, 'n_units_5': 17, 'n_units_6': 79, 'n_units_7': 4, 'n_units_8': 1, 'activation': 'tanh', 'learning_rate': 0.0007084423582805316, 'batch_size': 32768, 'optimizer': 'LBFGS', 'max_epochs': 75}. Best is trial 26 with value: 6.512729797409263.
2025-05-14 03:07:24.5913Z [I 2025-05-14 06:07:24,591] Trial 53 finished with value: 37733.253239019825 and parameters: {'n_layers': 9, 'n_units_0': 91, 'n_units_1': 27, 'n_units_2': 40, 'n_units_3': 31, 'n_units_4': 27, 'n_units_5': 18, 'n_units_6': 79, 'n_units_7': 2, 'n_units_8': 3, 'activation': 'tanh', 'learning_rate': 0.0007007155795275935, 'batch_size': 32768, 'optimizer': 'LBFGS', 'max_epochs': 73}. Best is trial 26 with value: 6.512729797409263.
2025-05-14 03:10:34.7080Z [I 2025-05-14 06:10:34,707] Trial 54 finished with value: 75.29948992917382 and parameters: {'n_layers': 8, 'n_units_0': 100, 'n_units_1': 18, 'n_units_2': 39, 'n_units_3': 10, 'n_units_4': 56, 'n_units_5': 43, 'n_units_6': 83, 'n_units_7': 96, 'activation': 'tanh', 'learning_rate': 0.005420511680515057, 'batch_size': 32768, 'optimizer': 'LBFGS', 'max_epochs': 133}. Best is trial 26 with value: 6.512729797409263.
2025-05-14 03:11:38.8663Z [I 2025-05-14 06:11:38,866] Trial 43 finished with value: 34.3440467884128 and parameters: {'n_layers': 1, 'n_units_0': 90, 'activation': 'tanh', 'learning_rate': 0.0010664458624100644, 'batch_size': 32768, 'optimizer': 'SGD', 'max_epochs': 96}. Best is trial 26 with value: 6.512729797409263.
2025-05-14 03:16:26.1787Z [I 2025-05-14 06:16:26,178] Trial 56 finished with value: 100.20940477164557 and parameters: {'n_layers': 11, 'n_units_0': 72, 'n_units_1': 34, 'n_units_2': 94, 'n_units_3': 47, 'n_units_4': 79, 'n_units_5': 45, 'n_units_6': 60, 'n_units_7': 46, 'n_units_8': 27, 'n_units_9': 6, 'n_units_10': 4, 'activation': 'tanh', 'learning_rate': 0.0020251676657353345, 'batch_size': 32768, 'optimizer': 'LBFGS', 'max_epochs': 269}. Best is trial 26 with value: 6.512729797409263.
2025-05-14 03:21:24.3036Z [I 2025-05-14 06:21:24,303] Trial 55 finished with value: 295.1053572455099 and parameters: {'n_layers': 8, 'n_units_0': 100, 'n_units_1': 35, 'n_units_2': 96, 'n_units_3': 10, 'n_units_4': 57, 'n_units_5': 45, 'n_units_6': 87, 'n_units_7': 99, 'activation': 'tanh', 'learning_rate': 0.004807319486120602, 'batch_size': 32768, 'optimizer': 'LBFGS', 'max_epochs': 127}. Best is trial 26 with value: 6.512729797409263.
2025-05-14 03:21:41.8562Z [I 2025-05-14 06:21:41,856] Trial 46 finished with value: 48.65824949729105 and parameters: {'n_layers': 1, 'n_units_0': 92, 'activation': 'logistic', 'learning_rate': 0.0010785355151061995, 'batch_size': 32768, 'optimizer': 'SGD', 'max_epochs': 112}. Best is trial 26 with value: 6.512729797409263.
2025-05-14 03:24:09.2322Z [I 2025-05-14 06:24:09,232] Trial 45 finished with value: 53.470156322826476 and parameters: {'n_layers': 1, 'n_units_0': 92, 'activation': 'logistic', 'learning_rate': 0.0008869461709038026, 'batch_size': 32768, 'optimizer': 'SGD', 'max_epochs': 119}. Best is trial 26 with value: 6.512729797409263.
2025-05-14 03:32:11.9418Z [I 2025-05-14 06:32:11,941] Trial 48 finished with value: 18.11979316374431 and parameters: {'n_layers': 1, 'n_units_0': 93, 'activation': 'tanh', 'learning_rate': 0.006498394325854894, 'batch_size': 32768, 'optimizer': 'SGD', 'max_epochs': 131}. Best is trial 26 with value: 6.512729797409263.
