2025-05-13 22:13:14.3523Z [ML Core] Job is waiting until resources in i-grebenkin quota are available...
2025-05-13 22:20:37.9163Z Looking in indexes: https://artifactory.tcsbank.ru/artifactory/api/pypi/python-all/simple
2025-05-13 22:20:38.2486Z Collecting alembic==1.14.0
2025-05-13 22:20:38.3098Z   Downloading https://artifactory.tcsbank.ru/artifactory/api/pypi/python-all/packages/packages/alembic/1.14.0/alembic-1.14.0-py3-none-any.whl (233 kB)
2025-05-13 22:20:38.4103Z      ━━━━━━━━━━━━━━━━━━━━━━━━━━━━━━━━━━━━━━━ 233.5/233.5 kB 9.7 MB/s eta 0:00:00
2025-05-13 22:20:38.6117Z Collecting anyio==4.8.0
2025-05-13 22:20:38.6500Z   Downloading https://artifactory.tcsbank.ru/artifactory/api/pypi/python-all/packages/packages/anyio/4.8.0/anyio-4.8.0-py3-none-any.whl (96 kB)
2025-05-13 22:20:38.6636Z      ━━━━━━━━━━━━━━━━━━━━━━━━━━━━━━━━━━━━━━━━ 96.0/96.0 kB 9.4 MB/s eta 0:00:00
2025-05-13 22:20:38.8395Z Collecting appnope==0.1.4
2025-05-13 22:20:38.9076Z   Downloading https://artifactory.tcsbank.ru/artifactory/api/pypi/python-all/packages/packages/appnope/0.1.4/appnope-0.1.4-py2.py3-none-any.whl (4.3 kB)
2025-05-13 22:20:39.2505Z Collecting argon2-cffi==23.1.0
2025-05-13 22:20:39.3107Z   Downloading https://artifactory.tcsbank.ru/artifactory/api/pypi/python-all/packages/packages/argon2-cffi/23.1.0/argon2_cffi-23.1.0-py3-none-any.whl (15 kB)
2025-05-13 22:20:39.6387Z Collecting argon2-cffi-bindings==21.2.0
2025-05-13 22:20:39.6806Z   Downloading https://artifactory.tcsbank.ru/artifactory/api/pypi/python-all/packages/packages/argon2-cffi-bindings/21.2.0/argon2_cffi_bindings-21.2.0-cp36-abi3-manylinux_2_17_x86_64.manylinux2014_x86_64.whl (86 kB)
2025-05-13 22:20:39.6937Z      ━━━━━━━━━━━━━━━━━━━━━━━━━━━━━━━━━━━━━━━━ 86.2/86.2 kB 8.7 MB/s eta 0:00:00
2025-05-13 22:20:40.1259Z Collecting arrow==1.3.0
2025-05-13 22:20:40.1906Z   Downloading https://artifactory.tcsbank.ru/artifactory/api/pypi/python-all/packages/packages/arrow/1.3.0/arrow-1.3.0-py3-none-any.whl (66 kB)
2025-05-13 22:20:40.1968Z      ━━━━━━━━━━━━━━━━━━━━━━━━━━━━━━━━━━━━━━━━ 66.4/66.4 kB 29.0 MB/s eta 0:00:00
2025-05-13 22:20:40.7418Z Collecting asttokens==3.0.0
2025-05-13 22:20:40.8071Z   Downloading https://artifactory.tcsbank.ru/artifactory/api/pypi/python-all/packages/packages/asttokens/3.0.0/asttokens-3.0.0-py3-none-any.whl (26 kB)
2025-05-13 22:20:41.2250Z Collecting async-lru==2.0.4
2025-05-13 22:20:41.2699Z   Downloading https://artifactory.tcsbank.ru/artifactory/api/pypi/python-all/packages/packages/async-lru/2.0.4/async_lru-2.0.4-py3-none-any.whl (6.1 kB)
2025-05-13 22:20:41.4797Z Collecting attrs==24.3.0
2025-05-13 22:20:41.5446Z   Downloading https://artifactory.tcsbank.ru/artifactory/api/pypi/python-all/packages/packages/attrs/24.3.0/attrs-24.3.0-py3-none-any.whl (63 kB)
2025-05-13 22:20:41.6094Z      ━━━━━━━━━━━━━━━━━━━━━━━━━━━━━━━━━━━━━━━━ 63.4/63.4 kB 27.7 MB/s eta 0:00:00
2025-05-13 22:20:41.6897Z Collecting babel==2.16.0
2025-05-13 22:20:41.7972Z   Downloading https://artifactory.tcsbank.ru/artifactory/api/pypi/python-all/packages/packages/babel/2.16.0/babel-2.16.0-py3-none-any.whl (9.6 MB)
2025-05-13 22:20:41.9411Z      ━━━━━━━━━━━━━━━━━━━━━━━━━━━━━━━━━━━━━━━━ 9.6/9.6 MB 68.9 MB/s eta 0:00:00
2025-05-13 22:20:42.2230Z Collecting bayesian-optimization==2.0.3
2025-05-13 22:20:42.2617Z   Downloading https://artifactory.tcsbank.ru/artifactory/api/pypi/python-all/packages/packages/bayesian-optimization/2.0.3/bayesian_optimization-2.0.3-py3-none-any.whl (31 kB)
2025-05-13 22:20:42.4640Z Collecting beautifulsoup4==4.12.3
2025-05-13 22:20:42.5375Z   Downloading https://artifactory.tcsbank.ru/artifactory/api/pypi/python-all/packages/packages/beautifulsoup4/4.12.3/beautifulsoup4-4.12.3-py3-none-any.whl (147 kB)
2025-05-13 22:20:42.6098Z      ━━━━━━━━━━━━━━━━━━━━━━━━━━━━━━━━━━━━━━ 147.9/147.9 kB 52.2 MB/s eta 0:00:00
2025-05-13 22:20:42.7226Z Collecting bleach==6.2.0
2025-05-13 22:20:42.8106Z   Downloading https://artifactory.tcsbank.ru/artifactory/api/pypi/python-all/packages/packages/bleach/6.2.0/bleach-6.2.0-py3-none-any.whl (163 kB)
2025-05-13 22:20:42.8106Z      ━━━━━━━━━━━━━━━━━━━━━━━━━━━━━━━━━━━━━━ 163.4/163.4 kB 55.1 MB/s eta 0:00:00
2025-05-13 22:20:43.0435Z Collecting certifi==2024.12.14
2025-05-13 22:20:43.0799Z   Downloading https://artifactory.tcsbank.ru/artifactory/api/pypi/python-all/packages/packages/certifi/2024.12.14/certifi-2024.12.14-py3-none-any.whl (164 kB)
2025-05-13 22:20:43.0994Z      ━━━━━━━━━━━━━━━━━━━━━━━━━━━━━━━━━━━━━━ 164.9/164.9 kB 10.4 MB/s eta 0:00:00
2025-05-13 22:20:44.3608Z Collecting cffi==1.17.1
2025-05-13 22:20:44.4259Z   Downloading https://artifactory.tcsbank.ru/artifactory/api/pypi/python-all/packages/packages/cffi/1.17.1/cffi-1.17.1-cp39-cp39-manylinux_2_17_x86_64.manylinux2014_x86_64.whl (445 kB)
2025-05-13 22:20:44.5110Z      ━━━━━━━━━━━━━━━━━━━━━━━━━━━━━━━━━━━━━━ 445.2/445.2 kB 41.6 MB/s eta 0:00:00
2025-05-13 22:20:45.2558Z Collecting charset-normalizer==3.4.1
2025-05-13 22:20:45.3470Z   Downloading https://artifactory.tcsbank.ru/artifactory/api/pypi/python-all/packages/packages/charset-normalizer/3.4.1/charset_normalizer-3.4.1-cp39-cp39-manylinux_2_17_x86_64.manylinux2014_x86_64.whl (146 kB)
2025-05-13 22:20:45.4116Z      ━━━━━━━━━━━━━━━━━━━━━━━━━━━━━━━━━━━━━━━ 146.2/146.2 kB 7.7 MB/s eta 0:00:00
2025-05-13 22:20:45.5809Z Collecting colorama==0.4.6
2025-05-13 22:20:45.6149Z   Downloading https://artifactory.tcsbank.ru/artifactory/api/pypi/python-all/packages/packages/colorama/0.4.6/colorama-0.4.6-py2.py3-none-any.whl (25 kB)
2025-05-13 22:20:45.9658Z Collecting colorlog==6.9.0
2025-05-13 22:20:46.0304Z   Downloading https://artifactory.tcsbank.ru/artifactory/api/pypi/python-all/packages/packages/colorlog/6.9.0/colorlog-6.9.0-py3-none-any.whl (11 kB)
2025-05-13 22:20:46.1335Z Collecting comm==0.2.2
2025-05-13 22:20:46.1927Z   Downloading https://artifactory.tcsbank.ru/artifactory/api/pypi/python-all/packages/packages/comm/0.2.2/comm-0.2.2-py3-none-any.whl (7.2 kB)
2025-05-13 22:20:46.9639Z Collecting contourpy==1.3.0
2025-05-13 22:20:47.0021Z   Downloading https://artifactory.tcsbank.ru/artifactory/api/pypi/python-all/packages/packages/contourpy/1.3.0/contourpy-1.3.0-cp39-cp39-manylinux_2_17_x86_64.manylinux2014_x86_64.whl (321 kB)
2025-05-13 22:20:47.0281Z      ━━━━━━━━━━━━━━━━━━━━━━━━━━━━━━━━━━━━━━ 321.9/321.9 kB 14.7 MB/s eta 0:00:00
2025-05-13 22:20:47.1804Z Collecting cycler==0.12.1
2025-05-13 22:20:47.2413Z   Downloading https://artifactory.tcsbank.ru/artifactory/api/pypi/python-all/packages/packages/cycler/0.12.1/cycler-0.12.1-py3-none-any.whl (8.3 kB)
2025-05-13 22:20:48.3535Z Collecting debugpy==1.8.11
2025-05-13 22:20:48.4196Z   Downloading https://artifactory.tcsbank.ru/artifactory/api/pypi/python-all/packages/packages/debugpy/1.8.11/debugpy-1.8.11-cp39-cp39-manylinux_2_5_x86_64.manylinux1_x86_64.manylinux_2_17_x86_64.manylinux2014_x86_64.whl (3.6 MB)
2025-05-13 22:20:48.5146Z      ━━━━━━━━━━━━━━━━━━━━━━━━━━━━━━━━━━━━━━━━ 3.6/3.6 MB 50.6 MB/s eta 0:00:00
2025-05-13 22:20:48.7165Z Collecting decorator==5.1.1
2025-05-13 22:20:48.7551Z   Downloading https://artifactory.tcsbank.ru/artifactory/api/pypi/python-all/packages/packages/decorator/5.1.1/decorator-5.1.1-py3-none-any.whl (9.1 kB)
2025-05-13 22:20:48.9229Z Collecting defusedxml==0.7.1
2025-05-13 22:20:48.9898Z   Downloading https://artifactory.tcsbank.ru/artifactory/api/pypi/python-all/packages/packages/defusedxml/0.7.1/defusedxml-0.7.1-py2.py3-none-any.whl (25 kB)
2025-05-13 22:20:49.5161Z Collecting exceptiongroup==1.2.2
2025-05-13 22:20:49.5772Z   Downloading https://artifactory.tcsbank.ru/artifactory/api/pypi/python-all/packages/packages/exceptiongroup/1.2.2/exceptiongroup-1.2.2-py3-none-any.whl (16 kB)
2025-05-13 22:20:50.3281Z Collecting executing==2.1.0
2025-05-13 22:20:50.3654Z   Downloading https://artifactory.tcsbank.ru/artifactory/api/pypi/python-all/packages/packages/executing/2.1.0/executing-2.1.0-py2.py3-none-any.whl (25 kB)
2025-05-13 22:20:50.5484Z Collecting fastjsonschema==2.21.1
2025-05-13 22:20:50.6224Z   Downloading https://artifactory.tcsbank.ru/artifactory/api/pypi/python-all/packages/packages/fastjsonschema/2.21.1/fastjsonschema-2.21.1-py3-none-any.whl (23 kB)
2025-05-13 22:20:50.7904Z Collecting filelock==3.17.0
2025-05-13 22:20:50.8558Z   Downloading https://artifactory.tcsbank.ru/artifactory/api/pypi/python-all/packages/packages/filelock/3.17.0/filelock-3.17.0-py3-none-any.whl (16 kB)
2025-05-13 22:20:52.2105Z Collecting fonttools==4.55.3
2025-05-13 22:20:52.2470Z   Downloading https://artifactory.tcsbank.ru/artifactory/api/pypi/python-all/packages/packages/fonttools/4.55.3/fonttools-4.55.3-cp39-cp39-manylinux_2_17_x86_64.manylinux2014_x86_64.whl (4.6 MB)
2025-05-13 22:20:52.3252Z      ━━━━━━━━━━━━━━━━━━━━━━━━━━━━━━━━━━━━━━━━ 4.6/4.6 MB 62.6 MB/s eta 0:00:00
2025-05-13 22:20:52.4944Z Collecting fpdf==1.7.2
2025-05-13 22:20:52.5657Z   Downloading https://artifactory.tcsbank.ru/artifactory/api/pypi/python-all/packages/packages/fpdf/1.7.2/fpdf-1.7.2.tar.gz (39 kB)
2025-05-13 22:20:52.6110Z   Preparing metadata (setup.py): started
2025-05-13 22:20:53.3094Z   Preparing metadata (setup.py): finished with status 'done'
2025-05-13 22:20:53.4114Z Collecting fqdn==1.5.1
2025-05-13 22:20:53.5162Z   Downloading https://artifactory.tcsbank.ru/artifactory/api/pypi/python-all/packages/packages/fqdn/1.5.1/fqdn-1.5.1-py3-none-any.whl (9.1 kB)
2025-05-13 22:20:53.7450Z Collecting fsspec==2025.2.0
2025-05-13 22:20:53.7817Z   Downloading https://artifactory.tcsbank.ru/artifactory/api/pypi/python-all/packages/packages/fsspec/2025.2.0/fsspec-2025.2.0-py3-none-any.whl (184 kB)
2025-05-13 22:20:53.7967Z      ━━━━━━━━━━━━━━━━━━━━━━━━━━━━━━━━━━━━━━ 184.5/184.5 kB 17.8 MB/s eta 0:00:00
2025-05-13 22:20:53.9491Z Collecting h11==0.14.0
2025-05-13 22:20:54.0179Z   Downloading https://artifactory.tcsbank.ru/artifactory/api/pypi/python-all/packages/packages/h11/0.14.0/h11-0.14.0-py3-none-any.whl (58 kB)
2025-05-13 22:20:54.1169Z      ━━━━━━━━━━━━━━━━━━━━━━━━━━━━━━━━━━━━━━━━ 58.3/58.3 kB 26.5 MB/s eta 0:00:00
2025-05-13 22:20:54.1833Z Collecting httpcore==1.0.7
2025-05-13 22:20:54.2436Z   Downloading https://artifactory.tcsbank.ru/artifactory/api/pypi/python-all/packages/packages/httpcore/1.0.7/httpcore-1.0.7-py3-none-any.whl (78 kB)
2025-05-13 22:20:54.3097Z      ━━━━━━━━━━━━━━━━━━━━━━━━━━━━━━━━━━━━━━━━ 78.6/78.6 kB 6.0 MB/s eta 0:00:00
2025-05-13 22:20:54.5247Z Collecting httpx==0.28.1
2025-05-13 22:20:54.5652Z   Downloading https://artifactory.tcsbank.ru/artifactory/api/pypi/python-all/packages/packages/httpx/0.28.1/httpx-0.28.1-py3-none-any.whl (73 kB)
2025-05-13 22:20:54.5781Z      ━━━━━━━━━━━━━━━━━━━━━━━━━━━━━━━━━━━━━━━━ 73.5/73.5 kB 7.1 MB/s eta 0:00:00
2025-05-13 22:20:54.7717Z Collecting idna==3.10
2025-05-13 22:20:54.8421Z   Downloading https://artifactory.tcsbank.ru/artifactory/api/pypi/python-all/packages/packages/idna/3.10/idna-3.10-py3-none-any.whl (70 kB)
2025-05-13 22:20:54.9121Z      ━━━━━━━━━━━━━━━━━━━━━━━━━━━━━━━━━━━━━━━━ 70.4/70.4 kB 25.6 MB/s eta 0:00:00
2025-05-13 22:20:55.0742Z Collecting imageio==2.37.0
2025-05-13 22:20:55.1442Z   Downloading https://artifactory.tcsbank.ru/artifactory/api/pypi/python-all/packages/packages/imageio/2.37.0/imageio-2.37.0-py3-none-any.whl (315 kB)
2025-05-13 22:20:55.1734Z      ━━━━━━━━━━━━━━━━━━━━━━━━━━━━━━━━━━━━━━ 315.8/315.8 kB 12.7 MB/s eta 0:00:00
2025-05-13 22:20:55.4154Z Collecting imageio-ffmpeg==0.6.0
2025-05-13 22:20:55.4527Z   Downloading https://artifactory.tcsbank.ru/artifactory/api/pypi/python-all/packages/packages/imageio-ffmpeg/0.6.0/imageio_ffmpeg-0.6.0-py3-none-manylinux2014_x86_64.whl (29.5 MB)
2025-05-13 22:20:55.8245Z      ━━━━━━━━━━━━━━━━━━━━━━━━━━━━━━━━━━━━━━━━ 29.5/29.5 MB 59.2 MB/s eta 0:00:00
2025-05-13 22:20:56.2549Z Collecting importlib_metadata==8.5.0
2025-05-13 22:20:56.3263Z   Downloading https://artifactory.tcsbank.ru/artifactory/api/pypi/python-all/packages/packages/importlib-metadata/8.5.0/importlib_metadata-8.5.0-py3-none-any.whl (26 kB)
2025-05-13 22:20:56.5968Z Collecting importlib_resources==6.5.2
2025-05-13 22:20:56.6621Z   Downloading https://artifactory.tcsbank.ru/artifactory/api/pypi/python-all/packages/packages/importlib-resources/6.5.2/importlib_resources-6.5.2-py3-none-any.whl (37 kB)
2025-05-13 22:20:56.9919Z Collecting ipykernel==6.29.5
2025-05-13 22:20:57.0300Z   Downloading https://artifactory.tcsbank.ru/artifactory/api/pypi/python-all/packages/packages/ipykernel/6.29.5/ipykernel-6.29.5-py3-none-any.whl (117 kB)
2025-05-13 22:20:57.1110Z      ━━━━━━━━━━━━━━━━━━━━━━━━━━━━━━━━━━━━━━ 117.2/117.2 kB 12.2 MB/s eta 0:00:00
2025-05-13 22:20:57.9563Z Collecting ipython==8.18.1
2025-05-13 22:20:58.0293Z   Downloading https://artifactory.tcsbank.ru/artifactory/api/pypi/python-all/packages/packages/ipython/8.18.1/ipython-8.18.1-py3-none-any.whl (808 kB)
2025-05-13 22:20:58.1089Z      ━━━━━━━━━━━━━━━━━━━━━━━━━━━━━━━━━━━━━━ 808.2/808.2 kB 63.6 MB/s eta 0:00:00
2025-05-13 22:20:58.3050Z Collecting ipywidgets==8.1.5
2025-05-13 22:20:58.3682Z   Downloading https://artifactory.tcsbank.ru/artifactory/api/pypi/python-all/packages/packages/ipywidgets/8.1.5/ipywidgets-8.1.5-py3-none-any.whl (139 kB)
2025-05-13 22:20:58.3906Z      ━━━━━━━━━━━━━━━━━━━━━━━━━━━━━━━━━━━━━━━ 139.8/139.8 kB 7.4 MB/s eta 0:00:00
2025-05-13 22:20:58.7420Z Collecting isoduration==20.11.0
2025-05-13 22:20:58.7839Z   Downloading https://artifactory.tcsbank.ru/artifactory/api/pypi/python-all/packages/packages/isoduration/20.11.0/isoduration-20.11.0-py3-none-any.whl (11 kB)
2025-05-13 22:20:59.3903Z Collecting jedi==0.19.2
2025-05-13 22:20:59.4539Z   Downloading https://artifactory.tcsbank.ru/artifactory/api/pypi/python-all/packages/packages/jedi/0.19.2/jedi-0.19.2-py2.py3-none-any.whl (1.6 MB)
2025-05-13 22:20:59.5094Z      ━━━━━━━━━━━━━━━━━━━━━━━━━━━━━━━━━━━━━━━━ 1.6/1.6 MB 68.2 MB/s eta 0:00:00
2025-05-13 22:20:59.6693Z Collecting Jinja2==3.1.5
2025-05-13 22:20:59.7304Z   Downloading https://artifactory.tcsbank.ru/artifactory/api/pypi/python-all/packages/packages/jinja2/3.1.5/jinja2-3.1.5-py3-none-any.whl (134 kB)
2025-05-13 22:20:59.7519Z      ━━━━━━━━━━━━━━━━━━━━━━━━━━━━━━━━━━━━━━━ 134.6/134.6 kB 7.4 MB/s eta 0:00:00
2025-05-13 22:20:59.9984Z Collecting joblib==1.4.2
2025-05-13 22:21:00.0399Z   Downloading https://artifactory.tcsbank.ru/artifactory/api/pypi/python-all/packages/packages/joblib/1.4.2/joblib-1.4.2-py3-none-any.whl (301 kB)
2025-05-13 22:21:00.1091Z      ━━━━━━━━━━━━━━━━━━━━━━━━━━━━━━━━━━━━━━ 301.8/301.8 kB 14.4 MB/s eta 0:00:00
2025-05-13 22:21:00.5124Z Collecting json5==0.10.0
2025-05-13 22:21:00.6147Z   Downloading https://artifactory.tcsbank.ru/artifactory/api/pypi/python-all/packages/packages/json5/0.10.0/json5-0.10.0-py3-none-any.whl (34 kB)
2025-05-13 22:21:00.7314Z Collecting jsonpointer==3.0.0
2025-05-13 22:21:00.7928Z   Downloading https://artifactory.tcsbank.ru/artifactory/api/pypi/python-all/packages/packages/jsonpointer/3.0.0/jsonpointer-3.0.0-py2.py3-none-any.whl (7.6 kB)
2025-05-13 22:21:01.0824Z Collecting jsonschema==4.23.0
2025-05-13 22:21:01.1189Z   Downloading https://artifactory.tcsbank.ru/artifactory/api/pypi/python-all/packages/packages/jsonschema/4.23.0/jsonschema-4.23.0-py3-none-any.whl (88 kB)
2025-05-13 22:21:01.2126Z      ━━━━━━━━━━━━━━━━━━━━━━━━━━━━━━━━━━━━━━━━ 88.5/88.5 kB 8.5 MB/s eta 0:00:00
2025-05-13 22:21:01.3221Z Collecting jsonschema-specifications==2024.10.1
2025-05-13 22:21:01.4110Z   Downloading https://artifactory.tcsbank.ru/artifactory/api/pypi/python-all/packages/packages/jsonschema-specifications/2024.10.1/jsonschema_specifications-2024.10.1-py3-none-any.whl (18 kB)
2025-05-13 22:21:01.6071Z Collecting jupyter==1.1.1
2025-05-13 22:21:01.6736Z   Downloading https://artifactory.tcsbank.ru/artifactory/api/pypi/python-all/packages/packages/jupyter/1.1.1/jupyter-1.1.1-py2.py3-none-any.whl (2.7 kB)
2025-05-13 22:21:02.0975Z Collecting jupyter-console==6.6.3
2025-05-13 22:21:02.1423Z   Downloading https://artifactory.tcsbank.ru/artifactory/api/pypi/python-all/packages/packages/jupyter-console/6.6.3/jupyter_console-6.6.3-py3-none-any.whl (24 kB)
2025-05-13 22:21:02.5101Z Collecting jupyter-events==0.11.0
2025-05-13 22:21:02.6345Z   Downloading https://artifactory.tcsbank.ru/artifactory/api/pypi/python-all/packages/packages/jupyter-events/0.11.0/jupyter_events-0.11.0-py3-none-any.whl (19 kB)
2025-05-13 22:21:02.9070Z Collecting jupyter-lsp==2.2.5
2025-05-13 22:21:02.9746Z   Downloading https://artifactory.tcsbank.ru/artifactory/api/pypi/python-all/packages/packages/jupyter-lsp/2.2.5/jupyter_lsp-2.2.5-py3-none-any.whl (69 kB)
2025-05-13 22:21:02.9904Z      ━━━━━━━━━━━━━━━━━━━━━━━━━━━━━━━━━━━━━━━━ 69.1/69.1 kB 5.1 MB/s eta 0:00:00
2025-05-13 22:21:03.3184Z Collecting jupyter_client==8.6.3
2025-05-13 22:21:03.3598Z   Downloading https://artifactory.tcsbank.ru/artifactory/api/pypi/python-all/packages/packages/jupyter-client/8.6.3/jupyter_client-8.6.3-py3-none-any.whl (106 kB)
2025-05-13 22:21:03.3784Z      ━━━━━━━━━━━━━━━━━━━━━━━━━━━━━━━━━━━━━━━ 106.1/106.1 kB 7.0 MB/s eta 0:00:00
2025-05-13 22:21:04.0213Z Collecting jupyter_core==5.7.2
2025-05-13 22:21:04.1106Z   Downloading https://artifactory.tcsbank.ru/artifactory/api/pypi/python-all/packages/packages/jupyter-core/5.7.2/jupyter_core-5.7.2-py3-none-any.whl (28 kB)
2025-05-13 22:21:04.5574Z Collecting jupyter_server==2.15.0
2025-05-13 22:21:04.6250Z   Downloading https://artifactory.tcsbank.ru/artifactory/api/pypi/python-all/packages/packages/jupyter-server/2.15.0/jupyter_server-2.15.0-py3-none-any.whl (385 kB)
2025-05-13 22:21:04.7105Z      ━━━━━━━━━━━━━━━━━━━━━━━━━━━━━━━━━━━━━━ 385.8/385.8 kB 15.2 MB/s eta 0:00:00
2025-05-13 22:21:04.9816Z Collecting jupyter_server_terminals==0.5.3
2025-05-13 22:21:05.0250Z   Downloading https://artifactory.tcsbank.ru/artifactory/api/pypi/python-all/packages/packages/jupyter-server-terminals/0.5.3/jupyter_server_terminals-0.5.3-py3-none-any.whl (13 kB)
2025-05-13 22:21:05.8413Z Collecting jupyterlab==4.3.4
2025-05-13 22:21:05.9111Z   Downloading https://artifactory.tcsbank.ru/artifactory/api/pypi/python-all/packages/packages/jupyterlab/4.3.4/jupyterlab-4.3.4-py3-none-any.whl (11.7 MB)
2025-05-13 22:21:06.0527Z      ━━━━━━━━━━━━━━━━━━━━━━━━━━━━━━━━━━━━━━━━ 11.7/11.7 MB 85.3 MB/s eta 0:00:00
2025-05-13 22:21:06.3644Z Collecting jupyterlab_pygments==0.3.0
2025-05-13 22:21:06.4293Z   Downloading https://artifactory.tcsbank.ru/artifactory/api/pypi/python-all/packages/packages/jupyterlab-pygments/0.3.0/jupyterlab_pygments-0.3.0-py3-none-any.whl (15 kB)
2025-05-13 22:21:06.7436Z Collecting jupyterlab_server==2.27.3
2025-05-13 22:21:06.7812Z   Downloading https://artifactory.tcsbank.ru/artifactory/api/pypi/python-all/packages/packages/jupyterlab-server/2.27.3/jupyterlab_server-2.27.3-py3-none-any.whl (59 kB)
2025-05-13 22:21:06.7944Z      ━━━━━━━━━━━━━━━━━━━━━━━━━━━━━━━━━━━━━━━━ 59.7/59.7 kB 5.5 MB/s eta 0:00:00
2025-05-13 22:21:07.1647Z Collecting jupyterlab_widgets==3.0.13
2025-05-13 22:21:07.2279Z   Downloading https://artifactory.tcsbank.ru/artifactory/api/pypi/python-all/packages/packages/jupyterlab-widgets/3.0.13/jupyterlab_widgets-3.0.13-py3-none-any.whl (214 kB)
2025-05-13 22:21:07.3203Z      ━━━━━━━━━━━━━━━━━━━━━━━━━━━━━━━━━━━━━━ 214.4/214.4 kB 63.5 MB/s eta 0:00:00
2025-05-13 22:21:07.8063Z Collecting kiwisolver==1.4.7
2025-05-13 22:21:07.8683Z   Downloading https://artifactory.tcsbank.ru/artifactory/api/pypi/python-all/packages/packages/kiwisolver/1.4.7/kiwisolver-1.4.7-cp39-cp39-manylinux_2_12_x86_64.manylinux2010_x86_64.whl (1.6 MB)
2025-05-13 22:21:07.9165Z      ━━━━━━━━━━━━━━━━━━━━━━━━━━━━━━━━━━━━━━━━ 1.6/1.6 MB 36.4 MB/s eta 0:00:00
2025-05-13 22:21:09.9649Z Collecting lxml==5.3.2
2025-05-13 22:21:10.0066Z   Downloading https://artifactory.tcsbank.ru/artifactory/api/pypi/python-all/packages/packages/lxml/5.3.2/lxml-5.3.2-cp39-cp39-manylinux_2_28_x86_64.whl (5.2 MB)
2025-05-13 22:21:10.1110Z      ━━━━━━━━━━━━━━━━━━━━━━━━━━━━━━━━━━━━━━━━ 5.2/5.2 MB 68.6 MB/s eta 0:00:00
2025-05-13 22:21:10.3026Z Collecting Mako==1.3.8
2025-05-13 22:21:10.3656Z   Downloading https://artifactory.tcsbank.ru/artifactory/api/pypi/python-all/packages/packages/mako/1.3.8/Mako-1.3.8-py3-none-any.whl (78 kB)
2025-05-13 22:21:10.3725Z      ━━━━━━━━━━━━━━━━━━━━━━━━━━━━━━━━━━━━━━━━ 78.6/78.6 kB 26.1 MB/s eta 0:00:00
2025-05-13 22:21:11.4156Z Collecting MarkupSafe==3.0.2
2025-05-13 22:21:11.4795Z   Downloading https://artifactory.tcsbank.ru/artifactory/api/pypi/python-all/packages/packages/markupsafe/3.0.2/MarkupSafe-3.0.2-cp39-cp39-manylinux_2_17_x86_64.manylinux2014_x86_64.whl (20 kB)
2025-05-13 22:21:12.9090Z Collecting matplotlib==3.9.4
2025-05-13 22:21:12.9550Z   Downloading https://artifactory.tcsbank.ru/artifactory/api/pypi/python-all/packages/packages/matplotlib/3.9.4/matplotlib-3.9.4-cp39-cp39-manylinux_2_17_x86_64.manylinux2014_x86_64.whl (8.3 MB)
2025-05-13 22:21:13.0755Z      ━━━━━━━━━━━━━━━━━━━━━━━━━━━━━━━━━━━━━━━━ 8.3/8.3 MB 71.7 MB/s eta 0:00:00
2025-05-13 22:21:13.7107Z Collecting matplotlib-inline==0.1.7
2025-05-13 22:21:13.7769Z   Downloading https://artifactory.tcsbank.ru/artifactory/api/pypi/python-all/packages/packages/matplotlib-inline/0.1.7/matplotlib_inline-0.1.7-py3-none-any.whl (9.9 kB)
2025-05-13 22:21:14.0348Z Collecting mistune==3.1.0
2025-05-13 22:21:14.0958Z   Downloading https://artifactory.tcsbank.ru/artifactory/api/pypi/python-all/packages/packages/mistune/3.1.0/mistune-3.1.0-py3-none-any.whl (53 kB)
2025-05-13 22:21:14.1109Z      ━━━━━━━━━━━━━━━━━━━━━━━━━━━━━━━━━━━━━━━━ 53.7/53.7 kB 4.1 MB/s eta 0:00:00
2025-05-13 22:21:14.3127Z Collecting moviepy==2.1.2
2025-05-13 22:21:14.4108Z   Downloading https://artifactory.tcsbank.ru/artifactory/api/pypi/python-all/packages/packages/moviepy/2.1.2/moviepy-2.1.2-py3-none-any.whl (126 kB)
2025-05-13 22:21:14.4108Z      ━━━━━━━━━━━━━━━━━━━━━━━━━━━━━━━━━━━━━━ 126.7/126.7 kB 26.1 MB/s eta 0:00:00
2025-05-13 22:21:14.5281Z Collecting mpmath==1.3.0
2025-05-13 22:21:14.6285Z   Downloa