2025-05-07 12:59:14.4547Z Looking in indexes: https://artifactory.tcsbank.ru/artifactory/api/pypi/python-all/simple
2025-05-07 12:59:14.8374Z Collecting alembic==1.14.0
2025-05-07 12:59:14.8743Z   Downloading https://artifactory.tcsbank.ru/artifactory/api/pypi/python-all/packages/packages/alembic/1.14.0/alembic-1.14.0-py3-none-any.whl (233 kB)
2025-05-07 12:59:14.8959Z      ━━━━━━━━━━━━━━━━━━━━━━━━━━━━━━━━━━━━━━ 233.5/233.5 kB 14.0 MB/s eta 0:00:00
2025-05-07 12:59:15.1269Z Collecting anyio==4.8.0
2025-05-07 12:59:15.1672Z   Downloading https://artifactory.tcsbank.ru/artifactory/api/pypi/python-all/packages/packages/anyio/4.8.0/anyio-4.8.0-py3-none-any.whl (96 kB)
2025-05-07 12:59:15.1734Z      ━━━━━━━━━━━━━━━━━━━━━━━━━━━━━━━━━━━━━━━━ 96.0/96.0 kB 41.2 MB/s eta 0:00:00
2025-05-07 12:59:15.9249Z Collecting appnope==0.1.4
2025-05-07 12:59:15.9661Z   Downloading https://artifactory.tcsbank.ru/artifactory/api/pypi/python-all/packages/packages/appnope/0.1.4/appnope-0.1.4-py2.py3-none-any.whl (4.3 kB)
2025-05-07 12:59:16.2301Z Collecting argon2-cffi==23.1.0
2025-05-07 12:59:16.3000Z   Downloading https://artifactory.tcsbank.ru/artifactory/api/pypi/python-all/packages/packages/argon2-cffi/23.1.0/argon2_cffi-23.1.0-py3-none-any.whl (15 kB)
2025-05-07 12:59:16.4309Z Collecting argon2-cffi-bindings==21.2.0
2025-05-07 12:59:16.4690Z   Downloading https://artifactory.tcsbank.ru/artifactory/api/pypi/python-all/packages/packages/argon2-cffi-bindings/21.2.0/argon2_cffi_bindings-21.2.0-cp36-abi3-manylinux_2_17_x86_64.manylinux2014_x86_64.whl (86 kB)
2025-05-07 12:59:16.4791Z      ━━━━━━━━━━━━━━━━━━━━━━━━━━━━━━━━━━━━━━━━ 86.2/86.2 kB 12.7 MB/s eta 0:00:00
2025-05-07 12:59:17.0909Z Collecting arrow==1.3.0
2025-05-07 12:59:17.1316Z   Downloading https://artifactory.tcsbank.ru/artifactory/api/pypi/python-all/packages/packages/arrow/1.3.0/arrow-1.3.0-py3-none-any.whl (66 kB)
2025-05-07 12:59:17.2141Z      ━━━━━━━━━━━━━━━━━━━━━━━━━━━━━━━━━━━━━━━━ 66.4/66.4 kB 9.0 MB/s eta 0:00:00
2025-05-07 12:59:17.2537Z Collecting asttokens==3.0.0
2025-05-07 12:59:17.2870Z   Downloading https://artifactory.tcsbank.ru/artifactory/api/pypi/python-all/packages/packages/asttokens/3.0.0/asttokens-3.0.0-py3-none-any.whl (26 kB)
2025-05-07 12:59:17.4379Z Collecting async-lru==2.0.4
2025-05-07 12:59:17.5025Z   Downloading https://artifactory.tcsbank.ru/artifactory/api/pypi/python-all/packages/packages/async-lru/2.0.4/async_lru-2.0.4-py3-none-any.whl (6.1 kB)
2025-05-07 12:59:17.6342Z Collecting attrs==24.3.0
2025-05-07 12:59:17.6698Z   Downloading https://artifactory.tcsbank.ru/artifactory/api/pypi/python-all/packages/packages/attrs/24.3.0/attrs-24.3.0-py3-none-any.whl (63 kB)
2025-05-07 12:59:17.6757Z      ━━━━━━━━━━━━━━━━━━━━━━━━━━━━━━━━━━━━━━━━ 63.4/63.4 kB 29.9 MB/s eta 0:00:00
2025-05-07 12:59:17.8605Z Collecting babel==2.16.0
2025-05-07 12:59:17.8958Z   Downloading https://artifactory.tcsbank.ru/artifactory/api/pypi/python-all/packages/packages/babel/2.16.0/babel-2.16.0-py3-none-any.whl (9.6 MB)
2025-05-07 12:59:18.0190Z      ━━━━━━━━━━━━━━━━━━━━━━━━━━━━━━━━━━━━━━━━ 9.6/9.6 MB 80.6 MB/s eta 0:00:00
2025-05-07 12:59:18.6058Z Collecting bayesian-optimization==2.0.3
2025-05-07 12:59:18.6541Z   Downloading https://artifactory.tcsbank.ru/artifactory/api/pypi/python-all/packages/packages/bayesian-optimization/2.0.3/bayesian_optimization-2.0.3-py3-none-any.whl (31 kB)
2025-05-07 12:59:18.9098Z Collecting beautifulsoup4==4.12.3
2025-05-07 12:59:18.9465Z   Downloading https://artifactory.tcsbank.ru/artifactory/api/pypi/python-all/packages/packages/beautifulsoup4/4.12.3/beautifulsoup4-4.12.3-py3-none-any.whl (147 kB)
2025-05-07 12:59:18.9573Z      ━━━━━━━━━━━━━━━━━━━━━━━━━━━━━━━━━━━━━━ 147.9/147.9 kB 22.0 MB/s eta 0:00:00
2025-05-07 12:59:19.1142Z Collecting bleach==6.2.0
2025-05-07 12:59:19.1521Z   Downloading https://artifactory.tcsbank.ru/artifactory/api/pypi/python-all/packages/packages/bleach/6.2.0/bleach-6.2.0-py3-none-any.whl (163 kB)
2025-05-07 12:59:19.1595Z      ━━━━━━━━━━━━━━━━━━━━━━━━━━━━━━━━━━━━━━ 163.4/163.4 kB 55.9 MB/s eta 0:00:00
2025-05-07 12:59:19.3051Z Collecting certifi==2024.12.14
2025-05-07 12:59:19.3409Z   Downloading https://artifactory.tcsbank.ru/artifactory/api/pypi/python-all/packages/packages/certifi/2024.12.14/certifi-2024.12.14-py3-none-any.whl (164 kB)
2025-05-07 12:59:19.3481Z      ━━━━━━━━━━━━━━━━━━━━━━━━━━━━━━━━━━━━━━ 164.9/164.9 kB 58.9 MB/s eta 0:00:00
2025-05-07 12:59:20.3814Z Collecting cffi==1.17.1
2025-05-07 12:59:20.4430Z   Downloading https://artifactory.tcsbank.ru/artifactory/api/pypi/python-all/packages/packages/cffi/1.17.1/cffi-1.17.1-cp39-cp39-manylinux_2_17_x86_64.manylinux2014_x86_64.whl (445 kB)
2025-05-07 12:59:20.5130Z      ━━━━━━━━━━━━━━━━━━━━━━━━━━━━━━━━━━━━━━ 445.2/445.2 kB 23.5 MB/s eta 0:00:00
2025-05-07 12:59:21.2805Z Collecting charset-normalizer==3.4.1
2025-05-07 12:59:21.3301Z   Downloading https://artifactory.tcsbank.ru/artifactory/api/pypi/python-all/packages/packages/charset-normalizer/3.4.1/charset_normalizer-3.4.1-cp39-cp39-manylinux_2_17_x86_64.manylinux2014_x86_64.whl (146 kB)
2025-05-07 12:59:21.4323Z      ━━━━━━━━━━━━━━━━━━━━━━━━━━━━━━━━━━━━━━ 146.2/146.2 kB 10.3 MB/s eta 0:00:00
2025-05-07 12:59:21.5380Z Collecting colorama==0.4.6
2025-05-07 12:59:21.6142Z   Downloading https://artifactory.tcsbank.ru/artifactory/api/pypi/python-all/packages/packages/colorama/0.4.6/colorama-0.4.6-py2.py3-none-any.whl (25 kB)
2025-05-07 12:59:21.7174Z Collecting colorlog==6.9.0
2025-05-07 12:59:21.8169Z   Downloading https://artifactory.tcsbank.ru/artifactory/api/pypi/python-all/packages/packages/colorlog/6.9.0/colorlog-6.9.0-py3-none-any.whl (11 kB)
2025-05-07 12:59:22.2236Z Collecting comm==0.2.2
2025-05-07 12:59:22.2580Z   Downloading https://artifactory.tcsbank.ru/artifactory/api/pypi/python-all/packages/packages/comm/0.2.2/comm-0.2.2-py3-none-any.whl (7.2 kB)
2025-05-07 12:59:22.9468Z Collecting contourpy==1.3.0
2025-05-07 12:59:22.9839Z   Downloading https://artifactory.tcsbank.ru/artifactory/api/pypi/python-all/packages/packages/contourpy/1.3.0/contourpy-1.3.0-cp39-cp39-manylinux_2_17_x86_64.manylinux2014_x86_64.whl (321 kB)
2025-05-07 12:59:23.0089Z      ━━━━━━━━━━━━━━━━━━━━━━━━━━━━━━━━━━━━━━ 321.9/321.9 kB 15.4 MB/s eta 0:00:00
2025-05-07 12:59:23.1131Z Collecting cycler==0.12.1
2025-05-07 12:59:23.1530Z   Downloading https://artifactory.tcsbank.ru/artifactory/api/pypi/python-all/packages/packages/cycler/0.12.1/cycler-0.12.1-py3-none-any.whl (8.3 kB)
2025-05-07 12:59:24.6701Z Collecting debugpy==1.8.11
2025-05-07 12:59:24.7246Z   Downloading https://artifactory.tcsbank.ru/artifactory/api/pypi/python-all/packages/packages/debugpy/1.8.11/debugpy-1.8.11-cp39-cp39-manylinux_2_5_x86_64.manylinux1_x86_64.manylinux_2_17_x86_64.manylinux2014_x86_64.whl (3.6 MB)
2025-05-07 12:59:24.8118Z      ━━━━━━━━━━━━━━━━━━━━━━━━━━━━━━━━━━━━━━━━ 3.6/3.6 MB 54.6 MB/s eta 0:00:00
2025-05-07 12:59:24.9234Z Collecting decorator==5.1.1
2025-05-07 12:59:25.0114Z   Downloading https://artifactory.tcsbank.ru/artifactory/api/pypi/python-all/packages/packages/decorator/5.1.1/decorator-5.1.1-py3-none-any.whl (9.1 kB)
2025-05-07 12:59:25.1016Z Collecting defusedxml==0.7.1
2025-05-07 12:59:25.1598Z   Downloading https://artifactory.tcsbank.ru/artifactory/api/pypi/python-all/packages/packages/defusedxml/0.7.1/defusedxml-0.7.1-py2.py3-none-any.whl (25 kB)
2025-05-07 12:59:25.2659Z Collecting exceptiongroup==1.2.2
2025-05-07 12:59:25.3002Z   Downloading https://artifactory.tcsbank.ru/artifactory/api/pypi/python-all/packages/packages/exceptiongroup/1.2.2/exceptiongroup-1.2.2-py3-none-any.whl (16 kB)
2025-05-07 12:59:25.4084Z Collecting executing==2.1.0
2025-05-07 12:59:25.4675Z   Downloading https://artifactory.tcsbank.ru/artifactory/api/pypi/python-all/packages/packages/executing/2.1.0/executing-2.1.0-py2.py3-none-any.whl (25 kB)
2025-05-07 12:59:25.5756Z Collecting fastjsonschema==2.21.1
2025-05-07 12:59:25.6327Z   Downloading https://artifactory.tcsbank.ru/artifactory/api/pypi/python-all/packages/packages/fastjsonschema/2.21.1/fastjsonschema-2.21.1-py3-none-any.whl (23 kB)
2025-05-07 12:59:25.7923Z Collecting filelock==3.17.0
2025-05-07 12:59:25.8598Z   Downloading https://artifactory.tcsbank.ru/artifactory/api/pypi/python-all/packages/packages/filelock/3.17.0/filelock-3.17.0-py3-none-any.whl (16 kB)
2025-05-07 12:59:27.0655Z Collecting fonttools==4.55.3
2025-05-07 12:59:27.1374Z   Downloading https://artifactory.tcsbank.ru/artifactory/api/pypi/python-all/packages/packages/fonttools/4.55.3/fonttools-4.55.3-cp39-cp39-manylinux_2_17_x86_64.manylinux2014_x86_64.whl (4.6 MB)
2025-05-07 12:59:27.2170Z      ━━━━━━━━━━━━━━━━━━━━━━━━━━━━━━━━━━━━━━━━ 4.6/4.6 MB 73.3 MB/s eta 0:00:00
2025-05-07 12:59:27.3232Z Collecting fpdf==1.7.2
2025-05-07 12:59:27.4142Z   Downloading https://artifactory.tcsbank.ru/artifactory/api/pypi/python-all/packages/packages/fpdf/1.7.2/fpdf-1.7.2.tar.gz (39 kB)
2025-05-07 12:59:27.4142Z   Preparing metadata (setup.py): started
2025-05-07 12:59:28.0450Z   Preparing metadata (setup.py): finished with status 'done'
2025-05-07 12:59:28.1482Z Collecting fqdn==1.5.1
2025-05-07 12:59:28.2233Z   Downloading https://artifactory.tcsbank.ru/artifactory/api/pypi/python-all/packages/packages/fqdn/1.5.1/fqdn-1.5.1-py3-none-any.whl (9.1 kB)
2025-05-07 12:59:28.4181Z Collecting fsspec==2025.2.0
2025-05-07 12:59:28.4627Z   Downloading https://artifactory.tcsbank.ru/artifactory/api/pypi/python-all/packages/packages/fsspec/2025.2.0/fsspec-2025.2.0-py3-none-any.whl (184 kB)
2025-05-07 12:59:28.4726Z      ━━━━━━━━━━━━━━━━━━━━━━━━━━━━━━━━━━━━━━ 184.5/184.5 kB 36.2 MB/s eta 0:00:00
2025-05-07 12:59:28.5730Z Collecting h11==0.14.0
2025-05-07 12:59:28.6307Z   Downloading https://artifactory.tcsbank.ru/artifactory/api/pypi/python-all/packages/packages/h11/0.14.0/h11-0.14.0-py3-none-any.whl (58 kB)
2025-05-07 12:59:28.6364Z      ━━━━━━━━━━━━━━━━━━━━━━━━━━━━━━━━━━━━━━━━ 58.3/58.3 kB 28.2 MB/s eta 0:00:00
2025-05-07 12:59:28.7964Z Collecting httpcore==1.0.7
2025-05-07 12:59:28.8318Z   Downloading https://artifactory.tcsbank.ru/artifactory/api/pypi/python-all/packages/packages/httpcore/1.0.7/httpcore-1.0.7-py3-none-any.whl (78 kB)
2025-05-07 12:59:28.8376Z      ━━━━━━━━━━━━━━━━━━━━━━━━━━━━━━━━━━━━━━━━ 78.6/78.6 kB 38.1 MB/s eta 0:00:00
2025-05-07 12:59:29.0924Z Collecting httpx==0.28.1
2025-05-07 12:59:29.1304Z   Downloading https://artifactory.tcsbank.ru/artifactory/api/pypi/python-all/packages/packages/httpx/0.28.1/httpx-0.28.1-py3-none-any.whl (73 kB)
2025-05-07 12:59:29.2167Z      ━━━━━━━━━━━━━━━━━━━━━━━━━━━━━━━━━━━━━━━━ 73.5/73.5 kB 34.2 MB/s eta 0:00:00
2025-05-07 12:59:29.3070Z Collecting idna==3.10
2025-05-07 12:59:29.3425Z   Downloading https://artifactory.tcsbank.ru/artifactory/api/pypi/python-all/packages/packages/idna/3.10/idna-3.10-py3-none-any.whl (70 kB)
2025-05-07 12:59:29.4138Z      ━━━━━━━━━━━━━━━━━━━━━━━━━━━━━━━━━━━━━━━━ 70.4/70.4 kB 35.1 MB/s eta 0:00:00
2025-05-07 12:59:29.7061Z Collecting imageio==2.37.0
2025-05-07 12:59:29.7449Z   Downloading https://artifactory.tcsbank.ru/artifactory/api/pypi/python-all/packages/packages/imageio/2.37.0/imageio-2.37.0-py3-none-any.whl (315 kB)
2025-05-07 12:59:29.8109Z      ━━━━━━━━━━━━━━━━━━━━━━━━━━━━━━━━━━━━━━ 315.8/315.8 kB 33.7 MB/s eta 0:00:00
2025-05-07 12:59:30.3554Z Collecting imageio-ffmpeg==0.6.0
2025-05-07 12:59:30.3973Z   Downloading https://artifactory.tcsbank.ru/artifactory/api/pypi/python-all/packages/packages/imageio-ffmpeg/0.6.0/imageio_ffmpeg-0.6.0-py3-none-manylinux2014_x86_64.whl (29.5 MB)
2025-05-07 12:59:30.7490Z      ━━━━━━━━━━━━━━━━━━━━━━━━━━━━━━━━━━━━━━━━ 29.5/29.5 MB 60.0 MB/s eta 0:00:00
2025-05-07 12:59:31.1628Z Collecting importlib_metadata==8.5.0
2025-05-07 12:59:31.1982Z   Downloading https://artifactory.tcsbank.ru/artifactory/api/pypi/python-all/packages/packages/importlib-metadata/8.5.0/importlib_metadata-8.5.0-py3-none-any.whl (26 kB)
2025-05-07 12:59:31.4031Z Collecting importlib_resources==6.5.2
2025-05-07 12:59:31.4449Z   Downloading https://artifactory.tcsbank.ru/artifactory/api/pypi/python-all/packages/packages/importlib-resources/6.5.2/importlib_resources-6.5.2-py3-none-any.whl (37 kB)
2025-05-07 12:59:32.2571Z Collecting ipykernel==6.29.5
2025-05-07 12:59:32.2934Z   Downloading https://artifactory.tcsbank.ru/artifactory/api/pypi/python-all/packages/packages/ipykernel/6.29.5/ipykernel-6.29.5-py3-none-any.whl (117 kB)
2025-05-07 12:59:32.3073Z      ━━━━━━━━━━━━━━━━━━━━━━━━━━━━━━━━━━━━━━ 117.2/117.2 kB 11.5 MB/s eta 0:00:00
2025-05-07 12:59:32.6297Z Collecting ipython==8.18.1
2025-05-07 12:59:32.6971Z   Downloading https://artifactory.tcsbank.ru/artifactory/api/pypi/python-all/packages/packages/ipython/8.18.1/ipython-8.18.1-py3-none-any.whl (808 kB)
2025-05-07 12:59:32.7267Z      ━━━━━━━━━━━━━━━━━━━━━━━━━━━━━━━━━━━━━━ 808.2/808.2 kB 32.1 MB/s eta 0:00:00
2025-05-07 12:59:32.9667Z Collecting ipywidgets==8.1.5
2025-05-07 12:59:33.0180Z   Downloading https://artifactory.tcsbank.ru/artifactory/api/pypi/python-all/packages/packages/ipywidgets/8.1.5/ipywidgets-8.1.5-py3-none-any.whl (139 kB)
2025-05-07 12:59:33.0307Z      ━━━━━━━━━━━━━━━━━━━━━━━━━━━━━━━━━━━━━━ 139.8/139.8 kB 14.7 MB/s eta 0:00:00
2025-05-07 12:59:33.1929Z Collecting isoduration==20.11.0
2025-05-07 12:59:33.2312Z   Downloading https://artifactory.tcsbank.ru/artifactory/api/pypi/python-all/packages/packages/isoduration/20.11.0/isoduration-20.11.0-py3-none-any.whl (11 kB)
2025-05-07 12:59:33.3547Z Collecting jedi==0.19.2
2025-05-07 12:59:33.4184Z   Downloading https://artifactory.tcsbank.ru/artifactory/api/pypi/python-all/packages/packages/jedi/0.19.2/jedi-0.19.2-py2.py3-none-any.whl (1.6 MB)
2025-05-07 12:59:33.4391Z      ━━━━━━━━━━━━━━━━━━━━━━━━━━━━━━━━━━━━━━━━ 1.6/1.6 MB 79.1 MB/s eta 0:00:00
2025-05-07 12:59:33.6061Z Collecting Jinja2==3.1.5
2025-05-07 12:59:33.6627Z   Downloading https://artifactory.tcsbank.ru/artifactory/api/pypi/python-all/packages/packages/jinja2/3.1.5/jinja2-3.1.5-py3-none-any.whl (134 kB)
2025-05-07 12:59:33.6696Z      ━━━━━━━━━━━━━━━━━━━━━━━━━━━━━━━━━━━━━━ 134.6/134.6 kB 52.1 MB/s eta 0:00:00
2025-05-07 12:59:33.8379Z Collecting joblib==1.4.2
2025-05-07 12:59:33.8843Z   Downloading https://artifactory.tcsbank.ru/artifactory/api/pypi/python-all/packages/packages/joblib/1.4.2/joblib-1.4.2-py3-none-any.whl (301 kB)
2025-05-07 12:59:33.8996Z      ━━━━━━━━━━━━━━━━━━━━━━━━━━━━━━━━━━━━━━ 301.8/301.8 kB 27.3 MB/s eta 0:00:00
2025-05-07 12:59:34.2747Z Collecting json5==0.10.0
2025-05-07 12:59:34.3167Z   Downloading https://artifactory.tcsbank.ru/artifactory/api/pypi/python-all/packages/packages/json5/0.10.0/json5-0.10.0-py3-none-any.whl (34 kB)
2025-05-07 12:59:34.4261Z Collecting jsonpointer==3.0.0
2025-05-07 12:59:34.4851Z   Downloading https://artifactory.tcsbank.ru/artifactory/api/pypi/python-all/packages/packages/jsonpointer/3.0.0/jsonpointer-3.0.0-py2.py3-none-any.whl (7.6 kB)
2025-05-07 12:59:34.6920Z Collecting jsonschema==4.23.0
2025-05-07 12:59:34.7271Z   Downloading https://artifactory.tcsbank.ru/artifactory/api/pypi/python-all/packages/packages/jsonschema/4.23.0/jsonschema-4.23.0-py3-none-any.whl (88 kB)
2025-05-07 12:59:34.8125Z      ━━━━━━━━━━━━━━━━━━━━━━━━━━━━━━━━━━━━━━━━ 88.5/88.5 kB 31.5 MB/s eta 0:00:00
2025-05-07 12:59:34.9101Z Collecting jsonschema-specifications==2024.10.1
2025-05-07 12:59:35.0131Z   Downloading https://artifactory.tcsbank.ru/artifactory/api/pypi/python-all/packages/packages/jsonschema-specifications/2024.10.1/jsonschema_specifications-2024.10.1-py3-none-any.whl (18 kB)
2025-05-07 12:59:35.0368Z Collecting jupyter==1.1.1
2025-05-07 12:59:35.0995Z   Downloading https://artifactory.tcsbank.ru/artifactory/api/pypi/python-all/packages/packages/jupyter/1.1.1/jupyter-1.1.1-py2.py3-none-any.whl (2.7 kB)
2025-05-07 12:59:35.2271Z Collecting jupyter-console==6.6.3
2025-05-07 12:59:35.2659Z   Downloading https://artifactory.tcsbank.ru/artifactory/api/pypi/python-all/packages/packages/jupyter-console/6.6.3/jupyter_console-6.6.3-py3-none-any.whl (24 kB)
2025-05-07 12:59:35.4297Z Collecting jupyter-events==0.11.0
2025-05-07 12:59:35.4781Z   Downloading https://artifactory.tcsbank.ru/artifactory/api/pypi/python-all/packages/packages/jupyter-events/0.11.0/jupyter_events-0.11.0-py3-none-any.whl (19 kB)
2025-05-07 12:59:35.5942Z Collecting jupyter-lsp==2.2.5
2025-05-07 12:59:35.6642Z   Downloading https://artifactory.tcsbank.ru/artifactory/api/pypi/python-all/packages/packages/jupyter-lsp/2.2.5/jupyter_lsp-2.2.5-py3-none-any.whl (69 kB)
2025-05-07 12:59:35.6700Z      ━━━━━━━━━━━━━━━━━━━━━━━━━━━━━━━━━━━━━━━━ 69.1/69.1 kB 33.7 MB/s eta 0:00:00
2025-05-07 12:59:36.3387Z Collecting jupyter_client==8.6.3
2025-05-07 12:59:36.3794Z   Downloading https://artifactory.tcsbank.ru/artifactory/api/pypi/python-all/packages/packages/jupyter-client/8.6.3/jupyter_client-8.6.3-py3-none-any.whl (106 kB)
2025-05-07 12:59:36.3870Z      ━━━━━━━━━━━━━━━━━━━━━━━━━━━━━━━━━━━━━━ 106.1/106.1 kB 32.2 MB/s eta 0:00:00
2025-05-07 12:59:36.7403Z Collecting jupyter_core==5.7.2
2025-05-07 12:59:36.7744Z   Downloading https://artifactory.tcsbank.ru/artifactory/api/pypi/python-all/packages/packages/jupyter-core/5.7.2/jupyter_core-5.7.2-py3-none-any.whl (28 kB)
2025-05-07 12:59:37.0670Z Collecting jupyter_server==2.15.0
2025-05-07 12:59:37.1299Z   Downloading https://artifactory.tcsbank.ru/artifactory/api/pypi/python-all/packages/packages/jupyter-server/2.15.0/jupyter_server-2.15.0-py3-none-any.whl (385 kB)
2025-05-07 12:59:37.2161Z      ━━━━━━━━━━━━━━━━━━━━━━━━━━━━━━━━━━━━━━ 385.8/385.8 kB 25.8 MB/s eta 0:00:00
2025-05-07 12:59:37.3075Z Collecting jupyter_server_terminals==0.5.3
2025-05-07 12:59:37.4124Z   Downloading https://artifactory.tcsbank.ru/artifactory/api/pypi/python-all/packages/packages/jupyter-server-terminals/0.5.3/jupyter_server_terminals-0.5.3-py3-none-any.whl (13 kB)
2025-05-07 12:59:38.1166Z Collecting jupyterlab==4.3.4
2025-05-07 12:59:38.1634Z   Downloading https://artifactory.tcsbank.ru/artifactory/api/pypi/python-all/packages/packages/jupyterlab/4.3.4/jupyterlab-4.3.4-py3-none-any.whl (11.7 MB)
2025-05-07 12:59:38.3108Z      ━━━━━━━━━━━━━━━━━━━━━━━━━━━━━━━━━━━━━━━━ 11.7/11.7 MB 90.3 MB/s eta 0:00:00
2025-05-07 12:59:38.5144Z Collecting jupyterlab_pygments==0.3.0
2025-05-07 12:59:38.5520Z   Downloading https://artifactory.tcsbank.ru/artifactory/api/pypi/python-all/packages/packages/jupyterlab-pygments/0.3.0/jupyterlab_pygments-0.3.0-py3-none-any.whl (15 kB)
2025-05-07 12:59:38.8477Z Collecting jupyterlab_server==2.27.3
2025-05-07 12:59:38.8982Z   Downloading https://artifactory.tcsbank.ru/artifactory/api/pypi/python-all/packages/packages/jupyterlab-server/2.27.3/jupyterlab_server-2.27.3-py3-none-any.whl (59 kB)
2025-05-07 12:59:38.9047Z      ━━━━━━━━━━━━━━━━━━━━━━━━━━━━━━━━━━━━━━━━ 59.7/59.7 kB 21.0 MB/s eta 0:00:00
2025-05-07 12:59:39.0789Z Collecting jupyterlab_widgets==3.0.13
2025-05-07 12:59:39.1518Z   Downloading https://artifactory.tcsbank.ru/artifactory/api/pypi/python-all/packages/packages/jupyterlab-widgets/3.0.13/jupyterlab_widgets-3.0.13-py3-none-any.whl (214 kB)
2025-05-07 12:59:39.2136Z      ━━━━━━━━━━━━━━━━━━━━━━━━━━━━━━━━━━━━━━ 214.4/214.4 kB 66.6 MB/s eta 0:00:00
2025-05-07 12:59:39.7171Z Collecting kiwisolver==1.4.7
2025-05-07 12:59:39.7553Z   Downloading https://artifactory.tcsbank.ru/artifactory/api/pypi/python-all/packages/packages/kiwisolver/1.4.7/kiwisolver-1.4.7-cp39-cp39-manylinux_2_12_x86_64.manylinux2010_x86_64.whl (1.6 MB)
2025-05-07 12:59:39.7826Z      ━━━━━━━━━━━━━━━━━━━━━━━━━━━━━━━━━━━━━━━━ 1.6/1.6 MB 69.0 MB/s eta 0:00:00
2025-05-07 12:59:41.7304Z Collecting lxml==5.3.2
2025-05-07 12:59:41.8000Z   Downloading https://artifactory.tcsbank.ru/artifactory/api/pypi/python-all/packages/packages/lxml/5.3.2/lxml-5.3.2-cp39-cp39-manylinux_2_28_x86_64.whl (5.2 MB)
2025-05-07 12:59:41.8896Z      ━━━━━━━━━━━━━━━━━━━━━━━━━━━━━━━━━━━━━━━━ 5.2/5.2 MB 64.0 MB/s eta 0:00:00
2025-05-07 12:59:42.0914Z Collecting Mako==1.3.8
2025-05-07 12:59:42.1269Z   Downloading https://artifactory.tcsbank.ru/artifactory/api/pypi/python-all/packages/packages/mako/1.3.8/Mako-1.3.8-py3-none-any.whl (78 kB)
2025-05-07 12:59:42.1374Z      ━━━━━━━━━━━━━━━━━━━━━━━━━━━━━━━━━━━━━━━━ 78.6/78.6 kB 10.6 MB/s eta 0:00:00
2025-05-07 12:59:42.7194Z Collecting MarkupSafe==3.0.2
2025-05-07 12:59:42.7563Z   Downloading https://artifactory.tcsbank.ru/artifactory/api/pypi/python-all/packages/packages/markupsafe/3.0.2/MarkupSafe-3.0.2-cp39-cp39-manylinux_2_17_x86_64.manylinux2014_x86_64.whl (20 kB)
2025-05-07 12:59:44.1215Z Collecting matplotlib==3.9.4
2025-05-07 12:59:44.1574Z   Downloading https://artifactory.tcsbank.ru/artifactory/api/pypi/python-all/packages/packages/matplotlib/3.9.4/matplotlib-3.9.4-cp39-cp39-manylinux_2_17_x86_64.manylinux2014_x86_64.whl (8.3 MB)
2025-05-07 12:59:44.2687Z      ━━━━━━━━━━━━━━━━━━━━━━━━━━━━━━━━━━━━━━━━ 8.3/8.3 MB 77.6 MB/s eta 0:00:00
2025-05-07 12:59:44.3977Z Collecting matplotlib-inline==0.1.7
2025-05-07 12:59:44.4461Z   Downloading https://artifactory.tcsbank.ru/artifactory/api/pypi/python-all/packages/packages/matplotlib-inline/0.1.7/matplotlib_inline-0.1.7-py3-none-any.whl (9.9 kB)
2025-05-07 12:59:44.5968Z Collecting mistune==3.1.0
2025-05-07 12:59:44.6701Z   Downloading https://artifactory.tcsbank.ru/artifactory/api/pypi/python-all/packages/packages/mistune/3.1.0/mistune-3.1.0-py3-none-any.whl (53 kB)
2025-05-07 12:59:44.7154Z      ━━━━━━━━━━━━━━━━━━━━━━━━━━━━━━━━━━━━━━━━ 53.7/53.7 kB 25.9 MB/s eta 0:00:00
2025-05-07 12:59:45.2362Z Collecting moviepy==2.1.2
2025-05-07 12:59:45.2791Z   Downloading https://artifactory.tcsbank.ru/artifactory/api/pypi/python-all/packages/packages/moviepy/2.1.2/moviepy-2.1.2-py3-none-any.whl (126 kB)
2025-05-07 12:59:45.2860Z      ━━━━━━━━━━━━━━━━━━━━━━━━━━━━━━━━━━━━━━ 126.7/126.7 kB 50.7 MB/s eta 0:00:00
2025-05-07 12:59:45.4509Z Collecting mpmath==1.3.0
2025-05-07 12:59:45.4876Z   Downloading https://artifactory.tcsbank.ru/artifactory/api/pypi/python-all/packages/packages/mpmath/1.3.0